,title,score,selftext,created_utc,num_comments
0,Joe Biden elected president of the United States,365122,,1604766517.0,28783
1,"Chauvin found guilty of murder, manslaughter in George Floyd's death",250273,,1618952864.0,28077
2,President Donald Trump says he has tested positive for coronavirus,233317,,1601615057.0,33765
3,Blizzard Employees Staged a Walkout After the Company Banned a Gamer for Pro-Hong Kong Views,226334,,1570653917.0,9529
4,Trump has left the White House for the last time as President,222631,,1611148604.0,11806
5,Kobe Bryant killed in helicopter crash in California,213677,,1580067478.0,20383
6,'Jeopardy' host Alex Trebek dies at 80 due to pancreatic cancer,200814,,1604856593.0,5408
7,Scientist Stephen Hawking has died aged 76,188172,,1520999128.0,6879
8,"Jeffrey Epstein's autopsy more consistent with homicidal strangulation than suicide, Dr. Michael Baden reveals",186239,,1572436047.0,9956
9,F.C.C. Announces Plan to Repeal Net Neutrality,177995,,1511283393.0,10806
10,"Joe Biden officially sworn in as the 46th President of the United States, Kamala Harris as the 49th Vice-President",176880,,1611161640.0,9095
11,Donald Trump impeached for ‘inciting’ US Capitol riot,175641,,1610573130.0,13138
12,Supreme Court rules workers can't be fired for being gay or transgender,171115,,1592230047.0,10478
13,Twitter permanently suspends Trump’s account,171080,,1610148532.0,13797
14,"Jeffrey Epstein, accused sex trafficker, dies by suicide: Officials",170191,,1565442055.0,32488
15,"Ghislane Maxwell, long-time friend and confidante of Jeffrey Epstein, has been arrested by the FBI and charged by federal prosecutors",165208,,1593696173.0,12885
16,"In a new court hearing, Britney Spears' father loses bid to retain complete control of his daughter's financial investments",161560,,1613088314.0,5202
17,Derek Chauvin sentenced to 22.5 years in prison for murder of George Floyd,157488,,1624650949.0,17896
18,Report: Stan Lee dead at 95 - Story,155794,,1542048484.0,6312
19,Arizona Senator John McCain has passed away at the age of 81,154798,,1535242878.0,11455
20,President Trump has been impeached,154265,,1576720262.0,17141
21,"Justice Ruth Bader Ginsburg, Champion Of Gender Equality, Dies At 87",154082,,1600472108.0,25291
22,Online influencer Jake Paul charged after Scottsdale looting,152237,,1591286250.0,6670
23,"Apple admits it slows older iPhones, confirming Geekbench report",149909,,1513807153.0,13034
24,"NY Times: Trump paid $750 in US income taxes in 2016, 2017",149749,,1601243871.0,14417
25,Net Neutrality Overturned,147344,,1513275208.0,18181
26,Dr. Fauci Named Federal Employee of the Year,146889,,1602354895.0,2777
27,Congress has certified the 270 Electoral College votes needed to confirm Joe Biden's presidential election win.,144177,,1610008976.0,7697
28,FCC Chairman Ajit Pai will step down on January 20,141345,,1606751912.0,4573
29,"GBI arrests father, son for murder of Ahmaud Arbery",141044,,1588897079.0,15329
30,"Melvin Capital, hedge fund that bet against GameStop, lost more than 50% in January",140606,,1612129289.0,5956
31,Wife of officer charged with murder of George Floyd announces she's divorcing him,140272,,1590813268.0,9850
32,Family of 11-year-old boy who died in Texas deep freeze files $100 million suit against power companies,137990,,1613942932.0,8870
33,"Judge permanently dismisses charges against Kenneth Walker, boyfriend of Breonna Taylor",137804,,1615232836.0,5824
34,Leader of North Carolina lockdown Protest group tests positive for COVID-19,136607,,1588007571.0,6063
35,"Kanye West removed from Illinois Presidential ballot after nearly 2,000 invalid signatures discovered",133974,,1596907298.0,6022
36,Losses on short positions in U.S. firms top $70 billion,133379,,1611861716.0,8203
37,Trump campaign loses lawsuit seeking to halt Michigan vote count,131222,,1604604999.0,5622
38,Portland sees peaceful night of protests following withdrawal of federal troops,129846,,1596198318.0,8277
39,Former President George H.W. Bush Dies at 94,129148,,1543640083.0,9534
40,"Illinois’ Top Legal Officer Wants To License Cops, Just Like Doctors, Hairdressers",128932,,1591413210.0,3487
41,"North Carolina man arrested after he’s discovered with guns, explosives in plot to assassinate Joe Biden",128374,,1603399360.0,7759
42,"Underage girl forced to have sex with Prince Andrew, US court document claims",127179,,1596214587.0,6814
43,Japanese firm gives non-smokers extra six days holiday to compensate for cigarette break,126707,,1509448837.0,4892
44,Entire staffs at 3 Sonic locations quit after wages cut to $4/hour plus tips,124877,,1551477140.0,10705
45,#DeleteFacebook Movement Gains Steam After 50 Million Users Have Data Leaked,124448,,1521507725.0,6769
46,Chester Bennington of Linkin Park commits suicide,123965,,1500574463.0,15679
47,Biden revokes presidential permit for Keystone XL pipeline expansion on 1st day,123741,,1611184040.0,6882
48,Fox News publishes digitally altered and misleading images of Seattle demonstrations,123149,,1592072157.0,5392
49,Ghislaine Maxwell Charged With Sex Trafficking of 14-Year-Old Girl,123004,,1617052539.0,4606
50,Harvey Weinstein sentenced to 23 years in prison for sex assault in case that sparked 'MeToo' movement,122063,,1583939101.0,6032
51,"Colorado governor signs police accountability bill, ending qualified immunity defense in the state",121988,,1592608798.0,4108
52,Man dies in Arizona after being restrained by police on hot tarmac for six minutes,121846,,1598014921.0,14405
53,U.S. President Donald Trump fired the federal government's top lawyer Sally Yates on Monday after she took the extraordinarily rare step of defying the White House and refused to defend new travel restrictions targeting seven Muslim-majority nations.,121534,,1485833138.0,16418
54,New Virginia law capping insulin prices at $50 a month goes into effect Friday,121227,,1609451073.0,2777
55,Gay men have taken over the Proud Boys Twitter hashtag,120501,,1601840940.0,4690
56,Police shoot 13-year-old boy with autism several times after mother calls for help,120280,,1599584433.0,12945
57,Airspace now restricted over Biden’s home,120217,,1604674175.0,6459
58,Blizzard pulls Blitzchung from Hearthstone tournament over support for Hong Kong protests,119967,,1570540313.0,7486
59,"Black woman shot and killed after Kentucky police entered her home as she slept, family says",119855,,1589326449.0,9903
60,Supreme Court rules New York prosecutor can get Trump's tax returns,119852,,1594304179.0,6803
61,Judge orders U.S. Postal Service to treat all election mail as 1st class or priority | CBC News,119481,,1600721017.0,2742
62,Marine Corps Bans Public Display of Confederate Flag,119482,,1587766828.0,6736
63,Some U.S. Capitol rioters fired after internet detectives identify them,119454,,1610069503.0,7814
64,Donald Trump calls for delay to 2020 US presidential election,119229,,1596114890.0,15327
65,"U.S. Supreme Court lets Flint, Michigan residents sue over water contamination",119147,,1579620808.0,2587
66,"Fired Wilmington cop: “We are just going to go out and start slaughtering them f—— ni—–. I can’t wait. God, I can’t wait.”",118548,,1593035134.0,7653
67,Italy bans unvaccinated children from school,118493,,1552387651.0,3041
68,'Black Panther' actor Chadwick Boseman dies at 43 after 4-year fight with colon cancer,118441,,1598666936.0,4150
69,Arresting officer in George Floyd case taken into custody by BCA,117869,,1590772614.0,10890
70,Assaulting a worker who's enforcing masks is now a felony under a new Illinois law,117456,,1597068846.0,4105
71,Dr. Fauci says his daughters need security as family continues to get death threats,116878,,1596651676.0,7062
72,Comcast quietly drops promise not to charge tolls for Internet fast lanes,116782,,1511804314.0,3474
73,Hospitals will have to post prices online starting January 1,116624,,1545884147.0,7054
74,"Grant Imahara, 'Mythbusters' co-host, dead at 49",116527,,1594703652.0,3119
75,Bill Cosby found guilty on all sex assault charges,116516,,1524765069.0,8862
76,"Mars, Nestlé and Hershey to face landmark child slavery lawsuit in US",116264,,1613170137.0,2822
77,Rush Limbaugh dead at 70,115741,,1613581957.0,436
78,"President-elect Joe Biden clears 270-vote threshold in Electoral College count, formalizing his victory",115228,,1607985257.0,6292
79,Texas Roadhouse CEO forgoes salary and bonus to pay front-line restaurant employees,115117,,1585255663.0,3134
80,Landlord changes locks on California church after pastor said he'd continue to hold services,114963,,1586261949.0,4506
81,"Reddit, Acting Against Hate Speech, Bans ‘The_Donald’ Subreddit",114813,,1593451535.0,15306
82,Woman Is Fired After Calling Police on Black Man in Central Park,114804,,1590520135.0,14733
83,Donald Trump Jr. tests positive for COVID-19,114563,,1605914197.0,2246
84,Officer accused of pushing teen during protest has 71 use of force cases on file,114227,,1591203901.0,3706
85,France bans unvaccinated American travelers,114222,,1631277014.0,6509
86,GRAPHIC VIDEO: Buffalo police officers violently shove man onto ground,113320,,1591323187.0,9086
87,Britney Spears’ father agrees to step down as conservator,112887,,1628803714.0,3342
88,Drought-hit California orders Nestlé to stop pumping millions of gallons of water,112350,,1619531888.0,5061
89,"'I can't breathe,' Oklahoma man tells police before dying. 'I don't care,' officer responds.",112072,,1591837227.0,7461
90,82-year-old Houston-area man left without heart medicine for a week due to USPS delays,112053,,1597674369.0,5496
91,"Amazon blocks sale of merchandise with ""stand back"" and ""stand by""",112002,,1601557423.0,10705
92,Britney Spears tells LA court she wants her father charged with conservatorship abuse,111988,,1626302958.0,3869
93,"Judge rules to unseal documents in 2015 case against Ghislaine Maxwell, Jeffrey Epstein's alleged accomplice",111807,,1595522275.0,4296
94,"Nearly 200,000 people have signed a petition to have Logan Paul kicked off YouTube after controversy over his filming of a dead body in Japan's 'Suicide Forest'",111611,,1515183131.0,7825
95,Parler CEO Says Service Dropped By “Every Vendor” Could End Business,111594,,1610309248.0,15650
96,Japanese police want to question Logan Paul,110658,,1515280263.0,9587
97,James Comey terminated as Director of FBI,110062,,1494366560.0,22994
98,52% of young adults in the US are living with their parents. That's the highest share since the Great Depression,109892,,1599275018.0,10014
99,Police warn they may use live ammo on protesters in Hong Kong,109621,,1574009709.0,6984
100,Alex Kearns died thinking he owed hundreds of thousands for stock market losses on Robinhood. His parents are set to sue over his suicide.,109371,,1612791812.0,8662
101,Norm Macdonald Dies: Influential Comedian And Former ‘SNL’ Weekend Update Anchor Was 61,109153,,1631643787.0,6995
102,Reddit bans active COVID misinformation subreddit NoNewNormal,109003,,1630522790.0,9959
103,FBI arrests Nashville zip-tie suspect from assault on U.S. Capitol,108722,,1610315084.0,5172
104,Bernie Sanders drops out of the presidential race,108711,,1586359482.0,29469
105,"American Icon and Playboy Founder, Hugh M. Hefner, Has Died",108352,,1506568044.0,6912
106,"Britney Spears’ father removed as her conservator, judge rules",108241,,1632954092.0,3219
107,"Capitol rioter known as ""QAnon Shaman"" will be jailed until trial",108218,,1610803309.0,7097
108,"The teacher who disarmed, then hugged a student will receive the citizen Congressional Medal of Honor",108183,,1585661906.0,2209
109,'Pharma bro' Martin Shkreli sentenced to 7 years in prison,108121,,1520621850.0,8654
110,All former officers involved in George Floyd's death are now in custody,107916,,1591225108.0,5320
111,"Thailand cave rescue: All 12 boys, coach freed, latest updates",107843,,1531223098.0,4075
112,"Fauci says ""serious threats"" have been made against him and his wife and daughters",107659,,1595613258.0,7066
113,Supreme Court legalizes gay marriage,107603,,1435327368.0,16600
114,"Thousands of Seattle students told to get vaccinated, or don’t come back after winter break",107571,,1577554974.0,6032
115,Kim Jong Un Allegedly in a 'vegetative state' after heart surgery - Japanese Media,107310,,1587814465.0,4629
116,"Pet Store Bill Passes California Senate 38 to 0. It bans the sale of dogs, cats and rabbits sourced from high-volume, commercial breeding facilities, known as mills, in all pet shops throughout the state.",107244,,1505323565.0,3904
117,Capitol rioter charged with threatening to 'assassinate' Rep. Ocasio-Cortez,106851,,1611428056.0,4812
118,Prosecutors weigh ‘heavy hammer’ — felony murder — for rioters in Capitol officer’s death,106545,,1610368662.0,8344
119,"Woman billed $700 after sitting in ER waiting room for 7 hours, leaving without treatment",106155,,1635772393.0,10205
120,Arrest warrant issued for Tampa megachurch pastor who led packed services despite safer-at-home orders,106108,,1585590349.0,4220
121,George Floyd's family says four officers involved in his death should be charged with murder,105869,,1590572524.0,6764
122,"Families of Sandy Hook shooting victims win legal victory in lawsuit against InfoWars, Alex Jones",105782,,1547237808.0,3527
123,Recount in Wisconsin county demanded by Trump increases Biden's margin,105240,,1606532781.0,3559
124,Judge denies bail for Ghislaine Maxwell after she pleads not guilty in Jefferey Epstein sex crimes case,104989,,1594754185.0,4515
125,Breonna Taylor evidence photos contradict LMPD's 'no body cam' claim,104943,,1599612779.0,5285
126,"Days after photos of packed hallways go viral, Paulding County High School in Georgia reports 9 COVID-19 cases",104818,,1596935448.0,5613
127,"NYPD officers can no longer search a vehicle due to the smell of marijuana alone, new memo says",104219,,1617544538.0,3545
128,"Trump ousts Homeland Security cyber chief Chris Krebs, who called election secure",104191,,1605658852.0,6298
129,"Minneapolis police officers must keep body cameras turned on during entire response to a call, new policy says",103920,,1612269755.0,3462
130,Black armed protesters march in Kentucky demanding justice for Breonna Taylor,103392,,1595770079.0,13232
131,R. Kelly Has Been Found Guilty Of Federal Crimes After 11 Sexual Abuse Victims Testified Against Him,103226,,1632770534.0,4561
132,"Bond denied for father, son charged with murder in Ahmaud Arbery case",103118,,1588966919.0,8077
133,Twenty-Two Attorneys General Sue The FCC Over Net Neutrality Repeal,102969,,1516157233.0,4074
134,Magic Mushrooms Are Decriminalized in DC as of Today,102626,,1615836267.0,2913
135,CNN banned from White House press briefing,102358,,1487965888.0,18323
136,Commonwealth’s Attorney: Man who drove through group of protesters is leader of KKK,102159,,1591636722.0,4847
137,Kanye West's Yeezy got millions in federal small business loans,102156,,1594068518.0,6261
138,GSA tells Biden that transition can formally begin,101851,,1606173063.0,5502
139,Hospitals Sued to Keep Prices Secret. They Lost.,101803,,1593005772.0,4507
140,Boy who suffered up to 100 seizures a day has none in 300 days after being prescribed cannabis oil,101673,,1504810067.0,4427
141,"Texas judge interrupts jury, says God told him defendant is not guilty",101597,,1516389174.0,7395
142,"Robinhood appears to halt support on Reddit-driven GameStop, AMC stocks",101542,,1611842194.0,7739
143,Vermont has officially legalized cannabis,101388,,1516649066.0,4185
144,Apple fined for slowing down old iphones.,101136,,1581101330.0,4550
145,"Man dies after police kneel on his neck for nearly 5 minutes, family says in wrongful death claim",101007,,1614141810.0,8292
146,YouTube star Daddyofive loses custody of two children featured in 'prank' video.,100910,,1493730089.0,11507
147,Costco lifts minimum wage above Amazon or Target to $16 per hour,100276,,1614273068.0,3857
148,Family sues after 26-year-old EMT is shot and killed by police in her own home,100253,,1589544704.0,6971
149,U.S. court: Mass surveillance program exposed by Snowden was illegal,100091,,1599100401.0,3596
150,Washington state governor OKs bill banning for-profit jails,99832,,1618513378.0,2146
151,New York Gov. Cuomo signs executive order that allows store owners the right to ban any customer that enters without wearing a mask.,99622,,1590681810.0,4444
152,A man who carried a Confederate flag into the Capitol has been arrested.,99278,,1610644445.0,4027
153,Carrie Fisher Dies at 60,99278,,1482861146.0,7885
154,Vermont Senate legalizes recreational pot,99276,,1515681822.0,6200
155,"75-year-old protester pushed by Buffalo police files lawsuit against city, mayor and officers",99091,,1614042616.0,3021
156,New probe confirms Trump officials blocked Puerto Rico from receiving hurricane aid,99078,,1619127571.0,4693
157,Trump tax returns are now in the hands of the Manhattan district attorney,99014,,1614263934.0,5993
158,Post-election audits find no fraud in Arizona,99006,,1605219956.0,4573
159,CNN sues President Trump and White House for banning reporter Jim Acosta,98336,,1542119149.0,12316
160,"Texan files $1 billion class-action lawsuit after receiving $9,000 electric bill",98165,,1614303011.0,6973
161,Facebook will block Trump from posting for the remainder of his term,98169,,1610035118.0,4168
162,Alex Jones arrested for DWI in Travis County,98155,,1583866531.0,5379
163,Admitted KKK leader who drove through crowd of protesters found guilty on multiple charges,97987,,1597090302.0,3467
164,"Bob Murray, Who Fought Against Black Lung Regulations As A Coal Operator, Has Filed For Black Lung Benefits",97960,,1601510776.0,3321
165,Kamala Harris makes history as first woman of color elected US vice-president,97809,,1604768094.0,5511
166,Former Buffalo officer who stopped fellow cop's chokehold on suspect will get pension after winning lawsuit,97611,,1618393500.0,2149
167,Belgium declares loot boxes gambling and therefore illegal,97518,,1524681250.0,5899
168,"Infowars host Alex Jones is responsible for damages triggered by his false claims on the Sandy Hook shooting, judge rules",97415,,1633082441.0,5521
169,Ohio mayor calls for 'immediate termination' of officer who shot and killed a Black man 'who had committed no crime',97111,,1608814171.0,4773
170,Bloomberg drops out of 2020 presidential race after poor Super Tuesday showing,97104,,1583334809.0,7781
171,"Thirteen Russians criminally charged for interfering in US election, Mueller announces",97048,,1518805101.0,13116
172,USA now vaccinating more people against COVID-19 in one day than Canada has in total,97025,,1613919978.0,8434
173,"Burger King workers write ‘we all quit’ on sign, walk out of Nebraska restaurant",96887,,1626119605.0,11617
174,Black Army Medic Pepper-Sprayed in Traffic Stop Accuses Officers of Assault,96620,,1618089453.0,8663
175,"""Nobody Died at Sandy Hook"" author must pay victim's dad $450,000, jury says",96467,,1571236336.0,6369
176,Black gun owners plan pro-Second Amendment walk,96132,,1592578195.0,13754
177,Black homeowner had a white friend stand in for third appraisal. Her home value doubled.,96020,,1621009749.0,7587
178,Virginia's governor signs legislation banning no-knock warrants,95939,,1603916671.0,2331
179,Agents raid home of fired Florida data scientist who built COVID-19 dashboard,95766,,1607381578.0,4834
180,Student suspended after showing fellow students without masks,95650,,1596721415.0,6639
181,Actor Danny Trejo saves a trapped baby from an overturned car,95562,,1565229767.0,2253
182,Thousands of Amazon workers demand time off to vote,95563,,1602623582.0,3170
183,The Museum of London Has Acquired That Giant 'Trump Baby' Balloon for Its Collection of Protest Art,95446,,1610974347.0,1707
184,AntiVirus Creator John McAfee Found Dead In Catalan Prison Cell,95273,,1624476235.0,8575
185,Report: Sen. Graham pressured Ga. secretary of state to throw out legally cast ballots,95274,,1605580393.0,4349
186,Calling 911 with a false claim because of race can now put you in prison for years in N.J.,95015,,1598986651.0,3725
187,Measles returned to Costa Rica after five years by French family who had not had vaccinations,94964,,1551026335.0,3449
188,Federal judge rules women can get abortion pill without doctor visits,94947,,1594680580.0,4189
189,"Los Angeles Mayor Eric Garcetti, City Officials Cutting $100-$150 Million From LAPD Budget, Funds To Be Reinvested In Communities Of Color",94773,,1591234965.0,4223
190,US makes official return to Paris climate agreement,94729,,1613734856.0,4910
191,Kentucky Sen. Rand Paul tests positive for coronavirus,94707,,1584899528.0,7079
192,Poland stalls abortion ban amid nationwide protests,94568,,1604413924.0,2433
193,Texas real estate agent who took private jet to D.C. charged in Capitol riot,94485,,1610745622.0,3051
194,"FDA grants full approval to Pfizer-BioNTech’s Covid shot, clearing path to more vaccine mandates",94473,,1629726183.0,10913
195,Mask order issued for entire state of Texas,94403,,1593721811.0,5656
196,Buffalo police officers arrested after shoving 75-year-old protester,94390,,1591455173.0,4880
197,Target joins Walmart in staying closed for Thanksgiving this year,94262,,1595856567.0,2548
198,NFL offers Biden all 32 football stadiums as mass Covid vaccination sites,94173,,1612560619.0,2227
199,Larry Nassar sentenced to 175 years in prison in sexual abuse case,94162,,1516815633.0,6964
200,Billionaire David Koch dies at age 79,94025,,1566563751.0,17229
201,Wuhan residents remember coronavirus 'whistleblower' doctor a year after his death,93958,,1612615199.0,2612
202,National veterans groups plan to purge members found guilty in Capitol attack,93788,,1610388299.0,2348
203,Mississippi Votes to End Jim Crow Electoral College-Like System; Popular Vote to Choose Governor,93739,,1604512222.0,2253
204,"Giuliani has tested positive for coronavirus, Trump says",93723,,1607286583.0,2435
205,Woman who lied about being raped on college campus gets jail,93653,,1529431720.0,5860
206,"Ronna McDaniel, chairwoman of the R.N.C., tests positive for the coronavirus.",93587,,1601646540.0,5697
207,Steve Bannon indicted in scheme to defraud donors to campaign pledging to build border wall,93434,,1597932529.0,6095
208,Christian Cooper is asking people to stop making death threats against the woman who called the cops on him,93270,,1590592407.0,8035
209,Delta adds 460 passengers who refused masks to 'no-fly' list,93001,,1603483719.0,3102
210,"Human penises are shrinking because of pollution, warns scientist",92918,,1616588297.0,7718
211,"Elderly couple found dead in apparent murder-suicide, left notes about high medical bills",92914,,1565355669.0,11532
212,"Kentucky lawmaker who proposed ""Breonna's Law"" to end no-knock warrants statewide arrested at Louisville protest",92740,,1601047323.0,5998
213,Facebook will stop recommending political groups permanently,92535,,1611786900.0,2544
214,Pelosi announces formal impeachment inquiry,92431,,1569359122.0,9521
215,Recreational marijuana becomes legal in Illinois on New Years Day,92262,,1577194330.0,4503
216,Trump revealed highly classified information to Russian foreign minister and ambassador,92233,,1494883179.0,13518
217,"Protesters trample, burn LeBron James jerseys in Hong Kong",92213,,1571168942.0,4277
218,"Video shows Minneapolis cop with knee on neck of motionless, moaning man who later died",92179,,1590492001.0,2212
219,Comcast fired 500 despite claiming tax cut would create thousands of jobs,92108,,1515103967.0,3742
220,"CBC.ca: Jeffrey Epstein prison guards admit to falsifying records, make deal to avoid jail time",91963,,1621644110.0,4327
221,"A suspected big cat poacher has been eaten by lions near the Kruger National Park in South Africa, police say",91823,,1518450645.0,4417
222,Chris Brown detained on suspicion of rape,91772,,1548155887.0,7821
223,NASCAR bans Confederate flag from its races and properties,91687,,1591824549.0,6381
224,"Man with mental illness spent nearly 5 months in jail before body cam video revealed Garfield Heights officers beat, tased and mocked him",91614,,1592321580.0,2801
225,"Sacha Baron Cohen Crashes Right Wing Event, Leads Absurd Sing-Along",91545,,1593364360.0,4775
226,Comcast deleted net neutrality pledge the same day FCC announced repeal,91484,,1511982740.0,2701
227,"Jeff Bezos to step down as Amazon CEO, Andy Jassy to take over in Q3",91462,,1612300019.0,5586
228,Senate approves bill to extend 9/11 victims fund,91463,,1563911967.0,3736
229,Amazon workers stage strike on Black Friday,91383,,1575036902.0,5113
230,Woman who coughed on $35K worth of grocery store food charged with four felonies,91166,,1585354841.0,2718
231,"Nestlé cannot claim bottled water is ‘essential public service’, court rules",91153,,1575545583.0,3101
232,Prison whistleblower who exposed unsafe conditions in Arizona facility found dead,91101,,1584015582.0,2854
233,"Twitter has suspended 70,000 QAnon accounts since U.S. Capitol riot",91012,,1610419900.0,4500
234,Campaign to 'thank' Xi Jinping flatly rejected by Wuhan citizens,91001,,1584187493.0,3466
235,Twitter Suspends Marjorie Taylor Greene for Posting Coronavirus Misinformation,90986,,1626744407.0,8046
236,Hate crime charges filed against 4 in torture of teen,90943,,1483641716.0,20499
237,Nestle illegally fires worker for reporting racist comment,90890,,1608061453.0,2905
238,Jeffrey Epstein Death: 2 Guards Slept Through Checks and Falsified Records,90846,,1565870658.0,7690
239,Exclusive: Georgia doctor who forcibly sterilized detained women has been identified,90811,,1600205357.0,5666
240,Rhino poacher trampled to death by elephant; remains eaten by lions,90800,,1554592276.0,3250
241,"Louisville Metro Council Agrees To Ban No-Knock Raids. Breonna Taylor was killed nearly three months ago during a no-knock raid. All 26 members of the Metro Council have signed on as co-sponsors to “Breonna’s Law,” which would ban them.",90657,,1591910713.0,1718
