,title,score,selftext,created_utc,num_comments
444,Megathread: Pro-Trump protesters storm US Capitol during certification of Electoral College votes,78731,"**Part 2** - https://www.reddit.com/r/news/comments/krzopk/megathread_part_2_trump_supporters_storm_us

**Updates**

*All timestamps are Eastern Time in US/Canada*

~6:00pm

- DC curfew is now legally in effect.

~5:35pm

- Police seem to be successfully moving mob away from Capitol, per CNN footage

~5:15pm

- [@shomaristone (NBC DC):](https://twitter.com/shomaristone/status/1346941715895250949?s=19) ""Mob of Trump supporters swarm the media near the US Capitol. They yell what Trump frequently says, “the media is the enemy of the people.” They destroy equipment and chased out reporters. I’ve never seen anything like this in my 20 year career."" (video)

- Rep. Scalise (R-LA) tells Fox News he believes vote certification will resume tonight.

- Fox News says things are ""winding down"", that the Secret Service and FBI have arrived to help, and that the ATF is searching the Capitol for remaining ""protesters"".

~5:00pm

- ""Congressional leaders are being evacuated from the Capitol complex and will be taken to Fort McNair, according to a federal law enforcement official. McNair is a nearby Army base in Washington, DC. The evacuation is still underway, the source said."" [Per CNN:](https://edition.cnn.com/politics/live-news/congress-electoral-college-vote-count-2021/index.html)

- Riot police have arrived at US Capitol complex, per CNN and footage. Have been able to move mob away from building peacefully so far.

~4:50pm

- CNN reports the crowd is thinning somewhat. DC curphew goes into effect at 6PM.

~4:30pm:

- ""Suspected pipe bomb found and rendered safe at the U.S. Capitol"" per CNN via [@BNONews](https://twitter.com/BNONews/status/1346932055859453953?s=19)

~4:20pm:

- Trump: ""It's time to go home"" (in statement that also perpetuates lies about the election being stolen).

~4:05pm:

- Three bombs, apparently: https://twitter.com/EmmaVigeland/status/1346925827800367106

- [NYT: An explosive device is found at the R.N.C., and the D.N.C. is evacuated.](https://www.nytimes.com/2021/01/06/us/politics/an-explosive-device-is-found-at-the-rnc-and-the-dnc-is-evacuated.html)

- [@roddreher:](https://twitter.com/roddreher/status/1346925426539565058) ABC reporting that even people normally in Trump's inner circle can't get through to him. They're worried. Reporting that Trump cabinet officials may resign out of disgust. [@AnaCabrera:](https://twitter.com/AnaCabrera/status/1346925936197984260) White House adviser tells @Acosta some aides around Trump are furious the president won't do more... but ""he doesn't want to”

- President-Elect Biden addresses the nation on mob violence in the capitol: https://twitter.com/Transition46/status/1346926053462319114

- Calls on President Trump to go on TV now and ""demand an end to this siege"".

~4:00pm:

- Security has cleared inside of rotunda and ""starting to get our arms around it"" but ""not under control yet"" per CNN

~3:50pm:

- Multiple officers wounded with at least one transported to hospital; officers are ""overwhelmed"", per CNN

- Entire DC National Guard has been activated, per CNN

- ""Pro-Trump Protester"" breached speaker Nancy Pelosi's office, per CNN

- ""The vice-president has asked Trump supporters to leave the Capitol and stop the violence"" per BBC. Pence: ""This attack on our Capitol will not be tolerated and those involved will be prosecuted to the fullest extent of the law.""

~3:30pm:

- [@GovernorVA:](https://twitter.com/GovernorVA/status/1346916716614451207) Per the Mayor's request, I am sending members of the Virginia National Guard along with 200 Virginia State Troopers.

~3:25pm:

- Speaker Nancy Pelosi has requested National Guard assistance, per ABC

- Woman in critical condition for gunshot wounds after being shot on Capitol grounds, per CNN (uncertain if related to below update) | [@dcexaminer: WARNING. GRAPHIC FOOTAGE: A woman was shot in the neck in the Capitol building.](https://twitter.com/dcexaminer/status/1346917459710726149)

- Armed standoff at door of House floor, per CNN 

- Windows have been smashed and protesters have breached rotunda of Capitol, per various sources

~2:55pm:

- [@tackettdc AP:](https://twitter.com/tackettdc/status/1346909032435613696) Members of Congress inside House chamber told by police to put on gas masks after tear gas dispersed in Capitol Rotunda.

- [@byaaroncdavis WaPo:](https://twitter.com/byaaroncdavis/status/1346908166030766080) A source tells me The Defense Department has just denied a request by DC officials to deploy the National Guard to the US Capitol.

**Live Update Links**

[CNN](https://edition.cnn.com/politics/live-news/congress-electoral-college-vote-count-2021/index.html)

[Wikipedia Article](https://en.wikipedia.org/wiki/2021_United_States_Capitol_protests)

[(ABC / AP) Shots reportedly fired in US Capitol as lawmakers evacuate, pro-Trump protesters swarm (text + video)](https://abc7news.com/washington-dc-rally-donald-trump-protest-2020-election-results-save-america/9405310/)

[(USA Today) Pence evacuated, Capitol locked down as protesters push through fence, breach building](https://www.usatoday.com/story/news/nation/2021/01/06/dc-protests-live-updates-trump-supporters-electoral-college-proud-boys/4126018001/)

[(NPR) U.S. Capitol Locked Down As Far-Right Protesters Enter The Building](https://www.npr.org/sections/congress-electoral-college-tally-live-updates/2021/01/06/954028436/u-s-capitol-locked-down-amid-escalating-far-right-protests)

[(BBC) Live: Protesters storm US Capital and halt election debate](https://www.bbc.com/news/live/election-us-2020-55558355)

[(AP) The Latest: DC mayor orders 6 pm curfew after Capitol breach](https://apnews.com/article/ap-electoral-college-congress-7af85d3c702e070464d7713c42cf254a)

**Photo Galleries**

[Politico](https://www.politico.com/news/2021/01/06/electoral-college-certification-halted-amid-massive-pro-trump-demonstration-455495)

[(FOX 5 DC) PHOTOS: Pro-Trump protesters storm Capitol in DC](https://www.fox5dc.com/news/photos-pro-trump-protesters-storm-capitol-in-dc)

**Video Streams**

[C-SPAN](https://www.c-span.org/video/?507663-1/joint-session-congress-counting-electoral-college-ballots)

[C-SPAN YouTube](https://www.youtube.com/watch?v=KzWS7gJX5Z8)

[PBS NewsHour YouTube](https://www.youtube.com/watch?v=BKy84YmL-sU)

[CBS](https://www.cbsnews.com/live/)

Random YouTuber in Capitol: https://www.youtube.com/watch?v=mNJKNpAOs5k

**Twitter Accounts**

[@tackettdc (Michael Tackett, Deputy Bureau Chief, Associated Press)](https://twitter.com/tackettdc)

[@igorbobic](https://twitter.com/igorbobic)

[@MEPFullter](https://twitter.com/MEPFuller)

reddit user with various Twitter suggestions: [reddit.com/r/news/comments/krvwkf/megathread_protrump_protesters_storm_us_capitol/gic8jqm?context=3](http://reddit.com/r/news/comments/krvwkf/megathread_protrump_protesters_storm_us_capitol/gic8jqm?context=3)",1609963305.0,37450
445,Three Texas soldiers arrested in child prostitution sting near Fort Hood,78703,,1597240754.0,4018
446,Rudy Giuliani’s DC law license is suspended,78649,,1625696915.0,3408
447,"Jail video surveillance from Jeffrey Epstein's first suicide attempt in July is missing, prosecutor says, according to reports",78632,,1576723717.0,2753
448,Disney heir criticises company over $1.5bn bonuses as it cuts pay,78602,,1587547957.0,3003
449,GoFundMe Bans Anti-Vaxxers Who Raise Money to Spread Misinformation,78567,,1553247255.0,2425
450,"Kenya’s only white female giraffe, calf killed by poachers",78530,,1583844018.0,4206
451,Chris Evans sending 'Captain America' shield to little boy who saved sister from dog attack,78504,,1594940870.0,1618
452,Trump Organization Is Charged in 15-Year Tax Scheme,78433,,1625164706.0,5802
453,"FBI: $50,000 Reward For Info On Suspected Pipe Bomber at U.S. Capitol",78352,,1610083636.0,4368
454,Sen. Mitch McConnell's home in Kentucky vandalized,78316,,1609609664.0,577
455,White supremacists behind majority of US domestic terror attacks in 2020,78274,,1603436914.0,3149
456,Jeopardy' host Alex Trebek has stage 4 pancreatic cancer,78239,,1551910041.0,3030
457,"Neil deGrasse Tyson Cleared by Misconduct Investigation, Will Keep Museum Job",78223,,1564236485.0,6958
458,"In 2000, a Disneyland ticket cost $41. It's just increased to $164.",78212,,1635253504.0,9019
459,US soldier being charged with giving classified info about troops to white supremacists,78020,,1592848224.0,3079
460,Capitol Police officer who shot Ashli Babbitt exonerated in internal probe,78022,,1629487987.0,9988
461,Biden orders US flags flown at half-staff after Atlanta shootings,77994,,1616098725.0,3882
462,U.S. Navy Recommends Reinstating Fired USS Theodore Roosevelt Captain,77978,,1587756589.0,1919
463,Portland mayor bans cops from using tear gas during protests,77976,,1599772597.0,5700
464,"Shopify removes Trump stores, citing president's support for violence",77964,,1610047319.0,1796
465,Phoenix police must now document each time they point their gun at someone,77955,,1566320267.0,3599
466,Neo-Nazi who said homosexuality was 'unnatural' revealed as paedophile who groomed young boys,77945,,1554317540.0,4832
467,The White House website's page on climate change just disappeared,77941,,1484938751.0,7999
468,Texas park ranger pushed into water after reminding crowd about social distancing,77898,,1588423776.0,6966
469,91-year-old mailman retires after 69 years with perfect record,77865,,1550189928.0,2786
470,"Taiwan rejects China's ""one country, two systems"" offer",77734,,1570716729.0,3793
471,Michigan inmate serving 60-year sentence for selling weed requests clemency,77727,,1580319361.0,4565
472,"Astronaut’s DNA No Longer Matches His Identical Twin’s After Year Spent in Space, NASA Finds",77694,,1521060719.0,2158
473,Mystery person buys $1M worth of remaining toys at Toys 'R' Us store to donate to kids,77651,,1530298733.0,2115
474,Fulton DA announces charges against 6 Atlanta officers in excessive force case,77603,,1591112967.0,2226
475,Kyle Rittenhouse says he used coronavirus stimulus check to buy AR-15 used in fatal shooting,77597,,1605824946.0,8367
476,California State Senate passes bill restricting gifts from pharma companies to doctors,77552,,1495207967.0,2891
477,"W.Va. delegate, just sworn in, was among the mob storming U.S. Capitol",77532,,1609982522.0,2884
478,New Law Requires Federal Agents to Identify Themselves to Protesters,77515,,1609901140.0,1611
479,Elon Musk has deleted Tesla and SpaceX’s Facebook Pages after Twitter Challenge,77472,,1521823096.0,4882
480,California bans gender in setting car insurance rates,77453,,1547381055.0,7511
481,Las Vegas workers push back after mayor's call to reopen casinos and hotels,77436,,1587643956.0,5615
482,Alleged Capitol rioters are still being arrested four months after the insurrection,77427,,1620167370.0,3815
483,YouTube Suspends OANN for a Week After It Posted Fake Covid-19 Cure,77418,,1606249957.0,4519
484,Head of NYPD union gives Fox News interview with QAnon mug in background,77414,,1595077370.0,6960
485,33 missing children rescued in Los Angeles trafficking operation,77400,,1611461905.0,1878
486,Kentucky teen who sued over school ban for refusing chickenpox vaccination now has chickenpox,77321,,1557335585.0,4325
487,Alex Jones must pay legal fees for ’frivolous’ Sandy Hook appeal,77271,,1585336391.0,3040
488,Trump files emergency request with Supreme Court to stop release of his tax returns,77267,,1602857362.0,4311
489,Spectator who caused massive crash at Tour de France missing after fleeing the country,77231,,1624888561.0,9010
490,Acting Navy Secretary Modly resigns,77206,,1586287200.0,4857
491,"Capitol Rioter Seen in Horned Hat, Carrying Spear Arrested: US Attorney",77189,,1610211994.0,5221
492,Ghislaine Maxwell loses bid to keep deposition excerpt secret,77111,,1612816971.0,2714
493,Delaware judge rules that a medical marijuana user fired from factory job after failing a drug test can pursue lawsuit against former employer,77044,,1545520455.0,2726
494,Federal judge blocks Texas governor's order limiting mail ballot drop-off locations,76950,,1602327866.0,2422
495,Proud Boys are a dangerous ‘white supremacist’ group say US agencies,76900,,1601583286.0,8983
496,Man Sues Police After Being Pepper-Sprayed While Filming Son’s Arrest,76892,,1609084280.0,3164
497,Texas megachurch pastor sent to prison for fraud scheme,76826,,1610652718.0,1791
498,Mass. Trooper Sues Police Leaders After He Was Told To Alter Arrest Report Of Judge's Daughter,76789,,1510141354.0,3183
499,UPS ends ban on beards and natural Black hairstyles,76781,,1605118373.0,3776
500,Tour de France to sue fan who caused mass crash during stage 1,76770,,1624803658.0,7837
501,"Verizon VP jokes at planting a 'brainwashed' FCC chairman, Ajit Pai says 'awesome'",76735,,1512824233.0,2969
502,Medical Marijuana passes VA Senate 40-0.,76710,,1517885335.0,2341
503,"Uber, Lyft, DoorDash stocks fall sharply after U.S. Labor secretary says gig workers should be classified as employees",76696,,1619726512.0,5485
504,"Men accused of vandalizing Black Lives Matter sign in Westlake Village work for sheriff, DA",76665,,1592772234.0,4000
505,Joe Biden selects Kamala Harris as his running mate,76640,,1597177028.0,26725
506,Nurse who received first FDA-approved COVID-19 vaccine will have her scrubs and vaccine card displayed in Smithsonian,76620,,1625402635.0,3984
507,"Ikea bought 11,000 acres of forest in Georgia to protect it from development",76554,,1612076481.0,1329
508,New York Suspends Giuliani’s Law License,76497,,1624548857.0,2980
509,"Church pastor who repeatedly raped children after ""holy baths"" has been jailed for 34 years",76414,,1583584594.0,4833
510,‘I should have gotten the damn vaccine’: Father of 5 dies of COVID at age 39,76401,,1627736372.0,15763
511,"Obama dog Bo, once a White House celebrity, dies from cancer",76366,,1620505754.0,2690
512,Trudeau says any approved COVID-19 vaccine will be free for all Canadians,76208,,1602117210.0,2918
513,Protestors attempting to rip down confederate monuments - Birmingham AL,76188,,1590978451.0,5344
514,"Prison guards, but not mother, get counselling after baby dies in cell",76045,,1632660733.0,3231
515,"Dow falls 1,191 points -- the most in history",75886,,1582839313.0,12319
516,Driver Who Killed Seattle Protester Charged With Vehicular Homicide,75854,,1594250430.0,7718
517,Kenosha County DA says Kyle Rittenhouse has violated bond,75849,,1612390096.0,4964
518,Ellen Pao Is Stepping Down as Reddit’s Chief,75805,,1436563386.0,8597
519,Woman who falsely said Black teen stole her phone in NYC hotel arrested in home state of California,75782,,1610103856.0,3652
520,The Police Report for the Killing of Breonna Taylor Is Almost Entirely Blank,75767,,1591875587.0,2937
521,Pfizer avoids taxes via the Netherlands and makes a profit worth billions,75674,,1621080713.0,4002
522,Atlanta mayor: 2 police officers fired after body-camera footage showed they used excessive force in protest incident,75631,,1590964630.0,1819
523,Dolly Parton statue may replace KKK leader monument at the Tennessee capitol,75554,,1592186357.0,2168
524,Sheriff who refused to enforce restrictions tests positive for Covid-19,75519,,1607093916.0,2094
525,"Utah CEO gets 210 days in jail for having 13K files of infant & child rape, bestiality",75495,,1589581215.0,5769
526,Prosecutors formally request to talk with Prince Andrew in Epstein investigation,75478,,1591582441.0,2278
527,Sean Connery: James Bond actor dies aged 90,75461,,1604147423.0,3059
528,Pete Buttigieg is suspending his 2020 presidential campaign,75441,,1583104435.0,9092
529,Child sex offenders to be named as such in US passports,75408,,1509631385.0,8499
530,California officer associated with Proud Boys fired,75320,,1618054981.0,3508
531,US weekly jobless claims double to 6.6 million,75196,,1585830880.0,9459
532,City gets public backlash for spending federal COVID relief money on golf course clubhouse,75193,,1608124176.0,2608
533,NASCAR: Noose found in Black NASCAR Driver's (Bubba Wallace) garage area at Talladega,75187,,1592794942.0,5084
534,Missing 5-year-old and 8-year-old sisters found alive,75184,,1551644558.0,1408
535,R. Kelly Is Charged With Using Bribes to Marry Aaliyah at Age 15,75174,,1575587032.0,3337
536,John McCain has chosen to discontinue medical treatment for brain cancer,75139,,1535123810.0,7446
537,A Kentucky tattoo shop is offering to cover up hate and gang symbols for free,75093,,1592167412.0,1322
538,Millennials earn 20% less than baby boomers did—despite being better educated,75062,,1572971473.0,7921
539,Massachusetts mayor first in line as recreational marijuana sales begin,74966,,1542724692.0,2876
540,"Mexico Set to Legalize Marijuana, Becoming World’s Largest Market",74963,,1615424848.0,2571
541,A Trader Joe's worker says he was fired after writing to the CEO about Covid-19 safety protections,74966,,1614638280.0,3771
542,"NFL Condems Racism, Admits “ We we’re wrong” Not to Listen to NFL Player Protests",74906,,1591397595.0,3792
543,Ambien-maker to Roseanne: Racism is not a side effect of our drug,74846,,1527691226.0,6485
544,A Florida man just paid off the past dues for 114 families at risk of having their utilities shut off,74844,,1607653046.0,1456
545,White Referee Fired After Forcing Black Wrestler to Cut Dreadlocks,74775,,1546002276.0,7048
546,Active duty troops deploying to Washington DC,74771,,1591051375.0,12643
547,'White Lives Matter' rallies flop as hardly anyone shows up,74747,,1618181177.0,7208
548,"Buffalo man punched in head repeatedly by officer plans to sue city, BPD and arresting officers",74730,,1593170017.0,3367
549,US Police officers charged with over 400 rapes that occurred over a 9 year period.,74714,,1539951653.0,5688
550,Capitol Police arrested a man with an ‘unauthorized’ inauguration credential and a gun at a security checkpoint.,74615,,1610832912.0,3758
551,"Lawsuit: Cops ‘stomped’ on pregnant black woman’s stomach, causing miscarriage",74612,,1591043541.0,3137
552,"Venezuela judge convicts 6 American oil execs, orders prison",74539,,1606442172.0,6395
553,March for Science: Worldwide protests begin to support 'evidence',74515,,1492867303.0,8956
554,California ‘shattering prior election returns’ with 6m ballots already cast,74454,,1603567149.0,5284
555,"Muhammad Ali, 'The Greatest of All Time', Dead at 74",74448,,1465013871.0,5839
556,Steve Bannon out as White House chief strategist,74435,,1503074896.0,10989
557,"Body-cam video in George Floyd killing shows officer pulled gun, swore and touched Floyd multiple times without explanation",74394,,1594834140.0,3928
558,Terry Crews Shares His Own Story of Sexual Assault by a Hollywood Executive,74358,,1507668873.0,5116
559,Hedge fund billionaire Steve Cohen leaves Twitter after family receives threats amid GameStop backlash,74267,,1612036068.0,4603
560,Minnesota AG says 4 officers will be charged to 'highest degree of accountability',74251,,1591024060.0,4414
561,"Illinois governor pardons 11,000 for low-level marijuana convictions",74204,,1577832434.0,1513
562,Blizzard apology does not silence protestors at BlizzCon 2019,74166,,1572695102.0,4982
563,"Two US Capitol police officers suspended, one arrested following Capitol riot",74150,,1610404060.0,2578
564,Ginsburg will become the first woman in history to lie in state in US Capitol,74146,,1600740536.0,2498
565,Unpaid Kentucky coal miners have been blocking a train track for 3 weeks,74114,,1566707010.0,4280
566,Former First Lady Barbara Bush dies at 92,74045,,1524008675.0,4820
567,Portland mayor demands removal of camouflage-clad agents detaining protesters,74040,,1595087785.0,5085
568,Alabama just passed a near-total abortion ban with no exceptions for rape or incest,74038,,1557919881.0,19494
569,Police officer sued after shooting puppy dead in front of its owners,74023,,1630149062.0,5150
570,"Agents find sniper rifle, stash of weapons in home of “Zip Tie Guy”",74030,,1611253180.0,7715
571,More than 40 attorneys general urge Facebook to stop plans for an Instagram for kids,73987,,1620677812.0,2780
572,Washington man gets stunning souvenir with COVID-19 treatment: a $1.1 million bill,73976,,1599178600.0,6931
573,Texas governor lifts mask mandate despite health officials' warnings,73963,,1614717127.0,10120
574,Trump's chief strategist Steve Bannon stripped of national security council role,73870,,1491408645.0,7188
575,"Dow drops nearly 3,000 points; worst day since '87",73797,,1584392309.0,7334
576,US Ice officers 'used torture to make Africans sign own deportation orders',73780,,1603362787.0,4994
577,Justice Department says it will end use of private prisons,73747,,1471534436.0,4923
578,South Dakota governor uses coronavirus relief funds for $5 million tourism ad despite COVID surge,73717,,1599703197.0,3534
579,Black man led by mounted police while bound with a rope sues Texas city for $1 million,73703,,1602394761.0,3182
580,Dr. Anthony Fauci says he won't walk away from 'this outbreak no matter who's the president',73638,,1602596521.0,2259
581,Buffalo police unit resigns in protest,73617,,1591383851.0,9779
582,Canada teen wins $1000 a week for life on 18th birthday,73592,,1522191394.0,5889
583,"Boston Mayor declares racism a public health crisis, diverts police overtime money to community programs",73590,,1591982935.0,2232
584,California man who spent 39 years in prison gets $21 million for wrongful conviction,73587,,1551061141.0,2806
585,"Denmark, Germany, Netherlands and Finland join countries halting weapons sales to Saudi Arabia",73565,,1542983351.0,2101
586,Son of Butler Co. judge receives no prison time after pleading guilty to child porn,73493,,1593338399.0,3470
587,Family outraged that LAPD officers won’t face charges in shooting that killed Trader Joe's manager,73458,,1608724875.0,4371
588,U.S. regulator demands companies take action to halt 'robocalls',73443,,1541452671.0,4026
589,Elizabeth Warren will drop out of the 2020 presidential race after disappointing Super Tuesday showing,73409,,1583423181.0,11420
590,"Bucking GOP trend, Alabama governor extends mask order",73397,,1614877741.0,2802
591,Nearly all Fox staffers vaccinated for Covid even as hosts cast doubt on vaccine,73378,,1631759100.0,3084
592,"Amazon to drop Parler from its web hosting service, citing violent posts",73190,,1610249799.0,7022
593,Grand jury indicts 1 officer on criminal charges 6 months after Breonna Taylor fatally shot by police in Kentucky,73141,,1600881833.0,7619
594,Student who feared for life in speeding Uber furious company first offered her $5 voucher,73103,,1578922354.0,5335
595,Charles Manson Dead After Spending 46 Years Behind Bars,73097,,1511156082.0,8289
596,Tennessee police chief tells officers they now must intervene when others are abusing their authority,73084,,1591801852.0,2097
597,Buffalo protester Martin Gugino has a fractured skull and cannot walk,73037,,1592333659.0,3828
598,"United CEO doubles down in email to employees, says passenger was 'disruptive and belligerent'",72990,,1491871372.0,10692
599,Amazon relaxes drug testing policies and will lobby the government to legalize marijuana,72974,,1632237613.0,5172
600,"Net neutrality: Amazon among top internet firms planning day of action. Etsy, Kickstarter and other leading companies to fight FCC plans to neuter 2015 rules in July protest backed by ACLU, Greenpeace and more",72912,,1496749838.0,3330
601,Kellyanne Conway's daughter the latest to test positive for COVID-19,72806,,1601841791.0,3637
602,"Man cleared of rape to sue police after they hid 40,000 messages from 'victim'",72803,,1513687131.0,7803
603,Billionaire pharmaceutical exec John Kapoor goes on trial starting today in the first prosecution of a CEO tied to the opioid crisis,72788,,1548695611.0,1906
604,"US Initial Jobless Claims skyrocket to 3,283,000",72780,,1585225972.0,8717
605,Terry Crews names alleged sexual assaulter: 'I will not be shamed',72774,,1510759507.0,5525
606,"Brutal beating in Iowa should be investigated as hate crime, NAACP says. A black man was leaving his girlfriend's house when he was attacked by white men who accused him of being a burglar, according to the civil rights organization",72775,,1590258902.0,4888
607,"Reversing Trump, US restores transgender health protections",72743,,1620650388.0,4207
608,Zuckerberg has sold more Facebook stock in the last 3 months than any insider at any other company,72733,,1521574519.0,3071
609,"Prince Philip has died aged 99, Buckingham Palace announces",72689,,1617967552.0,5921
610,"Houston woman accused of offering to sell her 2-year-old daughter for sex at a cost of $1,200 has been sentenced to 40 years in prison.",72665,,1531492136.0,4942
611,Cleveland cop who urinated on girl as she waited for bus gets 4 1/2 years in prison,72634,,1579690022.0,3605
612,Killer Mike's new Black-owned bank receives 'tens of thousands' of account requests in less than 24 hours,72631,,1602376542.0,4183
613,'Pharma bro' Martin Shkreli convicted in federal fraud case,72629,,1501872127.0,6568
614,Apple removes police-tracking app used in Hong Kong protests from its app store,72610,,1570677724.0,3966
615,Amber Guyger found guilty of murder in fatal shooting of Botham Jean,72619,,1569944798.0,10840
616,"‘Hey Siri, I’m getting pulled over’: iPhone feature will record police interaction, send location",72612,,1592278145.0,1620
617,"This zoo will name a cockroach after your ex, then feed it to a meerkat on Valentine's Day.",72614,,1549576562.0,1159
618,"Deputy who killed himself left haunting videos on racist policing, division: 'I've had enough'",72603,,1612462449.0,3356
619,Trump associate Roger Stone has been found guilty,72599,,1573836819.0,4049
620,Stephen King quits Facebook over concerns of 'false information‘,72585,,1580671439.0,3364
