,title,score,selftext,created_utc,num_comments
242,'Epstein Didn’t Kill Himself' Mardi Gras float causes a stir,90667,,1582670925.0,3030
243,"Eddie Van Halen, Guitar Hero, Dies At 65",90488,,1602013749.0,3503
244,"YouTube suspends Logan Paul’s ad revenue, blames ‘recent pattern of behavior",90453,,1518180785.0,7454
245,Michigan becomes the 10th state to legalize recreational marijuana,90427,,1541564118.0,4308
246,"Police officer fired after ""fabricating"" story about being served McDonald's coffee with ""f***ing pig"" written on cup",90419,,1577757959.0,5752
247,Third Sandy Hook parent wins defamation suit against Alex Jones,90275,,1633475492.0,2995
248,"MyPillow CEO says Bed Bath & Beyond, Kohl's stopped selling his products, prompting calls for boycotts",90094,,1611066225.0,7861
249,Doctor who tweeted that she would give Jews the wrong medication loses ohio medical certificate,89869,,1598386450.0,6002
250,Houston hospital suspends 178 employees who refused Covid-19 vaccination,89833,,1623281866.0,12851
251,Native Americans renew decades-long push to reclaim millions of acres in the Black Hills,89695,,1606569511.0,4434
252,New York Times reporter infected with Covid-19 says the White House is not doing contact tracing,89603,,1601922268.0,3095
253,"Terry Crews Testifies Before Senate On Sexual Assault, Says He Won’t Be In ‘Expendables 4’ After Producer Threatened “Trouble”",89606,,1530044689.0,2761
254,"Fed to ban policymakers from owning individual stocks, restrict trading following controversy",89594,,1634839338.0,2549
255,"Chicago teachers vote to teach from home, defying district",89377,,1611521663.0,4655
256,Comcast asks the FCC to prohibit states from enforcing net neutrality,89212,,1509800715.0,5022
257,Law Enforcement fires paint projectile at residents on porch during curfew,89096,,1590938887.0,7339
258,"Ann Arbor decriminalizes magic mushrooms, psychedelic plants",89019,,1601410746.0,2661
259,Armed man arrested at Charlotte polling site after being banned,88661,,1604437366.0,3269
260,Corey Feldman launches campaign to expose Hollywood pedophile ring,88638,,1508975675.0,5487
261,A principal in Florida said he couldn't confirm the Holocaust was a 'factual' event. The school district just fired him,88594,,1572484990.0,6061
262,The AP has learned ex-Michigan Gov. Snyder and others have been told they’re being charged in Flint water scandal.,88505,,1610480308.0,1668
263,Michael Cohen sentenced to 3 years in prison,88290,,1544634464.0,5954
264,Facebook fails to convince lawmakers it needs to track your location at all times,88186,,1576679927.0,3632
265,Woman wanted for allegedly stealing Nancy Pelosi’s laptop arrested,88173,,1611032293.0,5978
266,One in 4 U.S. adults is now fully vaccinated,87945,,1617881976.0,10286
267,CNN's Anthony Bourdain dead at 61,87914,,1528456924.0,9149
268,FBI raids New York City police union headquarters,87897,,1633449271.0,4857
269,Marine kicked out of Marine Corps for role in Charlottesville white supremacist march | WTOP,87879,,1533653758.0,8480
270,Proud Boys leader Joseph Biggs arrested in Florida in connection with the Capitol riot,87783,,1611194755.0,2373
271,St. Louis police officers on trial for beating Black undercover detective during protest,87725,,1616840070.0,3109
272,Fauci says it might be time to mandate masks as Covid-19 surges across US,87696,,1603501979.0,7691
273,Trump acquitted for second time following historic Senate trial,87685,,1613249817.0,19044
274,Ex-Trump adviser sold $31m in shares days before president announced steel tariffs,87535,,1520013333.0,4072
275,REPORT: Kenosha man charged with illegally buying gun for Kyle Rittenhouse,87514,,1604962887.0,7685
276,"Verne Troyer, best known as Mini-Me in ""Austin Powers,"" has died",87485,,1524342956.0,2535
277,"Cops admit vandalizing cars of man who filed complaint against them, prosecutor says",87371,,1598407261.0,2686
278,Man with foot up on desk in Pelosi's office at Capitol arrested,87281,,1610131121.0,5089
279,Man who plowed into Charlottesville crowd found guilty,87180,,1544220672.0,374
280,Breonna Taylor's boyfriend Kenneth Walker files federal lawsuit against Louisville police,87177,,1615671517.0,1391
281,Stephen Hawking to Be Buried Between Darwin and Newton.,87149,,1529069518.0,2174
282,"Publix buys 5 million pounds of produce to support local farmers, donates to food banks",87045,,1594592192.0,1840
283,Trump withdrawing US from Paris climate agreement,87020,,1496346575.0,16477
284,Grandma and young man she accidentally invited to Thanksgiving are spending their fourth holiday together - CBS News,86979,,1574947312.0,1555
285,"Fox News mandates that its employees disclose vaccination status, contradicting rhetoric from its top stars",86902,,1629322666.0,2731
286,President Trump being taken to Walter Reed as a 'precautionary measure',86852,,1601673608.0,17371
287,A Navy veteran says he was beaten and pepper sprayed by authorities while attending his first protest in Portland,86785,,1595241178.0,6178
288,"Nestle has been bottling and selling water it has no right to in drought-stricken California, state says",86733,,1514461726.0,4608
289,OnlyFans says it will no longer ban porn in stunning U-turn after user backlash,86719,,1629896270.0,7194
290,"50,000 net neutrality complaints were excluded from FCC’s repeal docket",86639,,1512504919.0,3219
291,New York City breaks record: 58 straight days with no pedestrian deaths,86594,,1589368535.0,1920
292,Andrew Cuomo To Resign Amid Sexual Harassment Allegations,86475,,1628611702.0,9231
293,F.B.I. Raids Office of Trump’s Longtime Lawyer Michael Cohen,86482,,1523304046.0,10040
294,Teen who shared photo of packed high school hallway says she's receiving threats,86390,,1597047853.0,6134
295,California votes to bar schools from starting before 8:30am to help give students more sleep,86302,,1535829490.0,6478
296,Home surveillance camera shows officer lied on report when charging man with major crimes,86174,,1616073311.0,3816
297,Black disabled Veteran Sean Worsley sentenced to spend 60 months in Alabama prison for medical marijuana,86159,,1594663994.0,5411
298,Record 9 million comments flood FCC on net neutrality,86159,,1500723796.0,3335
299,House votes to strip Rep. Marjorie Taylor Greene of committee assignments,85917,,1612482998.0,4181
300,Judge drops charges against 28 Black Lives Matter protesters in Detroit,85839,,1610816499.0,3058
301,Swedish DJ Avicii Dead at 28,85812,,1524245300.0,5746
302,Twitter hides Trump tweet for 'glorifying violence',85626,,1590741919.0,7640
303,Dr. Anthony Fauci to throw first pitch for Nationals on Opening Day,85440,,1595278005.0,2181
304,AP Calls Nevada For Joe Biden,85420,,1604776106.0,2847
305,Hong Kong protesters form 28-mile human chain demanding democracy,85403,,1566583970.0,2914
306,Danny DeVito Abruptly Loses Twitter Verification After Tweeting Support For Nabisco Strike,85352,,1629422242.0,3927
307,Oxygen-dependent man dies 12 minutes after PG&E cuts power to his home,85318,,1570883005.0,5624
308,U.S. Supreme Court rejects Texas lawsuit,85306,,1607729997.0,6687
309,Facebook has shut down the personal accounts of a pair of New York University researchers and shuttered their investigation into misinformation spread through political ads on the social network.,85283,,1628104609.0,3796
310,"In blow to Trump, golf’s PGA to strip major championship from Trump-owned course",85254,,1610334815.0,3691
311,Kaepernick and Fauci will be honored as Robert F. Kennedy Human Rights award laureates,85229,,1596041328.0,4422
312,LA officially becomes 'no-kill' city as animal shelters achieve 90% save rate,85101,,1616236903.0,2135
313,"U.S. says Ghislaine Maxwell should stay behind bars, deserves no bail",85073,,1608320161.0,2334
314,Chicago Police: 4 in custody after young man tortured on Facebook Live,84888,,1483571067.0,33157
315,"Trump pardons former national security adviser Michael Flynn, who pleaded guilty to lying to the FBI",84877,,1606339205.0,5464
316,"FBI cannot even look at your phone lock screen without a warrant, rules judge",84848,,1590229849.0,2456
317,Five officials will face manslaughter charges for Flint water crisis,84644,,1497463793.0,2045
318,Bill Gates and Melinda Gates are splitting up after 27 years,84532,,1620074142.0,12137
319,Judge says US government can be sued for Flint water crisis,84509,,1555688098.0,1898
320,Former pharma CEO pleads guilty to bribing doctors to prescribe addictive opioids,84480,,1547127184.0,3322
321,For the first time in 25 years New York City didn't have a single shooting over the weekend,84472,,1539712564.0,2859
322,Man jailed for life over $20 marijuana sale has been freed,84376,,1608235736.0,3224
323,Korea leaders release joint statement declaring there will be no more war on the Korean Peninsula,84286,,1524820065.0,7542
324,University of Alabama orders faculty to keep quiet about outbreak,84280,,1598798817.0,3041
325,50 Cent forgot he had a stash of Bitcoin now worth $8m,84188,,1516906789.0,3803
326,Papa John sues Papa John's,84103,,1532634170.0,5729
327,Former Wisconsin pharmacist who tampered with COVID vaccines sentenced to 3 years in federal prison,84026,,1623168422.0,3578
328,"Child porn ring leader beaten to death at detention center, authorities say",83915,,1547268337.0,6850
329,"Biden wins Georgia and Trump wins North Carolina, the final states to be called.",83868,,1605298718.0,4886
330,Dominion Voting sues Fox for $1.6B over 2020 election claims,83862,,1616757362.0,3701
331,Christopher Columbus statue beheaded in Boston,83849,,1591793419.0,8804
332,A protester knelt down to tell police he loves and respects them. They threw him in jail.,83816,,1591181632.0,4334
333,Right-wing social media app Parler has been removed from the Google Play store,83707,,1610155923.0,9667
334,Canadian air traffic controllers send pizzas to U.S. counterparts working without pay,83688,,1547407439.0,2993
335,Judge reinstates third-degree murder charge against ex-cop charged in George Floyd's death,83612,,1615473615.0,5836
336,US to deploy thousands of additional troops to Middle East following Soleimani killing,83421,,1578073119.0,13986
337,NYPD officers are no longer protected from civil lawsuits after city council passes police reform legislation,83376,,1616727069.0,4786
338,"Don’t reconnect mailing machines, Postal Service tells plants. Tacoma does it anyway",83353,,1598128141.0,3020
339,YouTube Bans Minors From Streaming Unless Accompanied by Adult,83321,,1559576260.0,2771
340,"Son Tipped Off F.B.I. About His Father, Who Is Charged in Capitol Riot",83318,,1611661842.0,6752
341,"Jessica Walter Dies: Emmy-Winning ‘Arrested Development’, ‘Archer’ Actress Was 80",83277,,1616698902.0,2710
342,Officer who shot Ashli Babbitt during Capitol riot breaks silence: 'I saved countless lives',83221,,1630017184.0,14458
343,Oregon construction worker fired for refusing to attend Bible study sues former employer,83095,,1535636930.0,6833
344,FTC Shuts Down 4 Robocall Groups Responsible For Billions of Illegal Robocalls,83043,,1553703977.0,3616
345,A truck driver from Brooklyn wins $298 million Powerball Jackpot,82938,,1548513087.0,2790
346,"Autopsy finds broken bones in Jeffrey Epstein’s neck, deepening questions around his death",82859,,1565840019.0,7468
347,"'You shouldn't be able to breathe,' officer tells man before he dies",82840,,1621556078.0,5744
348,Worried voters are buying stamps and merch to fund the USPS,82840,,1597616966.0,3349
349,"EA’s day of reckoning is here after ‘Star Wars’ game uproar, $3 billion in stock value wiped out",82733,,1511907625.0,4125
350,Buffalo officials ask state to probe firing of Black officer who stopped white colleague's chokehold,82719,,1592085034.0,1319
351,Officer who knelt with George Floyd protesters accused of insubordination a day later - The San Francisco Examiner,82716,,1591887148.0,2462
352,U.S. Intelligence Publicly Accuses Iran and Russia of Interfering in 2020 Election,82704,,1603323863.0,3911
353,Waffle House closes 365 locations across the U.S.,82684,,1585096630.0,3924
354,The US debt is now projected to be larger than the US economy,82679,,1602195852.0,5707
355,An 11-year-old girl in Zimbabwe jumped on top of a crocodile and gouged its eyes out when it attacked her 9-year-old friend,82666,,1572731242.0,2308
356,EPA is now allowing asbestos back into manufacturing,82633,,1533605990.0,7445
357,China Shuts Down Its Legal Ivory Trade,82550,,1514729019.0,1985
358,Family O Five YouTube taken down permanently,82518,,1531964707.0,3986
359,Texas school district makes masks part of dress code to get around Gov. Abbott's order,82484,,1629280823.0,3592
360,"Black man shot dead while jogging in Georgia, and two months later, no arrests",82457,,1588557439.0,6481
361,"FBI director says antifa is an ideology, not an organization",82322,,1600369134.0,7861
362,Connecticut is 1st state to make all prison phone calls free,82313,,1624305401.0,3040
363,Fox News Host Tucker Carlson Loses More Advertisers,82232,,1591980351.0,5917
364,White House turns down offers from CDC to help with contact tracing,82165,,1601989955.0,3968
365,Judge rules Michigan stay-at-home order doesn’t infringe on constitutional rights,82134,,1588213987.0,7806
366,Home Depot to spend $1 billion more on employees' pay as sales surge,82084,,1605618487.0,3087
367,Police find and arrest spectator who caused mass Tour de France crash,82071,,1625061090.0,10300
368,Former Marine steals truck after Vegas shooting and drives nearly 30 victims to hospital,81935,,1507051329.0,4954
369,"ICE arrests rapper 21 Savage, says he is actually British and overstayed visa",81897,,1549226619.0,5375
370,"With no end in sight to government shutdown, TSA agents at Hawaii airports start to resign",81829,,1548383344.0,9508
371,Single anonymous donor gives $40 million to fund 50 civil rights lawyers,81818,,1610985033.0,1522
372,James Alex Fields Jr. sentenced: Man gets life plus 419 years in deadly Charlottesville car attack - CBS News,81734,,1563213723.0,8559
373,"Facebook has decided not to limit how political ads are targeted to specific groups of people, as Google has done. Nor will it ban political ads, as Twitter has done. And it still won't fact check them, as it's faced pressure to do.",81725,,1578570641.0,5862
374,"United Airlines will require its 67,000 U.S. employees to get vaccinated, a first for U.S. carriers",81706,,1628250824.0,7896
375,"Vermont becomes first state to reach 80% vaccination; Gov. Scott says, ""There are no longer any state Covid-19 restrictions. None.""",81674,,1623684509.0,4072
376,Jeff Bezos: World's richest man pledges $10bn to fight climate change,81605,,1581968324.0,8334
377,"In a first, FBI to begin collecting national data on police use of force",81560,,1542935211.0,1520
378,Biden calls mass killing of Armenians genocide,81541,,1619281092.0,4217
379,California bans secret condom removal during sex and enhances punishment for spousal rape,81513,,1633697967.0,7757
380,"Doctors post blood-soaked photos after NRA tells them to ""stay in their lane""",81492,,1542076114.0,9832
381,GameStop to permanently close over 300 stores,81474,,1585273998.0,4755
382,"Two travellers from U.S. fined $20,000 each for fake vaccination documents.",81472,,1627671358.0,4811
383,Johnson & Johnson agrees to stop selling opioids nationwide in $230 million settlement with New York state,81406,,1624722057.0,4900
384,Man killed by cops during Alabama mall shooting had a permit: Actual shooter remains at large,81393,,1543155479.0,8616
385,Britney Spears' new attorney files to remove Jamie Spears as conservator,81372,,1627332180.0,2767
386,Twitter temporarily restricts Donald Trump Jr.'s account after he posts video claiming masks are unnecessary,81338,,1595952414.0,4104
387,Tech writer suggests '10 Year Challenge' may be collecting data for facial recognition algorithm,81298,,1547990414.0,3609
388,"NYPD Officer Luis Alvarez, 9/11 First Responder Who Testified Before Congress With Jon Stewart, Dies",81266,,1561816781.0,2636
389,U.S. Homeland Security confirms three units sent paramilitary officers to Portland,81260,,1595362906.0,7336
390,"Japanese bonsai owners urge thieves to water stolen 400-year-old tree worth $127,700",81143,,1549963918.0,1660
391,CVS Puts Out Generic Competitor To EpiPen At A 6th Of The Price,81085,,1484230140.0,3134
392,Marine commandant banishes Confederate symbols from all Corps installations,81013,,1582769117.0,5433
393,"Federal appeals court rules 2-1, you have the right to film the police",81005,,1488035245.0,3587
394,Pentagon to require COVID vaccine for all troops by Sept. 15,80998,,1628528321.0,7325
395,"Warnock, Ossoff win in Georgia, handing Dems Senate control",80988,,1609968592.0,2437
396,Teen registered people to vote as they waited in Popeyes line for new chicken sandwich,80965,,1566841943.0,3089
397,Pharma bro Martin Shkreli is denied minimum security camp and sent to federal prison in New Jersey,80943,,1524069401.0,5413
398,Pope Francis: fake and sensationalised news 'a very serious sin',80887,,1513525338.0,5045
399,"Cincinnati church wipes out $46.5 million in medical debt for 45,000 families",80876,,1582909011.0,4129
400,"DC protester arrested with 11 Molotov cocktails, several guns had list of 'good guys,' 'bad guys': DOJ",80840,,1610500921.0,4101
401,Amazon raises minimum wage to $15 for all US employees,80813,,1538475386.0,8751
402,Coronavirus: Florida scientist was fired for refusing to 'manipulate' COVID-19 data,80816,,1589916889.0,2669
403,Amazon engineer quits after he 'snapped' when the company fired workers who called for protections,80737,,1588607383.0,3106
404,Woman in video seen coughing on customers loses her job,80631,,1631206802.0,5685
405,"Jeffrey Epstein denied bail, will remain jailed pending trial on sex trafficking charges",80617,,1563464240.0,3945
406,Net neutrality protesters take to the streets,80611,,1512694709.0,2933
407,Emergency alert about ballistic missile sent to Hawaii residents; EMA says ‘no threat’,80575,,1515868273.0,11786
408,"Woman shot herself in the head while cuffed with hands behind her back during traffic stop, police say",80533,,1552932060.0,8495
409,"NYPD used excessive force during George Floyd protests, city investigation finds",80419,,1608304244.0,3713
410,‘You’re Gonna Kill Me’: Body-Cam Footage Shows Cops Mocking Dallas Man as He Dies,80405,,1564603404.0,8389
411,Explosive Devices Found in Mail Sent to Hillary Clinton and Obama,80395,,1540387968.0,18536
412,"Video showing hundreds of shackled, blindfolded prisoners in China is 'genuine'",80369,,1569070509.0,5467
413,Alabama governor signs bill to remove anti-gay language from sex education curriculum,80237,,1619710409.0,3179
414,Scientology facilities in Tennessee closed after police find patients held against their will,80190,,1493980691.0,4857
415,Video shows USPS mail being dumped in a California parking lot. A postal union says USPS employees weren't involved,80181,,1599561907.0,5522
416,"Dallas officer goes home to wrong apartment, kills man inside, police say",80131,,1536323853.0,11775
417,Judge Who Advised Woman to 'Close Your Legs' to Avoid Sexual Assault Permanently Removed From the Bench,80007,,1590529140.0,1587
418,"Aretha Franklin dies in Detroit, surrounded by family and friends",79956,,1534427886.0,2733
419,Banks halt business with Trump after U.S. Capitol riots,79829,,1610450472.0,4993
420,"Illinois is going to expunge marijuana convictions from 800,000 criminal records - CNN",79815,,1561688097.0,1717
421,Illinois State Senate passes measure designating neo-Nazi groups as terrorists,79784,,1502851153.0,10187
422,FBI: Video evidence shows noose found in garage of Bubba Wallace had been there since Oct. 2019,79750,,1592947979.0,10708
423,U.S. Postmaster General to pause all operational reforms after outcry,79651,,1597772378.0,4127
424,"17-year-old Walmart employee quits over store intercom: 'Nobody should work here, ever'",79645,,1544908702.0,5661
425,Amazon's hourly workers lose monthly bonuses and stock awards as minimum wage increases,79587,,1538600903.0,6007
426,"Twitter Employees Can Work From Home Forever, CEO says",79475,,1589305540.0,4324
427,"Global rich must cut their carbon footprint 97% to stave off climate change, UN says",79439,,1608153534.0,5410
428,Rush Limbaugh says his lung cancer is terminal,79416,,1603194395.0,3069
429,Illegal Brooklyn bar found with nearly 300 people inside,79404,,1599498271.0,4676
430,Global warming: April was 400th straight warmer-than-average month,79366,,1526570140.0,4851
431,Couple who yelled 'white power' at Black man and his girlfriend arrested for hate crimes,79331,,1596322799.0,4408
432,The United States is now averaging 2 million vaccine doses administered per day.,79300,,1614907866.0,4588
433,"Multiple boats in distress, sinking at Trump Boat Parade on Lake Travis",79174,,1599334411.0,7720
434,South Carolina bill would ban animal cruelty offenders from adopting pets for five years,79116,,1548552124.0,1650
435,"Winner of $560 Million Powerball Can Keep Her Name Private, Judge Rules",79082,,1520884842.0,3877
436,"George Floyd protests: San Jose police fire rubber bullets at own bias trainer, rupture his testicle",79065,,1591737645.0,3489
437,One dead in Louisville after police and national guard 'return fire' on protesters,79057,,1591009249.0,9095
438,Police officers shoot and kill Los Angeles security guard: 'He ran because he was scared',79027,,1592581830.0,6153
439,"A veteran died in a Florida jail. Two years later, video shows he was tased, left convulsing in a cell.",79027,,1605391271.0,1840
440,Denver police fire pepper balls at man yelling that his pregnant fiancée is in car.,78990,,1591440963.0,3981
441,"Japanese woman turns 117 years old, extends record as world's oldest person",78956,,1578224021.0,2391
442,A vegan couple have been charged with first-degree murder after their 18-month-old son starved to death on a diet of only raw fruit and vegetables,78829,,1576845446.0,8382
443,"Proud Boys' leader Enrique Tarrio arrested in DC, law enforcement sources say",78746,,1609803054.0,7431
