,title,score,selftext,created_utc,num_comments
621,American-born citizen sues sheriff after he was nearly deported to Jamaica,72576,,1543954635.0,2548
622,Las Cruces officer heard saying 'I'm going to... choke you out' before suspect dies,72583,,1591715233.0,2804
623,Microsoft tried a 4-day workweek in Japan. Productivity jumped 40%,72558,,1572960526.0,2749
624,Treasury and IRS to delay tax season deadline by 90 days,72504,,1584464044.0,2532
625,"Washington DC mayor says federal police actions were ""shameful""",72491,,1591091335.0,3727
626,Proud Boys added to Canada’s list of terrorist groups,72437,,1612374511.0,3090
627,New Zealand election: Jacinda Ardern wins second term after rival concedes,72430,,1602927176.0,3327
628,"Eric Carle, Author of ‘The Very Hungry Caterpillar,’ Dies at 91",72430,,1622069609.0,1101
629,Alabama city removes Confederate statue without notice,72411,,1591611207.0,3208
630,"Mass. parents knew kid had coronavirus, sent him to 1st day of school anyway, officials say",72383,,1600366024.0,4208
631,Jeffrey Epstein Arrested For Sex Trafficking of Minors,72297,,1562459031.0,9053
632,Teacher says she was fired for giving zeroes to students who didn't turn in their work,72245,,1537886143.0,9998
633,Tony Hawk announces his mother has died after a long battle with Alzheimer's,72204,,1577291741.0,1206
634,The Gorilla Foundation is sad to announce the passing of our beloved Koko,72199,,1529564622.0,2706
635,Oregon governor issues emergency fire order; three prisons evacuated. The state's largest firefighting helicopters are unavailable; they were deployed to Afghanistan.,72141,,1599742933.0,3590
636,All of West Virginia's public schools are closed due to a teacher walk-out over pay,72121,,1519314587.0,6041
637,"F.D.A. Bans School Electric Shock Devices. The ban is national, but it is squarely targeted at a single school in Massachusetts that has been using electric shocks to condition students’ behavior for decades.",72125,,1583498443.0,4987
638,Outrage over video showing police macing child at Seattle protest,72086,,1592218485.0,6857
639,"Father buys $64,259 ad calling for police to reopen investigation into son's death",72082,,1517323341.0,3733
640,Virtually all hospitalized Covid patients have one thing in common: They're unvaccinated,72087,,1623548121.0,5554
641,"Family members viewed long-secret body-camera video this week of a Black man who died in Louisiana State Police custody, their attorney calling it damning footage that shows troopers choking and beating the man, repeatedly jolting him with stun guns and dragging him face-down across the pavement",72077,,1602803017.0,2226
642,"Whistleblower claims Mormon Church stockpiled $100 billion in charitable donations, dodged taxes",72069,,1576556571.0,3778
643,MAGA protesters damage historic Black church in DC,71882,,1607902923.0,5041
644,FBI agents swarm Jeffrey Epstein's private Caribbean island,71870,,1565646001.0,6488
645,Michigan governor extends state emergency order despite Trump tweet backing protesters,71825,,1588359162.0,5531
646,Police union will not ID officer in Australian TV crew attack,71827,,1591334874.0,3530
647,"Tokyo 2020: Olympics to be postponed until 2021, says IOC member",71808,,1584987158.0,1489
648,Rapper DMX Has Died at 50,71803,,1617985093.0,4438
649,"Disney to stop paying 100,000 workers but is still on track to give shareholders $1.5 billion",71742,,1587433658.0,4104
650,"Elon musk pledges to fix Flint, MI water problem",71690,,1531350319.0,5023
651,Russia to Withdraw Troops From Ukraine Border,71690,,1619093934.0,3123
652,Federal Investigators Execute Search Warrant at Rudy Giuliani’s Apartment,71653,,1619625953.0,4594
653,Dutch parliament: China's treatment of Uighurs is genocide,71636,,1614343283.0,3832
654,"Oregon Gov. Kate Brown will declare emergency, ready National Guard ahead of election",71603,,1604340421.0,10311
655,White supremacist killed in shootout with California deputies,71606,,1601088053.0,9014
656,"Christopher Columbus statue torn down, thrown in lake by protesters",71568,,1591758270.0,8383
657,"Black men arrested with weapons at protest while armed white militia men avoid charges in Greensboro, NC",71532,,1591507104.0,3661
658,"Denver police officer fired for ""Let's start a riot"" post during George Floyd protest",71537,,1591183961.0,2570
659,White House suspends CNN reporter's access,71451,,1541640937.0,9164
660,Calls grow louder to boycott Beijing’s Olympics — and analysts warn of retaliation from China,71434,,1617706875.0,5778
661,Police Officers sue Donald Trump for injuries resulting from capital riot,71393,,1617217787.0,2771
662,Komodo island is reportedly closing until 2020 because people keep stealing the dragons,71380,,1554214123.0,2512
663,THP trooper terminated after pulling face mask off protester,71357,,1597506787.0,2727
664,College-bound high school football player ruled ineligible because he's homeless,71328,,1537639959.0,1991
665,A woman who allegedly coughed on a baby no longer has her school district job,71325,,1594084670.0,1756
666,Ghislaine Maxwell: Jeffrey Epstein's former girlfriend denied bail,71259,,1609187395.0,2484
667,Twitter bans political ads after Facebook refused to do so,71220,,1572466131.0,1787
668,The parents of a nonverbal man killed by an off-duty officer in Costco say they want to see video of the shooting,71161,,1567039777.0,5045
669,NYC to terminate Trump contracts after Capitol insurrection,71146,,1610547711.0,3218
670,Man who filmed Ahmaud Arbery video charged with murder,71077,,1590098616.0,8035
671,Religious Parents Who Refused to Take Son to Hospital and Thought God Would Resurrect Him Found Guilty of First Degree Murder.,71033,,1488105989.0,5527
672,Trump Foundation agrees to dissolve under court supervision,70995,,1545149227.0,5306
673,Poll worker fired for turning away voters with BLM shirts,70984,,1603159017.0,4469
674,Harvey Weinstein Indicted in Los Angeles on Sex Crimes Charges,70955,,1578334498.0,2521
675,Supreme Court strikes down Louisiana law that would have limited state to one abortion clinic,70923,,1593440169.0,3601
676,Officer with knee to George Floyd's neck to be tried alone,70919,,1610462380.0,3323
677,"On-duty NYPD officers 'handcuffed 17-year-old girl, took her to deserted spot and raped her'",70822,,1506879215.0,9187
678,Former officers charged in George Floyd killing want court proceedings recorded and broadcast,70808,,1593186777.0,8283
679,New York City declares Juneteenth official holiday,70767,,1592647320.0,3870
680,Interpol issues wanted notice for wife of U.S. diplomat sought over fatal UK car crash: ITV,70735,,1589213839.0,3894
681,"Indiana man, 34, who impregnated 10-year-old girl, gets over 100 years in prison",70639,,1537530311.0,5764
682,NASA Fixes Mars Lander By Telling It to Hit Itself With a Shovel,70641,,1584579634.0,1541
683,Walmart closing stores on Thanksgiving,70627,,1595343035.0,3237
684,"U.S. reports more than 100,000 COVID-19 cases for seventh day in a row",70563,,1605095054.0,5323
685,New York City to try responding to mental health calls without police,70553,,1605047918.0,2902
686,"Texas Gov. Abbott, who banned mask mandates, tests positive for Covid",70492,,1629234159.0,599
687,Anti-vaxxers banned from raising money on GoFundMe,70410,,1555336476.0,2437
688,Delta wants other airlines to share ‘no-fly’ lists of unruly passengers,70393,,1632491228.0,3167
689,"Dominion sues Mike Lindell, the MyPillow chief, over election fraud claims.",70325,,1614001781.0,3632
690,San Francisco officer is charged with on-duty homicide. The DA says it's a first,70274,,1606222238.0,4287
691,Goldman Sachs CEO David Solomon gets a 20% raise to $27.5 million,70275,,1584738025.0,4524
692,"Breonna Taylor grand jury members allowed to speak, judge says",70182,,1603219369.0,3602
693,US health insurers doubled profits in second quarter amid pandemic,70159,,1597402242.0,3782
694,Kellyanne Conway announces she tested positive for coronavirus,70154,,1601692057.0,3761
695,"Man charged with infecting 22 people with Covid after going to gym and work with symptoms. He told colleagues ‘I’m going to give you all the coronavirus’, police say",70157,,1619355472.0,3486
696,Sen. Lindsey Graham tests positive for COVID-19,70103,,1627931962.0,596
697,"Postal worker admits fabricating allegations of ballot tampering, officials say",70068,,1605058696.0,3580
698,Leaked emails show Washington state Rep. Matt Shea endorsed training children to fight in holy war,70057,,1565997070.0,4321
699,Baltimore votes to become first large U.S. city to ban water privatization,70043,,1542162259.0,1658
700,Shooting at South Florida high school,70048,,1518638190.0,41948
701,Colorado district attorney 'incredibly frustrated' he's unable to prosecute cop found drunk in patrol car,70036,,1581035304.0,3036
702,Recreational use of marijuana now legal in Montana,70031,,1609524616.0,2249
703,President Donald Trump ordered to pay $2M to collection of nonprofits as part of civil lawsuit,70020,,1573152955.0,3288
704,"Comcast, Cox, Frontier All Raising Internet Access Rates for 2018",70010,,1513715775.0,6455
705,New York Democrat Ritchie Torres elected as the first openly gay Black member of Congress,69890,,1604529655.0,1036
706,Mother stabs rapist to death after catching him attacking her daughter,69876,,1545076678.0,2836
707,Salma Hayek divulges years of terrifying abuse by Harvey Weinstein,69860,,1513198571.0,4670
708,Same-sex penguin couple welcomes baby chick after adopting and hatching an egg together,69857,,1598445363.0,2495
709,School board gets death threats after teacher handcuffed after questioning pay raise,69831,,1515600550.0,6635
710,"911 call from Breonna Taylor's shooting death released: ""Somebody kicked in the door and shot my girlfriend""",69725,,1590786828.0,2934
711,U.S. judge orders USPS to reinforce 'extraordinary measures' ballot delivery policy,69687,,1604315411.0,2122
712,"Moderna Covid vaccine candidate almost 95% effective, trials show",69666,,1605528177.0,4155
713,Radiohead Donates Money to Climate Change Group Instead of Paying Ransom to Hackers. The band released hours of hacked recordings rather than pay ransom money to the hacker who stole them.,69635,,1560275904.0,1570
714,Major League Baseball and player's union agree to opioid testing; marijuana removed as 'drug of abuse',69613,,1576174390.0,1956
715,"Fox News supports CNN in lawsuit against White House, network's president says",69604,,1542212238.0,4305
716,Microsoft co-founder Paul Allen dies of cancer at age 65,69592,,1539640793.0,2673
717,"McDonald’s Says ‘No Mask, No Hamburgers’ In New Ruling On Face Coverings",69560,,1595700112.0,2813
718,Man Charged in U.S. Capitol Riot Worked for the FBI: Lawyer,69540,,1612883176.0,2424
719,Home Depot cancels Black Friday,69531,,1599680015.0,2450
720,"Pope reappears after surgery, backs free universal health care",69492,,1626009170.0,3501
721,Capitol Police order evacuation of some Capitol complex buildings as protests rage outside,69443,,1609959139.0,2901
722,Active shooter at Mandalay Bay Casino in Las Vegas,69431,,1506923479.0,39196
723,"Video surfaces showing Philadelphia police bashing SUV windows, then beating driver while child was in backseat",69432,,1604065763.0,1046
724,A third of the nation's honeybee colonies died last year.,69418,,1495819826.0,3665
725,"Robert Trump, the younger brother of President Donald Trump, dead at age 72",69404,,1597545298.0,4747
726,Cracker Barrel bans an anti-gay pastor from holding an event in one of its stores,69401,,1560968376.0,3578
727,Suspension Lifted of Georgia Student Who Posted Photos of Crowded Hall,69383,,1596812933.0,2876
728,"Amazon hired an army of employees to say nice things about it on Twitter, and it shows how big its reputation problem has gotten",69376,,1535340058.0,4870
729,Man gets 25 years for murdering sister's rapist after meeting him in jail,69338,,1628416757.0,6000
730,Nepal says its tiger population has almost doubled from 2009,69326,,1538913807.0,932
731,"McDonald's makes masks mandatory for all customers, staff",69315,,1627947352.0,4964
732,3 arrested in attack of Chili's hostess who was enforcing coronavirus dining rules,69315,,1597422092.0,3869
733,California bans private prisons – including Ice detention centers | US news,69307,,1568319111.0,3518
734,San Francisco CEO kicked out of restaurant following racist rant caught on camera,69290,,1594155029.0,1569
735,Washington bans anyone under 21 from buying assault rifles,69232,,1546375878.0,11395
736,"Naomi Osaka withdrew from the French Open on Monday, according to her social media, one day after tennis’ Grand Slams threatened disqualification or suspension if she continued to skip press conferences",69220,,1622484744.0,7376
737,India’s prime minister orders lockdown of country of 1.3 billion people for 21 days,69185,,1585062023.0,1622
738,Michigan man jailed for nearly 4 decades exonerated after witness admits to lying,69181,,1607972211.0,3162
739,"Police seize almost 7,000 pounds of cannabis from a truck. But the company that bought it says it's all legal",69165,,1549501561.0,4286
740,Tennessee doctors who spread COVID-19 vaccine misinformation could lose their licenses,69160,,1633865971.0,3681
741,Sailor aboard USS Theodore Roosevelt has passed away due to COVID-19,69126,,1586785643.0,3118
742,Twitter permanently suspends Steve Bannon account after talk of beheading,69087,,1604643212.0,3480
743,Albuquerque will use social workers to respond to certain 911 calls instead of police,69069,,1592263847.0,3649
744,Kavanaugh is confirmed to the Supreme Court by Senate -- live updates,69066,,1538855973.0,30119
745,More police K9s forced into retirement following legalization of recreational marijuana,69015,,1625650896.0,4775
746,Federal court backs California Gov. Gavin Newsom's orders keeping churches closed,68990,,1590339812.0,5573
747,"Outrage ensues as Michigan grants Nestlé permit to extract 200,000 gallons of water per day",68968,,1525106010.0,4167
748,"Judge halts Keystone XL pipeline, citing ‘complete disregard’ for climate",68963,,1544718230.0,2974
749,"Thomas Barrack, chairman of Trump 2017 inaugural fund, arrested on federal charge",68936,,1626806388.0,2331
750,"When gunman advanced on New Zealand mosque, this man ran At Him: Abdul Aziz, 48, is being hailed as a hero for preventing more deaths",68942,,1552741732.0,3557
751,Andrew Yang drops out of presidential race,68846,,1581469793.0,5528
752,"Dr. Fauci throws first pitch, players take knee for racial injustice on Opening Day",68847,,1595549804.0,1975
753,Three former executives of a French telecommunications giant have been found guilty of creating a corporate culture so toxic that 35 of their employees were driven to suicide,68682,,1577104402.0,3057
754,"Family of Tyson employee in Iowa who died of COVID-19 sues company, alleging gross negligence",68656,,1602078041.0,2039
755,12 million Americans set to lose unemployment benefits the day after Christmas,68613,,1605713514.0,6082
756,"""I want you to look me in my eye and say that you're sorry"": Man who lost his eye protesting says he demands a response from the mayor",68611,,1592493043.0,2699
757,BBC Investigation: The 'dead voters' in Michigan who are still alive,68597,,1605355232.0,3418
758,Dogecoin plunges nearly 30 percent after Elon Musk’s SNL appearance,68519,,1620563143.0,9374
759,A 21-year-old college student worked at a Texas hotel for 32 hours alone during a flood. Guests say he's a hero,68499,,1569263949.0,1698
760,Sheffield Lake police chief resigns after putting Ku Klux Klan sign on Black officer’s desk,68497,,1625225539.0,5185
761,"Britney Spears’ attorney filed a petition Thursday asking the court to immediately remove her father as conservator, noting that an investigation may be required into his financial dealings while in control of her estate",68449,,1628194288.0,1847
762,Justice Department appoints special prosecutor for Russia investigation,68435,,1495058728.0,9096
763,"Teacher accidentally fires gun in classroom, students injured",68433,,1521030417.0,7953
764,Arizona Sheriff Joe Arpaio loses bid to have his criminal record wiped clean,68427,,1508460834.0,3444
765,Pharmaceutical giant 'plotted to destroy cancer drugs to drive prices up 4000%',68413,,1492174151.0,5965
766,"Former Trump campaign manager, Brad Parscale, armed, barricades self in Fort Lauderdale home, police called",68409,,1601254409.0,5756
767,A teen who spent 10 hours cleaning up after a protest is rewarded with a car and a college scholarship,68404,,1591477176.0,1307
768,"With a pen stroke, Mississippi drops Confederate-themed flag",68397,,1593556280.0,2491
769,"The Minneapolis police officer who knelt on George Floyd's neck had 18 previous complaints against him, police department says",68369,,1590708990.0,2522
770,Volkswagen and BMW fined $1 billion for running emissions cartel,68356,,1625753027.0,2914
771,'Pharma Bro’ Shkreli loses 2nd bid for early prison release,68310,,1611091328.0,2516
772,Ivanka Trump used a personal email account to send hundreds of emails about government business last year,68296,,1542670860.0,4674
773,"FEMA Contract Called for 30 Million Meals for Puerto Ricans. 50,000 Were Delivered.",68273,,1517930229.0,4045
774,"Jailers Interrupt Ghislaine Maxwell's Sleep Every 15 Minutes to Check If She's Still Breathing, Lawyer Says",68271,,1606262845.0,4050
775,CNN News Crew of Omar Jimenez and 4-member crew Arrested on Live TV,68263,,1590747494.0,5491
776,SCOTUS Rules Police Cannot Search Homes Without Warrants in the Name of 'Community Caretaking',68253,,1621274283.0,3308
777,Harvey Weinstein found guilty in landmark #MeToo moment,68251,,1582562731.0,2578
778,Utah bans conversion therapy for LGBTQ children,68236,,1579718994.0,2474
779,Maine postal workers reassemble high-speed sorting machine,68199,,1602503616.0,1667
780,Flood Destroys Home Of Hate Group Leader Who Claims God Sends Natural Disasters To Punish Gays,68183,,1471483051.0,2959
781,"4 Years After an Execution, a Different Man’s DNA Is Found on the Murder Weapon",68131,,1620406620.0,4394
782,"Mitsubishi pulls Hearthstone tournament sponsorship after ""Free Hong Kong"" gamer ban",68138,,1572398868.0,1980
783,"Background checks blocked a record high 300,000 gun sales",68122,,1624377978.0,6291
784,Brock Turner Loses Appeal of Sexual Assault Conviction,68120,,1533768446.0,5138
785,Vocal anti-vaccine broadcaster dies from COVID-19 complications,68101,,1628278079.0,3306
786,Ex-Arizona police officer acquitted of murder in shooting of unarmed man,68105,,1512789457.0,4402
787,"Police chief: If you think Floyd video shows reasonable force, turn your badge in - CNN Video",68026,,1591208062.0,2194
788,"Manhattan Beach surfer issued $1,000 citation for violating beach closure order, disrespecting lifeguard.",67992,,1585434752.0,2946
789,Louisville police collected negative info about Breonna Taylor's boyfriend after fatal shooting,67978,,1602240679.0,3616
790,"Cops arrest armed men, Texas bar owner who violated order to close - Sheriff said armed men were there to intimidate officers.",67975,,1588700119.0,7141
791,H&M stops buying leather from Brazil over Amazon fires,67981,,1567770474.0,1893
792,Jeff Bezos (CEO of Amazon) is refusing a request for testimony from congress while they threaten subpoena.,67976,,1589632792.0,3959
793,Ex-postal worker charged with tossing absentee ballots,67965,,1603800069.0,3152
794,Colin Kaepernick becomes the face of Nike’s 30th anniversary ‘Just Do It’ campaign,67965,,1536006777.0,9608
795,Actor Kal Penn raises $160k in few hours for Syrian refugees after being told he 'doesn't belong in America',67970,,1485702323.0,4938
796,Israel officially decriminalizes marijuana use,67956,,1488725540.0,3263
797,Popularity of Netflix's 'Tiger King' prompts sheriff to ask for leads in 1997 cold case,67895,,1585600888.0,5586
798,Man found with five ‘fully operational’ pipe bombs was targeting Governor Newsom,67876,,1611805237.0,2706
799,"Actresses, CEOs arrested in nationwide college admissions cheating scam",67879,,1552401593.0,7237
800,Woman Who Called Michelle Obama An 'Ape' Sentenced To Jail For Defrauding FEMA of $18K,67857,,1559505557.0,1257
801,Criminal charges expected this week against Epstein guards,67860,,1574122524.0,2889
802,Two Maine police officers who allegedly beat porcupines to death with their batons while on duty have been fired,67834,,1602291603.0,3703
803,Michigan powerlifter heroically lifts vehicle pinned on top of man after accident.,67833,,1550501863.0,2493
804,Warner's girlfriend warned police he was building a bomb in his RV last year,67829,,1609296161.0,5819
805,"Paul Manafort, Who Once Ran Trump Campaign, Told to Surrender",67798,,1509366421.0,11176
806,Father of boy killed in school massacre wins defamation suit,67797,,1560858036.0,5103
807,1 of 2 protesters hit by car on closed Seattle highway dies,67762,,1593949557.0,10614
808,Providence fire union says police 'profiled' on-duty black firefighter when they held him at gunpoint,67757,,1591493504.0,1999
809,Twitter suspends Marjorie Taylor Greene's account for one week,67743,,1628601374.0,6386
810,"Mayor, Police Chief and other city officials of Iowa town arrested over embezzlement, fraud schemes",67715,,1613309978.0,2116
811,"Aurora Police did not have basis to stop, frisk or restrain Elijah McClain, investigation finds",67669,,1614024862.0,2547
812,Man arrested for groping woman on flight says 'President says it's OK to grab women's private parts',67661,,1540264009.0,4986
813,Principal who banned gay books charged with child pornography,67630,,1573673193.0,1991
814,"Breonna Taylor's boyfriend, Kenneth Walker: ""I'm a million percent sure"" police didn't identify themselves",67620,,1602595917.0,863
815,US Senate healthcare repeal bill fails,67623,,1501220131.0,9413
816,Facebook reports a decline in users in the U.S. and Canada,67605,,1604008950.0,3977
817,9/11 hero who saved hundreds dies of cancer at age 45,67604,,1521420643.0,2157
818,All 50 states and DC have now certified their presidential election results,67554,,1607551774.0,3687
819,"As Texas deep freeze subsides, some households now face electricity bills as high as $10,000",67517,,1613773422.0,6688
820,Fastest growing religion is ‘none’,67514,,1542032933.0,6712
821,1st black woman legislator in Vermont resigns after white supremacists threaten safety of her family,67488,,1540003408.0,6464
822,Oakland passes emergency ‘hazard pay’ ordinance; grocers must pay workers an extra $5 per hour,67463,,1612408676.0,2960
823,A Chinese Cheating Ring at UCLA Reveals an Industry Devoted to Helping International Students Scam Grades,67347,,1556796671.0,6302
824,FBI raids homes of 2 men who held rally on eve of Capitol attack,67269,,1612355921.0,3067
825,"Disney World Closes Mask Loophole, Bans Eating And Drinking While Walking",67275,,1595186453.0,3153
826,"Thea White, voice of Muriel Bagge in Courage the Cowardly Dog, has passed away.",67247,,1627818855.0,1043
827,Hospital Withdraws Job Offer To Doctor Who Tweeted About Giving Jews Wrong Meds,67223,,1554403763.0,6350
828,KKK denied permit to burn cross atop symbolic mountain in Georgia,67229,,1502918039.0,6611
829,Protesters set up guillotine outside of Jeff Bezos’ DC home,67173,,1593535701.0,8307
830,"Half of Teachers Did Not Return to Chicago Public Schools as Ordered on Monday, District Says",67141,,1609878825.0,5059
831,Dozens protest against China during US NBA game,67138,,1571492059.0,2011
832,"Hopkins researchers recommend reclassifying psilocybin, the drug in 'magic' mushrooms, from schedule I to schedule IV",67118,,1538404765.0,3606
833,Police Unions Lose Bid to Keep Disciplinary Records a Secret,67113,,1613561540.0,1478
834,"Amid reports of homelessness and food insecurity, 25,000 employees sue Disneyland for better pay",67067,,1632142974.0,3856
835,Judge Rejects Last-Minute Claim That Pence Can Ignore States' Presidential Electors,67052,,1609552658.0,3732
836,Man leaves €2m to French village that hid his family from Nazis,67045,,1611943950.0,591
837,"A high school student is growing out his hair for his sick sister. When administrators asked him to cut it, he withdrew from school",67034,,1581259367.0,3945
838,Police raid illegal rave inside abandoned Toys R Us,66987,,1523410054.0,2063
839,Sen. Ron Johnson tests positive for COVID-19,66982,,1601732143.0,4401
840,"WaPost: Girl dies of dehydration while in Border Patrol custody, 'had not eaten for days'",66962,,1544750327.0,6360
841,ABC News' Amy Robach caught on hot mic saying network spiked Jeffrey Epstein bombshell,66880,,1572976386.0,6495
842,'I’m getting shot': attacks on journalists surge in US protests,66874,,1591362484.0,3066
843,Federal Court Rules Suspicionless Searches of Travelers’ Phones and Laptops Unconstitutional,66840,,1573593008.0,1856
844,"Woman charged with attempted murder in beating of man, 92, with brick",66827,,1531569300.0,7069
845,"George Floyd death: Los Angeles police slammed for shooting homeless, wheelchair-bound man",66817,,1591448134.0,2084
846,Apple confirms it uses Google's cloud for iCloud,66804,,1519660550.0,2568
847,Texas anti-mask ‘Freedom Defender’ dies of COVID at age 30,66783,,1630496165.0,139
848,George Floyd protesters turn White House fence into memorial wall,66683,,1591568147.0,1832
849,Covid deniers removed from at capacity hospital,66658,,1609771033.0,2692
850,Texas mayor apologizes after violating stay-at-home order to go to nail salon,66662,,1587835475.0,3162
851,Florida insurance agent fired after mask meltdown at Costco,66594,,1594225107.0,5876
852,"Bitcoin investors may be out $190 million after the only guy with the password dies, firm says",66542,,1549305629.0,3778
853,L.A. area cop seen on video punching handcuffed woman twice in face,66536,,1619175319.0,7127
854,Active shooter reported at Pitfsburgh synagogue,66512,,1540651430.0,21781
