,score,title,selftext,created_utc
249,89826.0,Houston hospital suspends 178 employees who refused Covid-19 vaccination,,1623281866.0
250,89690.0,Native Americans renew decades-long push to reclaim millions of acres in the Black Hills,,1606569511.0
251,89613.0,New York Times reporter infected with Covid-19 says the White House is not doing contact tracing,,1601922268.0
252,89603.0,"Terry Crews Testifies Before Senate On Sexual Assault, Says He Won’t Be In ‘Expendables 4’ After Producer Threatened “Trouble”",,1530044689.0
253,89376.0,"Chicago teachers vote to teach from home, defying district",,1611521663.0
254,89365.0,"Fed to ban policymakers from owning individual stocks, restrict trading following controversy",,1634839338.0
255,89208.0,Comcast asks the FCC to prohibit states from enforcing net neutrality,,1509800715.0
256,89097.0,Law Enforcement fires paint projectile at residents on porch during curfew,,1590938887.0
257,89020.0,"Ann Arbor decriminalizes magic mushrooms, psychedelic plants",,1601410746.0
258,88669.0,Armed man arrested at Charlotte polling site after being banned,,1604437366.0
259,88639.0,Corey Feldman launches campaign to expose Hollywood pedophile ring,,1508975675.0
260,88590.0,A principal in Florida said he couldn't confirm the Holocaust was a 'factual' event. The school district just fired him,,1572484990.0
261,88498.0,The AP has learned ex-Michigan Gov. Snyder and others have been told they’re being charged in Flint water scandal.,,1610480308.0
262,88301.0,Michael Cohen sentenced to 3 years in prison,,1544634464.0
263,88187.0,Facebook fails to convince lawmakers it needs to track your location at all times,,1576679927.0
264,88175.0,Woman wanted for allegedly stealing Nancy Pelosi’s laptop arrested,,1611032293.0
265,87944.0,One in 4 U.S. adults is now fully vaccinated,,1617881976.0
266,87921.0,CNN's Anthony Bourdain dead at 61,,1528456924.0
267,87884.0,Marine kicked out of Marine Corps for role in Charlottesville white supremacist march | WTOP,,1533653758.0
268,87835.0,FBI raids New York City police union headquarters,,1633449271.0
269,87785.0,Proud Boys leader Joseph Biggs arrested in Florida in connection with the Capitol riot,,1611194755.0
270,87719.0,St. Louis police officers on trial for beating Black undercover detective during protest,,1616840070.0
271,87701.0,Fauci says it might be time to mandate masks as Covid-19 surges across US,,1603501979.0
272,87685.0,Trump acquitted for second time following historic Senate trial,,1613249817.0
273,87544.0,Ex-Trump adviser sold $31m in shares days before president announced steel tariffs,,1520013333.0
274,87518.0,REPORT: Kenosha man charged with illegally buying gun for Kyle Rittenhouse,,1604962887.0
275,87491.0,"Verne Troyer, best known as Mini-Me in ""Austin Powers,"" has died",,1524342956.0
276,87368.0,"Cops admit vandalizing cars of man who filed complaint against them, prosecutor says",,1598407261.0
277,87282.0,Man with foot up on desk in Pelosi's office at Capitol arrested,,1610131121.0
278,87178.0,Man who plowed into Charlottesville crowd found guilty,,1544220672.0
279,87182.0,Breonna Taylor's boyfriend Kenneth Walker files federal lawsuit against Louisville police,,1615671517.0
280,87148.0,Stephen Hawking to Be Buried Between Darwin and Newton.,,1529069518.0
281,87048.0,"Publix buys 5 million pounds of produce to support local farmers, donates to food banks",,1594592192.0
282,87014.0,Trump withdrawing US from Paris climate agreement,,1496346575.0
283,86972.0,Grandma and young man she accidentally invited to Thanksgiving are spending their fourth holiday together - CBS News,,1574947312.0
284,86900.0,"Fox News mandates that its employees disclose vaccination status, contradicting rhetoric from its top stars",,1629322666.0
285,86845.0,President Trump being taken to Walter Reed as a 'precautionary measure',,1601673608.0
286,86788.0,A Navy veteran says he was beaten and pepper sprayed by authorities while attending his first protest in Portland,,1595241178.0
287,86728.0,"Nestle has been bottling and selling water it has no right to in drought-stricken California, state says",,1514461726.0
288,86708.0,OnlyFans says it will no longer ban porn in stunning U-turn after user backlash,,1629896270.0
289,86643.0,"50,000 net neutrality complaints were excluded from FCC’s repeal docket",,1512504919.0
290,86596.0,New York City breaks record: 58 straight days with no pedestrian deaths,,1589368535.0
291,86488.0,F.B.I. Raids Office of Trump’s Longtime Lawyer Michael Cohen,,1523304046.0
292,86474.0,Andrew Cuomo To Resign Amid Sexual Harassment Allegations,,1628611702.0
293,86393.0,Teen who shared photo of packed high school hallway says she's receiving threats,,1597047853.0
294,86306.0,California votes to bar schools from starting before 8:30am to help give students more sleep,,1535829490.0
295,86169.0,Home surveillance camera shows officer lied on report when charging man with major crimes,,1616073311.0
296,86160.0,Black disabled Veteran Sean Worsley sentenced to spend 60 months in Alabama prison for medical marijuana,,1594663994.0
297,86158.0,Record 9 million comments flood FCC on net neutrality,,1500723796.0
298,85908.0,House votes to strip Rep. Marjorie Taylor Greene of committee assignments,,1612482998.0
299,85847.0,Judge drops charges against 28 Black Lives Matter protesters in Detroit,,1610816499.0
300,85810.0,Swedish DJ Avicii Dead at 28,,1524245300.0
301,85619.0,Twitter hides Trump tweet for 'glorifying violence',,1590741919.0
302,85437.0,Dr. Anthony Fauci to throw first pitch for Nationals on Opening Day,,1595278005.0
303,85421.0,AP Calls Nevada For Joe Biden,,1604776106.0
304,85404.0,Hong Kong protesters form 28-mile human chain demanding democracy,,1566583970.0
305,85363.0,Danny DeVito Abruptly Loses Twitter Verification After Tweeting Support For Nabisco Strike,,1629422242.0
306,85319.0,Oxygen-dependent man dies 12 minutes after PG&E cuts power to his home,,1570883005.0
307,85304.0,U.S. Supreme Court rejects Texas lawsuit,,1607729997.0
308,85285.0,Facebook has shut down the personal accounts of a pair of New York University researchers and shuttered their investigation into misinformation spread through political ads on the social network.,,1628104609.0
309,85248.0,"In blow to Trump, golf’s PGA to strip major championship from Trump-owned course",,1610334815.0
310,85223.0,Kaepernick and Fauci will be honored as Robert F. Kennedy Human Rights award laureates,,1596041328.0
311,85097.0,LA officially becomes 'no-kill' city as animal shelters achieve 90% save rate,,1616236903.0
312,85075.0,"U.S. says Ghislaine Maxwell should stay behind bars, deserves no bail",,1608320161.0
313,84895.0,Chicago Police: 4 in custody after young man tortured on Facebook Live,,1483571067.0
314,84866.0,"Trump pardons former national security adviser Michael Flynn, who pleaded guilty to lying to the FBI",,1606339205.0
315,84850.0,"FBI cannot even look at your phone lock screen without a warrant, rules judge",,1590229849.0
316,84637.0,Five officials will face manslaughter charges for Flint water crisis,,1497463793.0
317,84533.0,Bill Gates and Melinda Gates are splitting up after 27 years,,1620074142.0
318,84510.0,Judge says US government can be sued for Flint water crisis,,1555688098.0
319,84494.0,Former pharma CEO pleads guilty to bribing doctors to prescribe addictive opioids,,1547127184.0
320,84474.0,For the first time in 25 years New York City didn't have a single shooting over the weekend,,1539712564.0
321,84372.0,Man jailed for life over $20 marijuana sale has been freed,,1608235736.0
322,84284.0,Korea leaders release joint statement declaring there will be no more war on the Korean Peninsula,,1524820065.0
323,84274.0,University of Alabama orders faculty to keep quiet about outbreak,,1598798817.0
324,84186.0,50 Cent forgot he had a stash of Bitcoin now worth $8m,,1516906789.0
325,84111.0,Papa John sues Papa John's,,1532634170.0
326,84031.0,Former Wisconsin pharmacist who tampered with COVID vaccines sentenced to 3 years in federal prison,,1623168422.0
327,83907.0,"Child porn ring leader beaten to death at detention center, authorities say",,1547268337.0
328,83866.0,"Biden wins Georgia and Trump wins North Carolina, the final states to be called.",,1605298718.0
329,83864.0,Dominion Voting sues Fox for $1.6B over 2020 election claims,,1616757362.0
330,83844.0,Christopher Columbus statue beheaded in Boston,,1591793419.0
331,83811.0,A protester knelt down to tell police he loves and respects them. They threw him in jail.,,1591181632.0
332,83712.0,Right-wing social media app Parler has been removed from the Google Play store,,1610155923.0
333,83683.0,Canadian air traffic controllers send pizzas to U.S. counterparts working without pay,,1547407439.0
334,83610.0,Judge reinstates third-degree murder charge against ex-cop charged in George Floyd's death,,1615473615.0
335,83415.0,US to deploy thousands of additional troops to Middle East following Soleimani killing,,1578073119.0
336,83380.0,NYPD officers are no longer protected from civil lawsuits after city council passes police reform legislation,,1616727069.0
337,83365.0,"Don’t reconnect mailing machines, Postal Service tells plants. Tacoma does it anyway",,1598128141.0
338,83319.0,YouTube Bans Minors From Streaming Unless Accompanied by Adult,,1559576260.0
339,83313.0,"Son Tipped Off F.B.I. About His Father, Who Is Charged in Capitol Riot",,1611661842.0
340,83282.0,"Jessica Walter Dies: Emmy-Winning ‘Arrested Development’, ‘Archer’ Actress Was 80",,1616698902.0
341,83215.0,Officer who shot Ashli Babbitt during Capitol riot breaks silence: 'I saved countless lives',,1630017184.0
342,83096.0,Oregon construction worker fired for refusing to attend Bible study sues former employer,,1535636930.0
343,83051.0,FTC Shuts Down 4 Robocall Groups Responsible For Billions of Illegal Robocalls,,1553703977.0
344,82940.0,A truck driver from Brooklyn wins $298 million Powerball Jackpot,,1548513087.0
345,82857.0,"Autopsy finds broken bones in Jeffrey Epstein’s neck, deepening questions around his death",,1565840019.0
346,82836.0,"'You shouldn't be able to breathe,' officer tells man before he dies",,1621556078.0
347,82832.0,Worried voters are buying stamps and merch to fund the USPS,,1597616966.0
348,82734.0,"EA’s day of reckoning is here after ‘Star Wars’ game uproar, $3 billion in stock value wiped out",,1511907625.0
349,82718.0,Buffalo officials ask state to probe firing of Black officer who stopped white colleague's chokehold,,1592085034.0
350,82709.0,Officer who knelt with George Floyd protesters accused of insubordination a day later - The San Francisco Examiner,,1591887148.0
351,82707.0,U.S. Intelligence Publicly Accuses Iran and Russia of Interfering in 2020 Election,,1603323863.0
352,82680.0,Waffle House closes 365 locations across the U.S.,,1585096630.0
353,82688.0,The US debt is now projected to be larger than the US economy,,1602195852.0
354,82664.0,An 11-year-old girl in Zimbabwe jumped on top of a crocodile and gouged its eyes out when it attacked her 9-year-old friend,,1572731242.0
355,82637.0,EPA is now allowing asbestos back into manufacturing,,1533605990.0
356,82557.0,China Shuts Down Its Legal Ivory Trade,,1514729019.0
357,82525.0,Family O Five YouTube taken down permanently,,1531964707.0
358,82484.0,Texas school district makes masks part of dress code to get around Gov. Abbott's order,,1629280823.0
359,82461.0,"Black man shot dead while jogging in Georgia, and two months later, no arrests",,1588557439.0
360,82328.0,"FBI director says antifa is an ideology, not an organization",,1600369134.0
361,82311.0,Connecticut is 1st state to make all prison phone calls free,,1624305401.0
362,82235.0,Fox News Host Tucker Carlson Loses More Advertisers,,1591980351.0
363,82162.0,White House turns down offers from CDC to help with contact tracing,,1601989955.0
364,82133.0,Judge rules Michigan stay-at-home order doesn’t infringe on constitutional rights,,1588213987.0
365,82083.0,Home Depot to spend $1 billion more on employees' pay as sales surge,,1605618487.0
366,82056.0,Police find and arrest spectator who caused mass Tour de France crash,,1625061090.0
367,81940.0,Former Marine steals truck after Vegas shooting and drives nearly 30 victims to hospital,,1507051329.0
368,81903.0,"ICE arrests rapper 21 Savage, says he is actually British and overstayed visa",,1549226619.0
369,81838.0,"With no end in sight to government shutdown, TSA agents at Hawaii airports start to resign",,1548383344.0
370,81818.0,Single anonymous donor gives $40 million to fund 50 civil rights lawyers,,1610985033.0
371,81730.0,James Alex Fields Jr. sentenced: Man gets life plus 419 years in deadly Charlottesville car attack - CBS News,,1563213723.0
372,81721.0,"Facebook has decided not to limit how political ads are targeted to specific groups of people, as Google has done. Nor will it ban political ads, as Twitter has done. And it still won't fact check them, as it's faced pressure to do.",,1578570641.0
373,81711.0,"United Airlines will require its 67,000 U.S. employees to get vaccinated, a first for U.S. carriers",,1628250824.0
374,81676.0,"Vermont becomes first state to reach 80% vaccination; Gov. Scott says, ""There are no longer any state Covid-19 restrictions. None.""",,1623684509.0
375,81604.0,Jeff Bezos: World's richest man pledges $10bn to fight climate change,,1581968324.0
376,81562.0,"In a first, FBI to begin collecting national data on police use of force",,1542935211.0
377,81545.0,Biden calls mass killing of Armenians genocide,,1619281092.0
378,81498.0,"Doctors post blood-soaked photos after NRA tells them to ""stay in their lane""",,1542076114.0
379,81477.0,GameStop to permanently close over 300 stores,,1585273998.0
380,81470.0,"Two travellers from U.S. fined $20,000 each for fake vaccination documents.",,1627671358.0
381,81427.0,California bans secret condom removal during sex and enhances punishment for spousal rape,,1633697967.0
382,81400.0,Johnson & Johnson agrees to stop selling opioids nationwide in $230 million settlement with New York state,,1624722057.0
383,81403.0,Man killed by cops during Alabama mall shooting had a permit: Actual shooter remains at large,,1543155479.0
384,81373.0,Britney Spears' new attorney files to remove Jamie Spears as conservator,,1627332180.0
385,81340.0,Twitter temporarily restricts Donald Trump Jr.'s account after he posts video claiming masks are unnecessary,,1595952414.0
386,81298.0,Tech writer suggests '10 Year Challenge' may be collecting data for facial recognition algorithm,,1547990414.0
387,81261.0,"NYPD Officer Luis Alvarez, 9/11 First Responder Who Testified Before Congress With Jon Stewart, Dies",,1561816781.0
388,81253.0,U.S. Homeland Security confirms three units sent paramilitary officers to Portland,,1595362906.0
389,81140.0,"Japanese bonsai owners urge thieves to water stolen 400-year-old tree worth $127,700",,1549963918.0
390,81090.0,CVS Puts Out Generic Competitor To EpiPen At A 6th Of The Price,,1484230140.0
391,81006.0,Marine commandant banishes Confederate symbols from all Corps installations,,1582769117.0
392,81005.0,"Federal appeals court rules 2-1, you have the right to film the police",,1488035245.0
393,80997.0,Pentagon to require COVID vaccine for all troops by Sept. 15,,1628528321.0
394,80986.0,"Warnock, Ossoff win in Georgia, handing Dems Senate control",,1609968592.0
395,80961.0,Teen registered people to vote as they waited in Popeyes line for new chicken sandwich,,1566841943.0
396,80939.0,Pharma bro Martin Shkreli is denied minimum security camp and sent to federal prison in New Jersey,,1524069401.0
397,80890.0,Pope Francis: fake and sensationalised news 'a very serious sin',,1513525338.0
398,80879.0,"Cincinnati church wipes out $46.5 million in medical debt for 45,000 families",,1582909011.0
399,80835.0,"DC protester arrested with 11 Molotov cocktails, several guns had list of 'good guys,' 'bad guys': DOJ",,1610500921.0
400,80818.0,Amazon raises minimum wage to $15 for all US employees,,1538475386.0
401,80811.0,Coronavirus: Florida scientist was fired for refusing to 'manipulate' COVID-19 data,,1589916889.0
402,80736.0,Amazon engineer quits after he 'snapped' when the company fired workers who called for protections,,1588607383.0
403,80629.0,Woman in video seen coughing on customers loses her job,,1631206802.0
404,80616.0,"Jeffrey Epstein denied bail, will remain jailed pending trial on sex trafficking charges",,1563464240.0
405,80611.0,Net neutrality protesters take to the streets,,1512694709.0
406,80582.0,Emergency alert about ballistic missile sent to Hawaii residents; EMA says ‘no threat’,,1515868273.0
407,80538.0,"Woman shot herself in the head while cuffed with hands behind her back during traffic stop, police say",,1552932060.0
408,80415.0,"NYPD used excessive force during George Floyd protests, city investigation finds",,1608304244.0
409,80403.0,‘You’re Gonna Kill Me’: Body-Cam Footage Shows Cops Mocking Dallas Man as He Dies,,1564603404.0
410,80395.0,Explosive Devices Found in Mail Sent to Hillary Clinton and Obama,,1540387968.0
411,80371.0,"Video showing hundreds of shackled, blindfolded prisoners in China is 'genuine'",,1569070509.0
412,80238.0,Alabama governor signs bill to remove anti-gay language from sex education curriculum,,1619710409.0
413,80185.0,Scientology facilities in Tennessee closed after police find patients held against their will,,1493980691.0
414,80186.0,Video shows USPS mail being dumped in a California parking lot. A postal union says USPS employees weren't involved,,1599561907.0
415,80126.0,"Dallas officer goes home to wrong apartment, kills man inside, police say",,1536323853.0
416,80003.0,Judge Who Advised Woman to 'Close Your Legs' to Avoid Sexual Assault Permanently Removed From the Bench,,1590529140.0
417,79951.0,"Aretha Franklin dies in Detroit, surrounded by family and friends",,1534427886.0
418,79827.0,Banks halt business with Trump after U.S. Capitol riots,,1610450472.0
419,79813.0,"Illinois is going to expunge marijuana convictions from 800,000 criminal records - CNN",,1561688097.0
420,79786.0,Illinois State Senate passes measure designating neo-Nazi groups as terrorists,,1502851153.0
421,79750.0,FBI: Video evidence shows noose found in garage of Bubba Wallace had been there since Oct. 2019,,1592947979.0
422,79653.0,U.S. Postmaster General to pause all operational reforms after outcry,,1597772378.0
423,79642.0,"17-year-old Walmart employee quits over store intercom: 'Nobody should work here, ever'",,1544908702.0
424,79587.0,Amazon's hourly workers lose monthly bonuses and stock awards as minimum wage increases,,1538600903.0
425,79476.0,"Twitter Employees Can Work From Home Forever, CEO says",,1589305540.0
426,79429.0,"Global rich must cut their carbon footprint 97% to stave off climate change, UN says",,1608153534.0
427,79411.0,Rush Limbaugh says his lung cancer is terminal,,1603194395.0
428,79413.0,Illegal Brooklyn bar found with nearly 300 people inside,,1599498271.0
429,79366.0,Global warming: April was 400th straight warmer-than-average month,,1526570140.0
430,79327.0,Couple who yelled 'white power' at Black man and his girlfriend arrested for hate crimes,,1596322799.0
431,79298.0,The United States is now averaging 2 million vaccine doses administered per day.,,1614907866.0
432,79168.0,"Multiple boats in distress, sinking at Trump Boat Parade on Lake Travis",,1599334411.0
433,79114.0,South Carolina bill would ban animal cruelty offenders from adopting pets for five years,,1548552124.0
434,79081.0,"Winner of $560 Million Powerball Can Keep Her Name Private, Judge Rules",,1520884842.0
435,79068.0,"George Floyd protests: San Jose police fire rubber bullets at own bias trainer, rupture his testicle",,1591737645.0
436,79061.0,One dead in Louisville after police and national guard 'return fire' on protesters,,1591009249.0
437,79030.0,Police officers shoot and kill Los Angeles security guard: 'He ran because he was scared',,1592581830.0
438,79019.0,"A veteran died in a Florida jail. Two years later, video shows he was tased, left convulsing in a cell.",,1605391271.0
439,78994.0,Denver police fire pepper balls at man yelling that his pregnant fiancée is in car.,,1591440963.0
440,78953.0,"Japanese woman turns 117 years old, extends record as world's oldest person",,1578224021.0
441,78825.0,A vegan couple have been charged with first-degree murder after their 18-month-old son starved to death on a diet of only raw fruit and vegetables,,1576845446.0
442,78744.0,"Proud Boys' leader Enrique Tarrio arrested in DC, law enforcement sources say",,1609803054.0
