,score,title,selftext,created_utc
625,72426.0,New Zealand election: Jacinda Ardern wins second term after rival concedes,,1602927176.0
626,72427.0,"Eric Carle, Author of ‘The Very Hungry Caterpillar,’ Dies at 91",,1622069609.0
627,72410.0,Alabama city removes Confederate statue without notice,,1591611207.0
628,72382.0,"Mass. parents knew kid had coronavirus, sent him to 1st day of school anyway, officials say",,1600366024.0
629,72298.0,Jeffrey Epstein Arrested For Sex Trafficking of Minors,,1562459031.0
630,72237.0,Teacher says she was fired for giving zeroes to students who didn't turn in their work,,1537886143.0
631,72210.0,Tony Hawk announces his mother has died after a long battle with Alzheimer's,,1577291741.0
632,72201.0,The Gorilla Foundation is sad to announce the passing of our beloved Koko,,1529564622.0
633,72134.0,Oregon governor issues emergency fire order; three prisons evacuated. The state's largest firefighting helicopters are unavailable; they were deployed to Afghanistan.,,1599742933.0
634,72131.0,All of West Virginia's public schools are closed due to a teacher walk-out over pay,,1519314587.0
635,72128.0,"F.D.A. Bans School Electric Shock Devices. The ban is national, but it is squarely targeted at a single school in Massachusetts that has been using electric shocks to condition students’ behavior for decades.",,1583498443.0
636,72088.0,Outrage over video showing police macing child at Seattle protest,,1592218485.0
637,72080.0,"Father buys $64,259 ad calling for police to reopen investigation into son's death",,1517323341.0
638,72080.0,Virtually all hospitalized Covid patients have one thing in common: They're unvaccinated,,1623548121.0
639,72072.0,"Family members viewed long-secret body-camera video this week of a Black man who died in Louisiana State Police custody, their attorney calling it damning footage that shows troopers choking and beating the man, repeatedly jolting him with stun guns and dragging him face-down across the pavement",,1602803017.0
640,72070.0,"Whistleblower claims Mormon Church stockpiled $100 billion in charitable donations, dodged taxes",,1576556571.0
641,71873.0,MAGA protesters damage historic Black church in DC,,1607902923.0
642,71878.0,FBI agents swarm Jeffrey Epstein's private Caribbean island,,1565646001.0
643,71824.0,Michigan governor extends state emergency order despite Trump tweet backing protesters,,1588359162.0
644,71816.0,Police union will not ID officer in Australian TV crew attack,,1591334874.0
645,71811.0,"Tokyo 2020: Olympics to be postponed until 2021, says IOC member",,1584987158.0
646,71804.0,Rapper DMX Has Died at 50,,1617985093.0
647,71746.0,"Disney to stop paying 100,000 workers but is still on track to give shareholders $1.5 billion",,1587433658.0
648,71686.0,"Elon musk pledges to fix Flint, MI water problem",,1531350319.0
649,71685.0,Russia to Withdraw Troops From Ukraine Border,,1619093934.0
650,71651.0,Federal Investigators Execute Search Warrant at Rudy Giuliani’s Apartment,,1619625953.0
651,71634.0,Dutch parliament: China's treatment of Uighurs is genocide,,1614343283.0
652,71612.0,"Oregon Gov. Kate Brown will declare emergency, ready National Guard ahead of election",,1604340421.0
653,71612.0,White supremacist killed in shootout with California deputies,,1601088053.0
654,71572.0,"Christopher Columbus statue torn down, thrown in lake by protesters",,1591758270.0
655,71540.0,"Black men arrested with weapons at protest while armed white militia men avoid charges in Greensboro, NC",,1591507104.0
656,71532.0,"Denver police officer fired for ""Let's start a riot"" post during George Floyd protest",,1591183961.0
657,71445.0,White House suspends CNN reporter's access,,1541640937.0
658,71425.0,Calls grow louder to boycott Beijing’s Olympics — and analysts warn of retaliation from China,,1617706875.0
659,71397.0,Police Officers sue Donald Trump for injuries resulting from capital riot,,1617217787.0
660,71380.0,Komodo island is reportedly closing until 2020 because people keep stealing the dragons,,1554214123.0
661,71356.0,THP trooper terminated after pulling face mask off protester,,1597506787.0
662,71329.0,College-bound high school football player ruled ineligible because he's homeless,,1537639959.0
663,71331.0,A woman who allegedly coughed on a baby no longer has her school district job,,1594084670.0
664,71262.0,Ghislaine Maxwell: Jeffrey Epstein's former girlfriend denied bail,,1609187395.0
665,71220.0,Twitter bans political ads after Facebook refused to do so,,1572466131.0
666,71162.0,The parents of a nonverbal man killed by an off-duty officer in Costco say they want to see video of the shooting,,1567039777.0
667,71143.0,NYC to terminate Trump contracts after Capitol insurrection,,1610547711.0
668,71078.0,Man who filmed Ahmaud Arbery video charged with murder,,1590098616.0
669,71033.0,Religious Parents Who Refused to Take Son to Hospital and Thought God Would Resurrect Him Found Guilty of First Degree Murder.,,1488105989.0
670,70992.0,Trump Foundation agrees to dissolve under court supervision,,1545149227.0
671,70978.0,Poll worker fired for turning away voters with BLM shirts,,1603159017.0
672,70951.0,Harvey Weinstein Indicted in Los Angeles on Sex Crimes Charges,,1578334498.0
673,70918.0,Supreme Court strikes down Louisiana law that would have limited state to one abortion clinic,,1593440169.0
674,70920.0,Officer with knee to George Floyd's neck to be tried alone,,1610462380.0
675,70821.0,"On-duty NYPD officers 'handcuffed 17-year-old girl, took her to deserted spot and raped her'",,1506879215.0
676,70811.0,Former officers charged in George Floyd killing want court proceedings recorded and broadcast,,1593186777.0
677,70763.0,New York City declares Juneteenth official holiday,,1592647320.0
678,70732.0,Interpol issues wanted notice for wife of U.S. diplomat sought over fatal UK car crash: ITV,,1589213839.0
679,70648.0,"Indiana man, 34, who impregnated 10-year-old girl, gets over 100 years in prison",,1537530311.0
680,70639.0,NASA Fixes Mars Lander By Telling It to Hit Itself With a Shovel,,1584579634.0
681,70630.0,Walmart closing stores on Thanksgiving,,1595343035.0
682,70562.0,"U.S. reports more than 100,000 COVID-19 cases for seventh day in a row",,1605095054.0
683,70549.0,New York City to try responding to mental health calls without police,,1605047918.0
684,70489.0,"Texas Gov. Abbott, who banned mask mandates, tests positive for Covid",,1629234159.0
685,70411.0,Anti-vaxxers banned from raising money on GoFundMe,,1555336476.0
686,70392.0,Delta wants other airlines to share ‘no-fly’ lists of unruly passengers,,1632491228.0
687,70318.0,"Dominion sues Mike Lindell, the MyPillow chief, over election fraud claims.",,1614001781.0
688,70270.0,San Francisco officer is charged with on-duty homicide. The DA says it's a first,,1606222238.0
689,70272.0,Goldman Sachs CEO David Solomon gets a 20% raise to $27.5 million,,1584738025.0
690,70174.0,"Breonna Taylor grand jury members allowed to speak, judge says",,1603219369.0
691,70154.0,US health insurers doubled profits in second quarter amid pandemic,,1597402242.0
692,70152.0,Kellyanne Conway announces she tested positive for coronavirus,,1601692057.0
693,70150.0,"Man charged with infecting 22 people with Covid after going to gym and work with symptoms. He told colleagues ‘I’m going to give you all the coronavirus’, police say",,1619355472.0
694,70114.0,Sen. Lindsey Graham tests positive for COVID-19,,1627931962.0
695,70118.0,"In 2000, a Disneyland ticket cost $41. It's just increased to $164.",,1635253504.0
696,70069.0,"Postal worker admits fabricating allegations of ballot tampering, officials say",,1605058696.0
697,70060.0,Leaked emails show Washington state Rep. Matt Shea endorsed training children to fight in holy war,,1565997070.0
698,70041.0,Baltimore votes to become first large U.S. city to ban water privatization,,1542162259.0
699,70038.0,Shooting at South Florida high school,,1518638190.0
700,70040.0,Colorado district attorney 'incredibly frustrated' he's unable to prosecute cop found drunk in patrol car,,1581035304.0
701,70031.0,Recreational use of marijuana now legal in Montana,,1609524616.0
702,70013.0,President Donald Trump ordered to pay $2M to collection of nonprofits as part of civil lawsuit,,1573152955.0
703,70011.0,"Comcast, Cox, Frontier All Raising Internet Access Rates for 2018",,1513715775.0
704,69894.0,New York Democrat Ritchie Torres elected as the first openly gay Black member of Congress,,1604529655.0
705,69880.0,Mother stabs rapist to death after catching him attacking her daughter,,1545076678.0
706,69853.0,Salma Hayek divulges years of terrifying abuse by Harvey Weinstein,,1513198571.0
707,69844.0,Same-sex penguin couple welcomes baby chick after adopting and hatching an egg together,,1598445363.0
708,69830.0,School board gets death threats after teacher handcuffed after questioning pay raise,,1515600550.0
709,69732.0,"911 call from Breonna Taylor's shooting death released: ""Somebody kicked in the door and shot my girlfriend""",,1590786828.0
710,69686.0,U.S. judge orders USPS to reinforce 'extraordinary measures' ballot delivery policy,,1604315411.0
711,69673.0,"Moderna Covid vaccine candidate almost 95% effective, trials show",,1605528177.0
712,69636.0,Radiohead Donates Money to Climate Change Group Instead of Paying Ransom to Hackers. The band released hours of hacked recordings rather than pay ransom money to the hacker who stole them.,,1560275904.0
713,69613.0,Major League Baseball and player's union agree to opioid testing; marijuana removed as 'drug of abuse',,1576174390.0
714,69606.0,"Fox News supports CNN in lawsuit against White House, network's president says",,1542212238.0
715,69594.0,Microsoft co-founder Paul Allen dies of cancer at age 65,,1539640793.0
716,69558.0,"McDonald’s Says ‘No Mask, No Hamburgers’ In New Ruling On Face Coverings",,1595700112.0
717,69543.0,Man Charged in U.S. Capitol Riot Worked for the FBI: Lawyer,,1612883176.0
718,69523.0,Home Depot cancels Black Friday,,1599680015.0
719,69487.0,"Pope reappears after surgery, backs free universal health care",,1626009170.0
720,69450.0,Capitol Police order evacuation of some Capitol complex buildings as protests rage outside,,1609959139.0
721,69436.0,Active shooter at Mandalay Bay Casino in Las Vegas,,1506923479.0
722,69421.0,"Video surfaces showing Philadelphia police bashing SUV windows, then beating driver while child was in backseat",,1604065763.0
723,69422.0,A third of the nation's honeybee colonies died last year.,,1495819826.0
724,69404.0,"Robert Trump, the younger brother of President Donald Trump, dead at age 72",,1597545298.0
725,69405.0,Cracker Barrel bans an anti-gay pastor from holding an event in one of its stores,,1560968376.0
726,69381.0,Suspension Lifted of Georgia Student Who Posted Photos of Crowded Hall,,1596812933.0
727,69370.0,"Amazon hired an army of employees to say nice things about it on Twitter, and it shows how big its reputation problem has gotten",,1535340058.0
728,69336.0,Man gets 25 years for murdering sister's rapist after meeting him in jail,,1628416757.0
729,69333.0,Nepal says its tiger population has almost doubled from 2009,,1538913807.0
730,69314.0,"McDonald's makes masks mandatory for all customers, staff",,1627947352.0
731,69316.0,3 arrested in attack of Chili's hostess who was enforcing coronavirus dining rules,,1597422092.0
732,69307.0,California bans private prisons – including Ice detention centers | US news,,1568319111.0
733,69292.0,San Francisco CEO kicked out of restaurant following racist rant caught on camera,,1594155029.0
734,69229.0,Washington bans anyone under 21 from buying assault rifles,,1546375878.0
735,69219.0,"Naomi Osaka withdrew from the French Open on Monday, according to her social media, one day after tennis’ Grand Slams threatened disqualification or suspension if she continued to skip press conferences",,1622484744.0
736,69192.0,India’s prime minister orders lockdown of country of 1.3 billion people for 21 days,,1585062023.0
737,69190.0,Michigan man jailed for nearly 4 decades exonerated after witness admits to lying,,1607972211.0
738,69164.0,"Police seize almost 7,000 pounds of cannabis from a truck. But the company that bought it says it's all legal",,1549501561.0
739,69125.0,Sailor aboard USS Theodore Roosevelt has passed away due to COVID-19,,1586785643.0
740,69123.0,Tennessee doctors who spread COVID-19 vaccine misinformation could lose their licenses,,1633865971.0
741,69086.0,Twitter permanently suspends Steve Bannon account after talk of beheading,,1604643212.0
742,69070.0,Albuquerque will use social workers to respond to certain 911 calls instead of police,,1592263847.0
743,69066.0,Kavanaugh is confirmed to the Supreme Court by Senate -- live updates,,1538855973.0
744,69016.0,More police K9s forced into retirement following legalization of recreational marijuana,,1625650896.0
745,68986.0,Federal court backs California Gov. Gavin Newsom's orders keeping churches closed,,1590339812.0
746,68972.0,"Outrage ensues as Michigan grants Nestlé permit to extract 200,000 gallons of water per day",,1525106010.0
747,68958.0,"Judge halts Keystone XL pipeline, citing ‘complete disregard’ for climate",,1544718230.0
748,68948.0,"Thomas Barrack, chairman of Trump 2017 inaugural fund, arrested on federal charge",,1626806388.0
749,68938.0,"When gunman advanced on New Zealand mosque, this man ran At Him: Abdul Aziz, 48, is being hailed as a hero for preventing more deaths",,1552741732.0
750,68847.0,Andrew Yang drops out of presidential race,,1581469793.0
751,68845.0,"Dr. Fauci throws first pitch, players take knee for racial injustice on Opening Day",,1595549804.0
752,68686.0,Three former executives of a French telecommunications giant have been found guilty of creating a corporate culture so toxic that 35 of their employees were driven to suicide,,1577104402.0
753,68658.0,"Family of Tyson employee in Iowa who died of COVID-19 sues company, alleging gross negligence",,1602078041.0
754,68613.0,12 million Americans set to lose unemployment benefits the day after Christmas,,1605713514.0
755,68614.0,"""I want you to look me in my eye and say that you're sorry"": Man who lost his eye protesting says he demands a response from the mayor",,1592493043.0
756,68597.0,BBC Investigation: The 'dead voters' in Michigan who are still alive,,1605355232.0
757,68524.0,Dogecoin plunges nearly 30 percent after Elon Musk’s SNL appearance,,1620563143.0
758,68497.0,A 21-year-old college student worked at a Texas hotel for 32 hours alone during a flood. Guests say he's a hero,,1569263949.0
759,68497.0,Sheffield Lake police chief resigns after putting Ku Klux Klan sign on Black officer’s desk,,1625225539.0
760,68448.0,"Britney Spears’ attorney filed a petition Thursday asking the court to immediately remove her father as conservator, noting that an investigation may be required into his financial dealings while in control of her estate",,1628194288.0
761,68444.0,Justice Department appoints special prosecutor for Russia investigation,,1495058728.0
762,68434.0,"Teacher accidentally fires gun in classroom, students injured",,1521030417.0
763,68428.0,Arizona Sheriff Joe Arpaio loses bid to have his criminal record wiped clean,,1508460834.0
764,68423.0,Pharmaceutical giant 'plotted to destroy cancer drugs to drive prices up 4000%',,1492174151.0
765,68418.0,"Former Trump campaign manager, Brad Parscale, armed, barricades self in Fort Lauderdale home, police called",,1601254409.0
766,68398.0,A teen who spent 10 hours cleaning up after a protest is rewarded with a car and a college scholarship,,1591477176.0
767,68393.0,"With a pen stroke, Mississippi drops Confederate-themed flag",,1593556280.0
768,68370.0,"The Minneapolis police officer who knelt on George Floyd's neck had 18 previous complaints against him, police department says",,1590708990.0
769,68362.0,Volkswagen and BMW fined $1 billion for running emissions cartel,,1625753027.0
770,68304.0,'Pharma Bro’ Shkreli loses 2nd bid for early prison release,,1611091328.0
771,68296.0,Ivanka Trump used a personal email account to send hundreds of emails about government business last year,,1542670860.0
772,68276.0,"FEMA Contract Called for 30 Million Meals for Puerto Ricans. 50,000 Were Delivered.",,1517930229.0
773,68275.0,"Jailers Interrupt Ghislaine Maxwell's Sleep Every 15 Minutes to Check If She's Still Breathing, Lawyer Says",,1606262845.0
774,68265.0,CNN News Crew of Omar Jimenez and 4-member crew Arrested on Live TV,,1590747494.0
775,68255.0,SCOTUS Rules Police Cannot Search Homes Without Warrants in the Name of 'Community Caretaking',,1621274283.0
776,68244.0,Harvey Weinstein found guilty in landmark #MeToo moment,,1582562731.0
777,68231.0,Utah bans conversion therapy for LGBTQ children,,1579718994.0
778,68193.0,Maine postal workers reassemble high-speed sorting machine,,1602503616.0
779,68180.0,Flood Destroys Home Of Hate Group Leader Who Claims God Sends Natural Disasters To Punish Gays,,1471483051.0
780,68135.0,"4 Years After an Execution, a Different Man’s DNA Is Found on the Murder Weapon",,1620406620.0
781,68134.0,"Mitsubishi pulls Hearthstone tournament sponsorship after ""Free Hong Kong"" gamer ban",,1572398868.0
782,68127.0,"Background checks blocked a record high 300,000 gun sales",,1624377978.0
783,68120.0,Brock Turner Loses Appeal of Sexual Assault Conviction,,1533768446.0
784,68105.0,Vocal anti-vaccine broadcaster dies from COVID-19 complications,,1628278079.0
785,68092.0,Ex-Arizona police officer acquitted of murder in shooting of unarmed man,,1512789457.0
786,68025.0,"Police chief: If you think Floyd video shows reasonable force, turn your badge in - CNN Video",,1591208062.0
787,67990.0,"Manhattan Beach surfer issued $1,000 citation for violating beach closure order, disrespecting lifeguard.",,1585434752.0
788,67983.0,Louisville police collected negative info about Breonna Taylor's boyfriend after fatal shooting,,1602240679.0
789,67977.0,"Cops arrest armed men, Texas bar owner who violated order to close - Sheriff said armed men were there to intimidate officers.",,1588700119.0
790,67977.0,H&M stops buying leather from Brazil over Amazon fires,,1567770474.0
791,67966.0,Jeff Bezos (CEO of Amazon) is refusing a request for testimony from congress while they threaten subpoena.,,1589632792.0
792,67966.0,Ex-postal worker charged with tossing absentee ballots,,1603800069.0
793,67976.0,Colin Kaepernick becomes the face of Nike’s 30th anniversary ‘Just Do It’ campaign,,1536006777.0
794,67968.0,Actor Kal Penn raises $160k in few hours for Syrian refugees after being told he 'doesn't belong in America',,1485702323.0
795,67965.0,Israel officially decriminalizes marijuana use,,1488725540.0
796,67889.0,Popularity of Netflix's 'Tiger King' prompts sheriff to ask for leads in 1997 cold case,,1585600888.0
797,67878.0,Man found with five ‘fully operational’ pipe bombs was targeting Governor Newsom,,1611805237.0
798,67877.0,"Actresses, CEOs arrested in nationwide college admissions cheating scam",,1552401593.0
799,67865.0,Woman Who Called Michelle Obama An 'Ape' Sentenced To Jail For Defrauding FEMA of $18K,,1559505557.0
800,67853.0,Criminal charges expected this week against Epstein guards,,1574122524.0
801,67835.0,Two Maine police officers who allegedly beat porcupines to death with their batons while on duty have been fired,,1602291603.0
802,67830.0,Michigan powerlifter heroically lifts vehicle pinned on top of man after accident.,,1550501863.0
803,67824.0,Warner's girlfriend warned police he was building a bomb in his RV last year,,1609296161.0
804,67797.0,"Paul Manafort, Who Once Ran Trump Campaign, Told to Surrender",,1509366421.0
805,67794.0,Father of boy killed in school massacre wins defamation suit,,1560858036.0
806,67754.0,1 of 2 protesters hit by car on closed Seattle highway dies,,1593949557.0
807,67752.0,Providence fire union says police 'profiled' on-duty black firefighter when they held him at gunpoint,,1591493504.0
808,67749.0,Twitter suspends Marjorie Taylor Greene's account for one week,,1628601374.0
809,67724.0,"Mayor, Police Chief and other city officials of Iowa town arrested over embezzlement, fraud schemes",,1613309978.0
810,67672.0,"Aurora Police did not have basis to stop, frisk or restrain Elijah McClain, investigation finds",,1614024862.0
811,67661.0,Man arrested for groping woman on flight says 'President says it's OK to grab women's private parts',,1540264009.0
812,67633.0,Principal who banned gay books charged with child pornography,,1573673193.0
813,67622.0,"Breonna Taylor's boyfriend, Kenneth Walker: ""I'm a million percent sure"" police didn't identify themselves",,1602595917.0
814,67611.0,US Senate healthcare repeal bill fails,,1501220131.0
815,67604.0,Facebook reports a decline in users in the U.S. and Canada,,1604008950.0
816,67611.0,9/11 hero who saved hundreds dies of cancer at age 45,,1521420643.0
817,67562.0,All 50 states and DC have now certified their presidential election results,,1607551774.0
818,67513.0,"As Texas deep freeze subsides, some households now face electricity bills as high as $10,000",,1613773422.0
819,67512.0,Fastest growing religion is ‘none’,,1542032933.0
820,67488.0,1st black woman legislator in Vermont resigns after white supremacists threaten safety of her family,,1540003408.0
821,67459.0,Oakland passes emergency ‘hazard pay’ ordinance; grocers must pay workers an extra $5 per hour,,1612408676.0
822,67346.0,A Chinese Cheating Ring at UCLA Reveals an Industry Devoted to Helping International Students Scam Grades,,1556796671.0
823,67273.0,FBI raids homes of 2 men who held rally on eve of Capitol attack,,1612355921.0
824,67273.0,"Disney World Closes Mask Loophole, Bans Eating And Drinking While Walking",,1595186453.0
825,67244.0,"Thea White, voice of Muriel Bagge in Courage the Cowardly Dog, has passed away.",,1627818855.0
826,67229.0,Hospital Withdraws Job Offer To Doctor Who Tweeted About Giving Jews Wrong Meds,,1554403763.0
827,67227.0,KKK denied permit to burn cross atop symbolic mountain in Georgia,,1502918039.0
828,67179.0,Protesters set up guillotine outside of Jeff Bezos’ DC home,,1593535701.0
829,67135.0,"Half of Teachers Did Not Return to Chicago Public Schools as Ordered on Monday, District Says",,1609878825.0
830,67132.0,Dozens protest against China during US NBA game,,1571492059.0
831,67119.0,"Hopkins researchers recommend reclassifying psilocybin, the drug in 'magic' mushrooms, from schedule I to schedule IV",,1538404765.0
832,67106.0,Police Unions Lose Bid to Keep Disciplinary Records a Secret,,1613561540.0
833,67070.0,"Amid reports of homelessness and food insecurity, 25,000 employees sue Disneyland for better pay",,1632142974.0
834,67058.0,Judge Rejects Last-Minute Claim That Pence Can Ignore States' Presidential Electors,,1609552658.0
835,67048.0,Man leaves €2m to French village that hid his family from Nazis,,1611943950.0
836,67037.0,"A high school student is growing out his hair for his sick sister. When administrators asked him to cut it, he withdrew from school",,1581259367.0
837,66984.0,Police raid illegal rave inside abandoned Toys R Us,,1523410054.0
838,66980.0,Sen. Ron Johnson tests positive for COVID-19,,1601732143.0
839,66968.0,"WaPost: Girl dies of dehydration while in Border Patrol custody, 'had not eaten for days'",,1544750327.0
840,66885.0,ABC News' Amy Robach caught on hot mic saying network spiked Jeffrey Epstein bombshell,,1572976386.0
841,66872.0,'I’m getting shot': attacks on journalists surge in US protests,,1591362484.0
842,66840.0,Federal Court Rules Suspicionless Searches of Travelers’ Phones and Laptops Unconstitutional,,1573593008.0
843,66832.0,"Woman charged with attempted murder in beating of man, 92, with brick",,1531569300.0
844,66819.0,"George Floyd death: Los Angeles police slammed for shooting homeless, wheelchair-bound man",,1591448134.0
845,66797.0,Apple confirms it uses Google's cloud for iCloud,,1519660550.0
846,66782.0,Texas anti-mask ‘Freedom Defender’ dies of COVID at age 30,,1630496165.0
847,66690.0,George Floyd protesters turn White House fence into memorial wall,,1591568147.0
848,66660.0,Covid deniers removed from at capacity hospital,,1609771033.0
849,66664.0,Texas mayor apologizes after violating stay-at-home order to go to nail salon,,1587835475.0
850,66594.0,Florida insurance agent fired after mask meltdown at Costco,,1594225107.0
851,66540.0,"Bitcoin investors may be out $190 million after the only guy with the password dies, firm says",,1549305629.0
852,66530.0,L.A. area cop seen on video punching handcuffed woman twice in face,,1619175319.0
853,66505.0,Active shooter reported at Pitfsburgh synagogue,,1540651430.0
854,66506.0,"Stan Lee Laid To Rest In Small, Private Funeral",,1542475416.0
855,66488.0,"Hackers breach Electronic Arts, stealing game source code and tools",,1623351046.0
856,66486.0,Bronze statue of Ruth Bader Ginsburg to be unveiled in Brooklyn during Women's History Month,,1602689403.0
857,66454.0,R. Kelly Charged With Underage Prostitution in Minnesota,,1565039313.0
858,66452.0,A small-town Iowa newspaper with a staff of 10 people - most of whom are related to each other – has won a Pulitzer Prize for taking on powerful agricultural companies over farm pollution.,,1491921957.0
859,66414.0,"Kansas judge rules sperm donor not on hook for child support - A Topeka man who answered a Craigslist ad to donate sperm so two women could have a baby together is not legally the child's father and isn't required to provide financial support, a Kansas judge has ruled.",,1480477948.0
860,66383.0,The doctor who pronounced George Floyd dead says a lack of oxygen was the likely cause.,,1617639938.0
861,66323.0,Medically assisted suicide becomes legal in Hawaii,,1523006658.0
862,66320.0,"High turnover, understaffing, low pay: US nurses fight to unionize",,1566473573.0
