,score,title,selftext,created_utc
443,78725.0,Megathread: Pro-Trump protesters storm US Capitol during certification of Electoral College votes,"**Part 2** - https://www.reddit.com/r/news/comments/krzopk/megathread_part_2_trump_supporters_storm_us

**Updates**

*All timestamps are Eastern Time in US/Canada*

~6:00pm

- DC curfew is now legally in effect.

~5:35pm

- Police seem to be successfully moving mob away from Capitol, per CNN footage

~5:15pm

- [@shomaristone (NBC DC):](https://twitter.com/shomaristone/status/1346941715895250949?s=19) ""Mob of Trump supporters swarm the media near the US Capitol. They yell what Trump frequently says, “the media is the enemy of the people.” They destroy equipment and chased out reporters. I’ve never seen anything like this in my 20 year career."" (video)

- Rep. Scalise (R-LA) tells Fox News he believes vote certification will resume tonight.

- Fox News says things are ""winding down"", that the Secret Service and FBI have arrived to help, and that the ATF is searching the Capitol for remaining ""protesters"".

~5:00pm

- ""Congressional leaders are being evacuated from the Capitol complex and will be taken to Fort McNair, according to a federal law enforcement official. McNair is a nearby Army base in Washington, DC. The evacuation is still underway, the source said."" [Per CNN:](https://edition.cnn.com/politics/live-news/congress-electoral-college-vote-count-2021/index.html)

- Riot police have arrived at US Capitol complex, per CNN and footage. Have been able to move mob away from building peacefully so far.

~4:50pm

- CNN reports the crowd is thinning somewhat. DC curphew goes into effect at 6PM.

~4:30pm:

- ""Suspected pipe bomb found and rendered safe at the U.S. Capitol"" per CNN via [@BNONews](https://twitter.com/BNONews/status/1346932055859453953?s=19)

~4:20pm:

- Trump: ""It's time to go home"" (in statement that also perpetuates lies about the election being stolen).

~4:05pm:

- Three bombs, apparently: https://twitter.com/EmmaVigeland/status/1346925827800367106

- [NYT: An explosive device is found at the R.N.C., and the D.N.C. is evacuated.](https://www.nytimes.com/2021/01/06/us/politics/an-explosive-device-is-found-at-the-rnc-and-the-dnc-is-evacuated.html)

- [@roddreher:](https://twitter.com/roddreher/status/1346925426539565058) ABC reporting that even people normally in Trump's inner circle can't get through to him. They're worried. Reporting that Trump cabinet officials may resign out of disgust. [@AnaCabrera:](https://twitter.com/AnaCabrera/status/1346925936197984260) White House adviser tells @Acosta some aides around Trump are furious the president won't do more... but ""he doesn't want to”

- President-Elect Biden addresses the nation on mob violence in the capitol: https://twitter.com/Transition46/status/1346926053462319114

- Calls on President Trump to go on TV now and ""demand an end to this siege"".

~4:00pm:

- Security has cleared inside of rotunda and ""starting to get our arms around it"" but ""not under control yet"" per CNN

~3:50pm:

- Multiple officers wounded with at least one transported to hospital; officers are ""overwhelmed"", per CNN

- Entire DC National Guard has been activated, per CNN

- ""Pro-Trump Protester"" breached speaker Nancy Pelosi's office, per CNN

- ""The vice-president has asked Trump supporters to leave the Capitol and stop the violence"" per BBC. Pence: ""This attack on our Capitol will not be tolerated and those involved will be prosecuted to the fullest extent of the law.""

~3:30pm:

- [@GovernorVA:](https://twitter.com/GovernorVA/status/1346916716614451207) Per the Mayor's request, I am sending members of the Virginia National Guard along with 200 Virginia State Troopers.

~3:25pm:

- Speaker Nancy Pelosi has requested National Guard assistance, per ABC

- Woman in critical condition for gunshot wounds after being shot on Capitol grounds, per CNN (uncertain if related to below update) | [@dcexaminer: WARNING. GRAPHIC FOOTAGE: A woman was shot in the neck in the Capitol building.](https://twitter.com/dcexaminer/status/1346917459710726149)

- Armed standoff at door of House floor, per CNN 

- Windows have been smashed and protesters have breached rotunda of Capitol, per various sources

~2:55pm:

- [@tackettdc AP:](https://twitter.com/tackettdc/status/1346909032435613696) Members of Congress inside House chamber told by police to put on gas masks after tear gas dispersed in Capitol Rotunda.

- [@byaaroncdavis WaPo:](https://twitter.com/byaaroncdavis/status/1346908166030766080) A source tells me The Defense Department has just denied a request by DC officials to deploy the National Guard to the US Capitol.

**Live Update Links**

[CNN](https://edition.cnn.com/politics/live-news/congress-electoral-college-vote-count-2021/index.html)

[Wikipedia Article](https://en.wikipedia.org/wiki/2021_United_States_Capitol_protests)

[(ABC / AP) Shots reportedly fired in US Capitol as lawmakers evacuate, pro-Trump protesters swarm (text + video)](https://abc7news.com/washington-dc-rally-donald-trump-protest-2020-election-results-save-america/9405310/)

[(USA Today) Pence evacuated, Capitol locked down as protesters push through fence, breach building](https://www.usatoday.com/story/news/nation/2021/01/06/dc-protests-live-updates-trump-supporters-electoral-college-proud-boys/4126018001/)

[(NPR) U.S. Capitol Locked Down As Far-Right Protesters Enter The Building](https://www.npr.org/sections/congress-electoral-college-tally-live-updates/2021/01/06/954028436/u-s-capitol-locked-down-amid-escalating-far-right-protests)

[(BBC) Live: Protesters storm US Capital and halt election debate](https://www.bbc.com/news/live/election-us-2020-55558355)

[(AP) The Latest: DC mayor orders 6 pm curfew after Capitol breach](https://apnews.com/article/ap-electoral-college-congress-7af85d3c702e070464d7713c42cf254a)

**Photo Galleries**

[Politico](https://www.politico.com/news/2021/01/06/electoral-college-certification-halted-amid-massive-pro-trump-demonstration-455495)

[(FOX 5 DC) PHOTOS: Pro-Trump protesters storm Capitol in DC](https://www.fox5dc.com/news/photos-pro-trump-protesters-storm-capitol-in-dc)

**Video Streams**

[C-SPAN](https://www.c-span.org/video/?507663-1/joint-session-congress-counting-electoral-college-ballots)

[C-SPAN YouTube](https://www.youtube.com/watch?v=KzWS7gJX5Z8)

[PBS NewsHour YouTube](https://www.youtube.com/watch?v=BKy84YmL-sU)

[CBS](https://www.cbsnews.com/live/)

Random YouTuber in Capitol: https://www.youtube.com/watch?v=mNJKNpAOs5k

**Twitter Accounts**

[@tackettdc (Michael Tackett, Deputy Bureau Chief, Associated Press)](https://twitter.com/tackettdc)

[@igorbobic](https://twitter.com/igorbobic)

[@MEPFullter](https://twitter.com/MEPFuller)

reddit user with various Twitter suggestions: [reddit.com/r/news/comments/krvwkf/megathread_protrump_protesters_storm_us_capitol/gic8jqm?context=3](http://reddit.com/r/news/comments/krvwkf/megathread_protrump_protesters_storm_us_capitol/gic8jqm?context=3)",1609963305.0
444,78714.0,Three Texas soldiers arrested in child prostitution sting near Fort Hood,,1597240754.0
445,78647.0,Rudy Giuliani’s DC law license is suspended,,1625696915.0
446,78642.0,"Jail video surveillance from Jeffrey Epstein's first suicide attempt in July is missing, prosecutor says, according to reports",,1576723717.0
447,78607.0,Disney heir criticises company over $1.5bn bonuses as it cuts pay,,1587547957.0
448,78565.0,GoFundMe Bans Anti-Vaxxers Who Raise Money to Spread Misinformation,,1553247255.0
449,78530.0,"Kenya’s only white female giraffe, calf killed by poachers",,1583844018.0
450,78501.0,Chris Evans sending 'Captain America' shield to little boy who saved sister from dog attack,,1594940870.0
451,78432.0,Trump Organization Is Charged in 15-Year Tax Scheme,,1625164706.0
452,78353.0,"FBI: $50,000 Reward For Info On Suspected Pipe Bomber at U.S. Capitol",,1610083636.0
453,78318.0,Sen. Mitch McConnell's home in Kentucky vandalized,,1609609664.0
454,78271.0,White supremacists behind majority of US domestic terror attacks in 2020,,1603436914.0
455,78238.0,Jeopardy' host Alex Trebek has stage 4 pancreatic cancer,,1551910041.0
456,78223.0,"Neil deGrasse Tyson Cleared by Misconduct Investigation, Will Keep Museum Job",,1564236485.0
457,78020.0,US soldier being charged with giving classified info about troops to white supremacists,,1592848224.0
458,78018.0,Capitol Police officer who shot Ashli Babbitt exonerated in internal probe,,1629487987.0
459,78002.0,Biden orders US flags flown at half-staff after Atlanta shootings,,1616098725.0
460,77981.0,U.S. Navy Recommends Reinstating Fired USS Theodore Roosevelt Captain,,1587756589.0
461,77975.0,Portland mayor bans cops from using tear gas during protests,,1599772597.0
462,77968.0,"Shopify removes Trump stores, citing president's support for violence",,1610047319.0
463,77954.0,Phoenix police must now document each time they point their gun at someone,,1566320267.0
464,77948.0,Neo-Nazi who said homosexuality was 'unnatural' revealed as paedophile who groomed young boys,,1554317540.0
465,77940.0,The White House website's page on climate change just disappeared,,1484938751.0
466,77909.0,Texas park ranger pushed into water after reminding crowd about social distancing,,1588423776.0
467,77866.0,91-year-old mailman retires after 69 years with perfect record,,1550189928.0
468,77738.0,"Taiwan rejects China's ""one country, two systems"" offer",,1570716729.0
469,77725.0,Michigan inmate serving 60-year sentence for selling weed requests clemency,,1580319361.0
470,77706.0,"Astronaut’s DNA No Longer Matches His Identical Twin’s After Year Spent in Space, NASA Finds",,1521060719.0
471,77641.0,Mystery person buys $1M worth of remaining toys at Toys 'R' Us store to donate to kids,,1530298733.0
472,77612.0,Fulton DA announces charges against 6 Atlanta officers in excessive force case,,1591112967.0
473,77594.0,Kyle Rittenhouse says he used coronavirus stimulus check to buy AR-15 used in fatal shooting,,1605824946.0
474,77554.0,California State Senate passes bill restricting gifts from pharma companies to doctors,,1495207967.0
475,77530.0,"W.Va. delegate, just sworn in, was among the mob storming U.S. Capitol",,1609982522.0
476,77516.0,New Law Requires Federal Agents to Identify Themselves to Protesters,,1609901140.0
477,77465.0,Elon Musk has deleted Tesla and SpaceX’s Facebook Pages after Twitter Challenge,,1521823096.0
478,77461.0,California bans gender in setting car insurance rates,,1547381055.0
479,77436.0,Las Vegas workers push back after mayor's call to reopen casinos and hotels,,1587643956.0
480,77433.0,Alleged Capitol rioters are still being arrested four months after the insurrection,,1620167370.0
481,77413.0,YouTube Suspends OANN for a Week After It Posted Fake Covid-19 Cure,,1606249957.0
482,77411.0,Head of NYPD union gives Fox News interview with QAnon mug in background,,1595077370.0
483,77406.0,33 missing children rescued in Los Angeles trafficking operation,,1611461905.0
484,77329.0,Kentucky teen who sued over school ban for refusing chickenpox vaccination now has chickenpox,,1557335585.0
485,77267.0,Alex Jones must pay legal fees for ’frivolous’ Sandy Hook appeal,,1585336391.0
486,77264.0,Trump files emergency request with Supreme Court to stop release of his tax returns,,1602857362.0
487,77227.0,Spectator who caused massive crash at Tour de France missing after fleeing the country,,1624888561.0
488,77200.0,Acting Navy Secretary Modly resigns,,1586287200.0
489,77189.0,"Capitol Rioter Seen in Horned Hat, Carrying Spear Arrested: US Attorney",,1610211994.0
490,77108.0,Ghislaine Maxwell loses bid to keep deposition excerpt secret,,1612816971.0
491,77049.0,Delaware judge rules that a medical marijuana user fired from factory job after failing a drug test can pursue lawsuit against former employer,,1545520455.0
492,76958.0,Federal judge blocks Texas governor's order limiting mail ballot drop-off locations,,1602327866.0
493,76905.0,Proud Boys are a dangerous ‘white supremacist’ group say US agencies,,1601583286.0
494,76899.0,Man Sues Police After Being Pepper-Sprayed While Filming Son’s Arrest,,1609084280.0
495,76820.0,Texas megachurch pastor sent to prison for fraud scheme,,1610652718.0
496,76779.0,Mass. Trooper Sues Police Leaders After He Was Told To Alter Arrest Report Of Judge's Daughter,,1510141354.0
497,76786.0,UPS ends ban on beards and natural Black hairstyles,,1605118373.0
498,76770.0,Tour de France to sue fan who caused mass crash during stage 1,,1624803658.0
499,76744.0,"Verizon VP jokes at planting a 'brainwashed' FCC chairman, Ajit Pai says 'awesome'",,1512824233.0
500,76716.0,Medical Marijuana passes VA Senate 40-0.,,1517885335.0
501,76689.0,"Uber, Lyft, DoorDash stocks fall sharply after U.S. Labor secretary says gig workers should be classified as employees",,1619726512.0
502,76665.0,"Men accused of vandalizing Black Lives Matter sign in Westlake Village work for sheriff, DA",,1592772234.0
503,76645.0,Joe Biden selects Kamala Harris as his running mate,,1597177028.0
504,76628.0,Nurse who received first FDA-approved COVID-19 vaccine will have her scrubs and vaccine card displayed in Smithsonian,,1625402635.0
505,76558.0,"Ikea bought 11,000 acres of forest in Georgia to protect it from development",,1612076481.0
506,76500.0,New York Suspends Giuliani’s Law License,,1624548857.0
507,76420.0,"Church pastor who repeatedly raped children after ""holy baths"" has been jailed for 34 years",,1583584594.0
508,76401.0,‘I should have gotten the damn vaccine’: Father of 5 dies of COVID at age 39,,1627736372.0
509,76369.0,"Obama dog Bo, once a White House celebrity, dies from cancer",,1620505754.0
510,76208.0,Trudeau says any approved COVID-19 vaccine will be free for all Canadians,,1602117210.0
511,76189.0,Protestors attempting to rip down confederate monuments - Birmingham AL,,1590978451.0
512,76039.0,"Prison guards, but not mother, get counselling after baby dies in cell",,1632660733.0
513,75880.0,"Dow falls 1,191 points -- the most in history",,1582839313.0
514,75849.0,Driver Who Killed Seattle Protester Charged With Vehicular Homicide,,1594250430.0
515,75848.0,Kenosha County DA says Kyle Rittenhouse has violated bond,,1612390096.0
516,75804.0,Ellen Pao Is Stepping Down as Reddit’s Chief,,1436563386.0
517,75784.0,Woman who falsely said Black teen stole her phone in NYC hotel arrested in home state of California,,1610103856.0
518,75760.0,The Police Report for the Killing of Breonna Taylor Is Almost Entirely Blank,,1591875587.0
519,75678.0,Pfizer avoids taxes via the Netherlands and makes a profit worth billions,,1621080713.0
520,75629.0,Atlanta mayor: 2 police officers fired after body-camera footage showed they used excessive force in protest incident,,1590964630.0
521,75554.0,Dolly Parton statue may replace KKK leader monument at the Tennessee capitol,,1592186357.0
522,75520.0,Sheriff who refused to enforce restrictions tests positive for Covid-19,,1607093916.0
523,75492.0,"Utah CEO gets 210 days in jail for having 13K files of infant & child rape, bestiality",,1589581215.0
524,75483.0,Prosecutors formally request to talk with Prince Andrew in Epstein investigation,,1591582441.0
525,75451.0,Sean Connery: James Bond actor dies aged 90,,1604147423.0
526,75447.0,Pete Buttigieg is suspending his 2020 presidential campaign,,1583104435.0
527,75413.0,Child sex offenders to be named as such in US passports,,1509631385.0
528,75318.0,California officer associated with Proud Boys fired,,1618054981.0
529,75194.0,US weekly jobless claims double to 6.6 million,,1585830880.0
530,75190.0,City gets public backlash for spending federal COVID relief money on golf course clubhouse,,1608124176.0
531,75190.0,NASCAR: Noose found in Black NASCAR Driver's (Bubba Wallace) garage area at Talladega,,1592794942.0
532,75184.0,Missing 5-year-old and 8-year-old sisters found alive,,1551644558.0
533,75179.0,R. Kelly Is Charged With Using Bribes to Marry Aaliyah at Age 15,,1575587032.0
534,75145.0,John McCain has chosen to discontinue medical treatment for brain cancer,,1535123810.0
535,75090.0,A Kentucky tattoo shop is offering to cover up hate and gang symbols for free,,1592167412.0
536,75064.0,Millennials earn 20% less than baby boomers did—despite being better educated,,1572971473.0
537,74969.0,Massachusetts mayor first in line as recreational marijuana sales begin,,1542724692.0
538,74967.0,"Mexico Set to Legalize Marijuana, Becoming World’s Largest Market",,1615424848.0
539,74963.0,A Trader Joe's worker says he was fired after writing to the CEO about Covid-19 safety protections,,1614638280.0
540,74903.0,"NFL Condems Racism, Admits “ We we’re wrong” Not to Listen to NFL Player Protests",,1591397595.0
541,74847.0,Ambien-maker to Roseanne: Racism is not a side effect of our drug,,1527691226.0
542,74846.0,A Florida man just paid off the past dues for 114 families at risk of having their utilities shut off,,1607653046.0
543,74775.0,White Referee Fired After Forcing Black Wrestler to Cut Dreadlocks,,1546002276.0
544,74768.0,Active duty troops deploying to Washington DC,,1591051375.0
545,74745.0,'White Lives Matter' rallies flop as hardly anyone shows up,,1618181177.0
546,74717.0,"Buffalo man punched in head repeatedly by officer plans to sue city, BPD and arresting officers",,1593170017.0
547,74717.0,US Police officers charged with over 400 rapes that occurred over a 9 year period.,,1539951653.0
548,74615.0,Capitol Police arrested a man with an ‘unauthorized’ inauguration credential and a gun at a security checkpoint.,,1610832912.0
549,74610.0,"Lawsuit: Cops ‘stomped’ on pregnant black woman’s stomach, causing miscarriage",,1591043541.0
550,74538.0,"Venezuela judge convicts 6 American oil execs, orders prison",,1606442172.0
551,74507.0,March for Science: Worldwide protests begin to support 'evidence',,1492867303.0
552,74445.0,California ‘shattering prior election returns’ with 6m ballots already cast,,1603567149.0
553,74454.0,"Muhammad Ali, 'The Greatest of All Time', Dead at 74",,1465013871.0
554,74437.0,Steve Bannon out as White House chief strategist,,1503074896.0
555,74402.0,"Body-cam video in George Floyd killing shows officer pulled gun, swore and touched Floyd multiple times without explanation",,1594834140.0
556,74354.0,Terry Crews Shares His Own Story of Sexual Assault by a Hollywood Executive,,1507668873.0
557,74268.0,Hedge fund billionaire Steve Cohen leaves Twitter after family receives threats amid GameStop backlash,,1612036068.0
558,74248.0,Minnesota AG says 4 officers will be charged to 'highest degree of accountability',,1591024060.0
559,74201.0,"Illinois governor pardons 11,000 for low-level marijuana convictions",,1577832434.0
560,74166.0,Blizzard apology does not silence protestors at BlizzCon 2019,,1572695102.0
561,74149.0,"Two US Capitol police officers suspended, one arrested following Capitol riot",,1610404060.0
562,74145.0,Ginsburg will become the first woman in history to lie in state in US Capitol,,1600740536.0
563,74113.0,Unpaid Kentucky coal miners have been blocking a train track for 3 weeks,,1566707010.0
564,74048.0,Former First Lady Barbara Bush dies at 92,,1524008675.0
565,74042.0,Portland mayor demands removal of camouflage-clad agents detaining protesters,,1595087785.0
566,74040.0,Alabama just passed a near-total abortion ban with no exceptions for rape or incest,,1557919881.0
567,74031.0,Police officer sued after shooting puppy dead in front of its owners,,1630149062.0
568,74024.0,"Agents find sniper rifle, stash of weapons in home of “Zip Tie Guy”",,1611253180.0
569,73987.0,More than 40 attorneys general urge Facebook to stop plans for an Instagram for kids,,1620677812.0
570,73980.0,Washington man gets stunning souvenir with COVID-19 treatment: a $1.1 million bill,,1599178600.0
571,73955.0,Texas governor lifts mask mandate despite health officials' warnings,,1614717127.0
572,73872.0,Trump's chief strategist Steve Bannon stripped of national security council role,,1491408645.0
573,73798.0,"Dow drops nearly 3,000 points; worst day since '87",,1584392309.0
574,73771.0,US Ice officers 'used torture to make Africans sign own deportation orders',,1603362787.0
575,73751.0,Justice Department says it will end use of private prisons,,1471534436.0
576,73710.0,South Dakota governor uses coronavirus relief funds for $5 million tourism ad despite COVID surge,,1599703197.0
577,73701.0,Black man led by mounted police while bound with a rope sues Texas city for $1 million,,1602394761.0
578,73642.0,Dr. Anthony Fauci says he won't walk away from 'this outbreak no matter who's the president',,1602596521.0
579,73617.0,Buffalo police unit resigns in protest,,1591383851.0
580,73593.0,Canada teen wins $1000 a week for life on 18th birthday,,1522191394.0
581,73591.0,"Boston Mayor declares racism a public health crisis, diverts police overtime money to community programs",,1591982935.0
582,73594.0,California man who spent 39 years in prison gets $21 million for wrongful conviction,,1551061141.0
583,73563.0,"Denmark, Germany, Netherlands and Finland join countries halting weapons sales to Saudi Arabia",,1542983351.0
584,73487.0,Son of Butler Co. judge receives no prison time after pleading guilty to child porn,,1593338399.0
585,73452.0,Family outraged that LAPD officers won’t face charges in shooting that killed Trader Joe's manager,,1608724875.0
586,73441.0,U.S. regulator demands companies take action to halt 'robocalls',,1541452671.0
587,73401.0,Elizabeth Warren will drop out of the 2020 presidential race after disappointing Super Tuesday showing,,1583423181.0
588,73400.0,"Bucking GOP trend, Alabama governor extends mask order",,1614877741.0
589,73378.0,Nearly all Fox staffers vaccinated for Covid even as hosts cast doubt on vaccine,,1631759100.0
590,73187.0,"Amazon to drop Parler from its web hosting service, citing violent posts",,1610249799.0
591,73138.0,Grand jury indicts 1 officer on criminal charges 6 months after Breonna Taylor fatally shot by police in Kentucky,,1600881833.0
592,73096.0,Student who feared for life in speeding Uber furious company first offered her $5 voucher,,1578922354.0
593,73090.0,Charles Manson Dead After Spending 46 Years Behind Bars,,1511156082.0
594,73083.0,Tennessee police chief tells officers they now must intervene when others are abusing their authority,,1591801852.0
595,73042.0,Buffalo protester Martin Gugino has a fractured skull and cannot walk,,1592333659.0
596,72997.0,"United CEO doubles down in email to employees, says passenger was 'disruptive and belligerent'",,1491871372.0
597,72966.0,Amazon relaxes drug testing policies and will lobby the government to legalize marijuana,,1632237613.0
598,72912.0,"Net neutrality: Amazon among top internet firms planning day of action. Etsy, Kickstarter and other leading companies to fight FCC plans to neuter 2015 rules in July protest backed by ACLU, Greenpeace and more",,1496749838.0
599,72812.0,Kellyanne Conway's daughter the latest to test positive for COVID-19,,1601841791.0
600,72802.0,"Man cleared of rape to sue police after they hid 40,000 messages from 'victim'",,1513687131.0
601,72793.0,Billionaire pharmaceutical exec John Kapoor goes on trial starting today in the first prosecution of a CEO tied to the opioid crisis,,1548695611.0
602,72779.0,"US Initial Jobless Claims skyrocket to 3,283,000",,1585225972.0
603,72769.0,Terry Crews names alleged sexual assaulter: 'I will not be shamed',,1510759507.0
604,72769.0,"Brutal beating in Iowa should be investigated as hate crime, NAACP says. A black man was leaving his girlfriend's house when he was attacked by white men who accused him of being a burglar, according to the civil rights organization",,1590258902.0
605,72739.0,"Reversing Trump, US restores transgender health protections",,1620650388.0
606,72721.0,Zuckerberg has sold more Facebook stock in the last 3 months than any insider at any other company,,1521574519.0
607,72686.0,"Prince Philip has died aged 99, Buckingham Palace announces",,1617967552.0
608,72669.0,"Houston woman accused of offering to sell her 2-year-old daughter for sex at a cost of $1,200 has been sentenced to 40 years in prison.",,1531492136.0
609,72628.0,Cleveland cop who urinated on girl as she waited for bus gets 4 1/2 years in prison,,1579690022.0
610,72626.0,Killer Mike's new Black-owned bank receives 'tens of thousands' of account requests in less than 24 hours,,1602376542.0
611,72621.0,'Pharma bro' Martin Shkreli convicted in federal fraud case,,1501872127.0
612,72619.0,Apple removes police-tracking app used in Hong Kong protests from its app store,,1570677724.0
613,72619.0,Amber Guyger found guilty of murder in fatal shooting of Botham Jean,,1569944798.0
614,72615.0,"‘Hey Siri, I’m getting pulled over’: iPhone feature will record police interaction, send location",,1592278145.0
615,72607.0,"This zoo will name a cockroach after your ex, then feed it to a meerkat on Valentine's Day.",,1549576562.0
616,72597.0,"Deputy who killed himself left haunting videos on racist policing, division: 'I've had enough'",,1612462449.0
617,72601.0,Trump associate Roger Stone has been found guilty,,1573836819.0
618,72599.0,Stephen King quits Facebook over concerns of 'false information‘,,1580671439.0
619,72586.0,American-born citizen sues sheriff after he was nearly deported to Jamaica,,1543954635.0
620,72578.0,Las Cruces officer heard saying 'I'm going to... choke you out' before suspect dies,,1591715233.0
621,72551.0,Microsoft tried a 4-day workweek in Japan. Productivity jumped 40%,,1572960526.0
622,72509.0,Treasury and IRS to delay tax season deadline by 90 days,,1584464044.0
623,72493.0,"Washington DC mayor says federal police actions were ""shameful""",,1591091335.0
624,72436.0,Proud Boys added to Canada’s list of terrorist groups,,1612374511.0
