,score,title,selftext,created_utc
0,365122.0,Joe Biden elected president of the United States,,1604766517.0
1,250273.0,"Chauvin found guilty of murder, manslaughter in George Floyd's death",,1618952864.0
2,233314.0,President Donald Trump says he has tested positive for coronavirus,,1601615057.0
3,226328.0,Blizzard Employees Staged a Walkout After the Company Banned a Gamer for Pro-Hong Kong Views,,1570653917.0
4,222628.0,Trump has left the White House for the last time as President,,1611148604.0
5,213683.0,Kobe Bryant killed in helicopter crash in California,,1580067478.0
6,200823.0,'Jeopardy' host Alex Trebek dies at 80 due to pancreatic cancer,,1604856593.0
7,188176.0,Scientist Stephen Hawking has died aged 76,,1520999128.0
8,186248.0,"Jeffrey Epstein's autopsy more consistent with homicidal strangulation than suicide, Dr. Michael Baden reveals",,1572436047.0
9,177992.0,F.C.C. Announces Plan to Repeal Net Neutrality,,1511283393.0
10,176887.0,"Joe Biden officially sworn in as the 46th President of the United States, Kamala Harris as the 49th Vice-President",,1611161640.0
11,175651.0,Donald Trump impeached for ‘inciting’ US Capitol riot,,1610573130.0
12,171110.0,Supreme Court rules workers can't be fired for being gay or transgender,,1592230047.0
13,171081.0,Twitter permanently suspends Trump’s account,,1610148532.0
14,170201.0,"Jeffrey Epstein, accused sex trafficker, dies by suicide: Officials",,1565442055.0
15,165204.0,"Ghislane Maxwell, long-time friend and confidante of Jeffrey Epstein, has been arrested by the FBI and charged by federal prosecutors",,1593696173.0
16,161557.0,"In a new court hearing, Britney Spears' father loses bid to retain complete control of his daughter's financial investments",,1613088314.0
17,157482.0,Derek Chauvin sentenced to 22.5 years in prison for murder of George Floyd,,1624650949.0
18,155782.0,Report: Stan Lee dead at 95 - Story,,1542048484.0
19,154796.0,Arizona Senator John McCain has passed away at the age of 81,,1535242878.0
20,154263.0,President Trump has been impeached,,1576720262.0
21,154081.0,"Justice Ruth Bader Ginsburg, Champion Of Gender Equality, Dies At 87",,1600472108.0
22,152238.0,Online influencer Jake Paul charged after Scottsdale looting,,1591286250.0
23,149908.0,"Apple admits it slows older iPhones, confirming Geekbench report",,1513807153.0
24,149750.0,"NY Times: Trump paid $750 in US income taxes in 2016, 2017",,1601243871.0
25,147346.0,Net Neutrality Overturned,,1513275208.0
26,146882.0,Dr. Fauci Named Federal Employee of the Year,,1602354895.0
27,144173.0,Congress has certified the 270 Electoral College votes needed to confirm Joe Biden's presidential election win.,,1610008976.0
28,141342.0,FCC Chairman Ajit Pai will step down on January 20,,1606751912.0
29,141042.0,"GBI arrests father, son for murder of Ahmaud Arbery",,1588897079.0
30,140596.0,"Melvin Capital, hedge fund that bet against GameStop, lost more than 50% in January",,1612129289.0
31,140272.0,Wife of officer charged with murder of George Floyd announces she's divorcing him,,1590813268.0
32,137987.0,Family of 11-year-old boy who died in Texas deep freeze files $100 million suit against power companies,,1613942932.0
33,137813.0,"Judge permanently dismisses charges against Kenneth Walker, boyfriend of Breonna Taylor",,1615232836.0
34,136603.0,Leader of North Carolina lockdown Protest group tests positive for COVID-19,,1588007571.0
35,133971.0,"Kanye West removed from Illinois Presidential ballot after nearly 2,000 invalid signatures discovered",,1596907298.0
36,133387.0,Losses on short positions in U.S. firms top $70 billion,,1611861716.0
37,131230.0,Trump campaign loses lawsuit seeking to halt Michigan vote count,,1604604999.0
38,129847.0,Portland sees peaceful night of protests following withdrawal of federal troops,,1596198318.0
39,129148.0,Former President George H.W. Bush Dies at 94,,1543640083.0
40,128937.0,"Illinois’ Top Legal Officer Wants To License Cops, Just Like Doctors, Hairdressers",,1591413210.0
41,128373.0,"North Carolina man arrested after he’s discovered with guns, explosives in plot to assassinate Joe Biden",,1603399360.0
42,127181.0,"Underage girl forced to have sex with Prince Andrew, US court document claims",,1596214587.0
43,126707.0,Japanese firm gives non-smokers extra six days holiday to compensate for cigarette break,,1509448837.0
44,124876.0,Entire staffs at 3 Sonic locations quit after wages cut to $4/hour plus tips,,1551477140.0
45,124449.0,#DeleteFacebook Movement Gains Steam After 50 Million Users Have Data Leaked,,1521507725.0
46,123951.0,Chester Bennington of Linkin Park commits suicide,,1500574463.0
47,123735.0,Biden revokes presidential permit for Keystone XL pipeline expansion on 1st day,,1611184040.0
48,123153.0,Fox News publishes digitally altered and misleading images of Seattle demonstrations,,1592072157.0
49,122995.0,Ghislaine Maxwell Charged With Sex Trafficking of 14-Year-Old Girl,,1617052539.0
50,122060.0,Harvey Weinstein sentenced to 23 years in prison for sex assault in case that sparked 'MeToo' movement,,1583939101.0
51,121994.0,"Colorado governor signs police accountability bill, ending qualified immunity defense in the state",,1592608798.0
52,121844.0,Man dies in Arizona after being restrained by police on hot tarmac for six minutes,,1598014921.0
53,121529.0,U.S. President Donald Trump fired the federal government's top lawyer Sally Yates on Monday after she took the extraordinarily rare step of defying the White House and refused to defend new travel restrictions targeting seven Muslim-majority nations.,,1485833138.0
54,121224.0,New Virginia law capping insulin prices at $50 a month goes into effect Friday,,1609451073.0
55,120507.0,Gay men have taken over the Proud Boys Twitter hashtag,,1601840940.0
56,120281.0,Police shoot 13-year-old boy with autism several times after mother calls for help,,1599584433.0
57,120212.0,Airspace now restricted over Biden’s home,,1604674175.0
58,119972.0,Blizzard pulls Blitzchung from Hearthstone tournament over support for Hong Kong protests,,1570540313.0
59,119859.0,"Black woman shot and killed after Kentucky police entered her home as she slept, family says",,1589326449.0
60,119848.0,Supreme Court rules New York prosecutor can get Trump's tax returns,,1594304179.0
61,119485.0,Judge orders U.S. Postal Service to treat all election mail as 1st class or priority | CBC News,,1600721017.0
62,119479.0,Marine Corps Bans Public Display of Confederate Flag,,1587766828.0
63,119444.0,Some U.S. Capitol rioters fired after internet detectives identify them,,1610069503.0
64,119220.0,Donald Trump calls for delay to 2020 US presidential election,,1596114890.0
65,119147.0,"U.S. Supreme Court lets Flint, Michigan residents sue over water contamination",,1579620808.0
66,118562.0,"Fired Wilmington cop: “We are just going to go out and start slaughtering them f—— ni—–. I can’t wait. God, I can’t wait.”",,1593035134.0
67,118501.0,Italy bans unvaccinated children from school,,1552387651.0
68,118445.0,'Black Panther' actor Chadwick Boseman dies at 43 after 4-year fight with colon cancer,,1598666936.0
69,117874.0,Arresting officer in George Floyd case taken into custody by BCA,,1590772614.0
70,117451.0,Assaulting a worker who's enforcing masks is now a felony under a new Illinois law,,1597068846.0
71,116883.0,Dr. Fauci says his daughters need security as family continues to get death threats,,1596651676.0
72,116783.0,Comcast quietly drops promise not to charge tolls for Internet fast lanes,,1511804314.0
73,116619.0,Hospitals will have to post prices online starting January 1,,1545884147.0
74,116521.0,"Grant Imahara, 'Mythbusters' co-host, dead at 49",,1594703652.0
75,116515.0,Bill Cosby found guilty on all sex assault charges,,1524765069.0
76,116260.0,"Mars, Nestlé and Hershey to face landmark child slavery lawsuit in US",,1613170137.0
77,115739.0,Rush Limbaugh dead at 70,,1613581957.0
78,115227.0,"President-elect Joe Biden clears 270-vote threshold in Electoral College count, formalizing his victory",,1607985257.0
79,115105.0,Texas Roadhouse CEO forgoes salary and bonus to pay front-line restaurant employees,,1585255663.0
80,114953.0,Landlord changes locks on California church after pastor said he'd continue to hold services,,1586261949.0
81,114816.0,"Reddit, Acting Against Hate Speech, Bans ‘The_Donald’ Subreddit",,1593451535.0
82,114807.0,Woman Is Fired After Calling Police on Black Man in Central Park,,1590520135.0
83,114571.0,Donald Trump Jr. tests positive for COVID-19,,1605914197.0
84,114235.0,Officer accused of pushing teen during protest has 71 use of force cases on file,,1591203901.0
85,114215.0,France bans unvaccinated American travelers,,1631277014.0
86,113318.0,GRAPHIC VIDEO: Buffalo police officers violently shove man onto ground,,1591323187.0
87,112881.0,Britney Spears’ father agrees to step down as conservator,,1628803714.0
88,112348.0,Drought-hit California orders Nestlé to stop pumping millions of gallons of water,,1619531888.0
89,112076.0,"'I can't breathe,' Oklahoma man tells police before dying. 'I don't care,' officer responds.",,1591837227.0
90,112063.0,82-year-old Houston-area man left without heart medicine for a week due to USPS delays,,1597674369.0
91,112004.0,"Amazon blocks sale of merchandise with ""stand back"" and ""stand by""",,1601557423.0
92,111974.0,Britney Spears tells LA court she wants her father charged with conservatorship abuse,,1626302958.0
93,111808.0,"Judge rules to unseal documents in 2015 case against Ghislaine Maxwell, Jeffrey Epstein's alleged accomplice",,1595522275.0
94,111602.0,"Nearly 200,000 people have signed a petition to have Logan Paul kicked off YouTube after controversy over his filming of a dead body in Japan's 'Suicide Forest'",,1515183131.0
95,111588.0,Parler CEO Says Service Dropped By “Every Vendor” Could End Business,,1610309248.0
96,110660.0,Japanese police want to question Logan Paul,,1515280263.0
97,110060.0,James Comey terminated as Director of FBI,,1494366560.0
98,109889.0,52% of young adults in the US are living with their parents. That's the highest share since the Great Depression,,1599275018.0
99,109625.0,Police warn they may use live ammo on protesters in Hong Kong,,1574009709.0
100,109368.0,Alex Kearns died thinking he owed hundreds of thousands for stock market losses on Robinhood. His parents are set to sue over his suicide.,,1612791812.0
101,109147.0,Norm Macdonald Dies: Influential Comedian And Former ‘SNL’ Weekend Update Anchor Was 61,,1631643787.0
102,108994.0,Reddit bans active COVID misinformation subreddit NoNewNormal,,1630522790.0
103,108716.0,FBI arrests Nashville zip-tie suspect from assault on U.S. Capitol,,1610315084.0
104,108703.0,Bernie Sanders drops out of the presidential race,,1586359482.0
105,108362.0,"American Icon and Playboy Founder, Hugh M. Hefner, Has Died",,1506568044.0
106,108221.0,"Capitol rioter known as ""QAnon Shaman"" will be jailed until trial",,1610803309.0
107,108186.0,"The teacher who disarmed, then hugged a student will receive the citizen Congressional Medal of Honor",,1585661906.0
108,108161.0,"Britney Spears’ father removed as her conservator, judge rules",,1632954092.0
109,108117.0,'Pharma bro' Martin Shkreli sentenced to 7 years in prison,,1520621850.0
110,107914.0,All former officers involved in George Floyd's death are now in custody,,1591225108.0
111,107844.0,"Thailand cave rescue: All 12 boys, coach freed, latest updates",,1531223098.0
112,107659.0,"Fauci says ""serious threats"" have been made against him and his wife and daughters",,1595613258.0
113,107602.0,Supreme Court legalizes gay marriage,,1435327368.0
114,107572.0,"Thousands of Seattle students told to get vaccinated, or don’t come back after winter break",,1577554974.0
115,107310.0,Kim Jong Un Allegedly in a 'vegetative state' after heart surgery - Japanese Media,,1587814465.0
116,107248.0,"Pet Store Bill Passes California Senate 38 to 0. It bans the sale of dogs, cats and rabbits sourced from high-volume, commercial breeding facilities, known as mills, in all pet shops throughout the state.",,1505323565.0
117,106857.0,Capitol rioter charged with threatening to 'assassinate' Rep. Ocasio-Cortez,,1611428056.0
118,106549.0,Prosecutors weigh ‘heavy hammer’ — felony murder — for rioters in Capitol officer’s death,,1610368662.0
119,106106.0,Arrest warrant issued for Tampa megachurch pastor who led packed services despite safer-at-home orders,,1585590349.0
120,105865.0,George Floyd's family says four officers involved in his death should be charged with murder,,1590572524.0
121,105784.0,"Families of Sandy Hook shooting victims win legal victory in lawsuit against InfoWars, Alex Jones",,1547237808.0
122,105245.0,Recount in Wisconsin county demanded by Trump increases Biden's margin,,1606532781.0
123,104990.0,Judge denies bail for Ghislaine Maxwell after she pleads not guilty in Jefferey Epstein sex crimes case,,1594754185.0
124,104940.0,Breonna Taylor evidence photos contradict LMPD's 'no body cam' claim,,1599612779.0
125,104824.0,"Days after photos of packed hallways go viral, Paulding County High School in Georgia reports 9 COVID-19 cases",,1596935448.0
126,104215.0,"NYPD officers can no longer search a vehicle due to the smell of marijuana alone, new memo says",,1617544538.0
127,104201.0,"Trump ousts Homeland Security cyber chief Chris Krebs, who called election secure",,1605658852.0
128,103916.0,"Minneapolis police officers must keep body cameras turned on during entire response to a call, new policy says",,1612269755.0
129,103389.0,Black armed protesters march in Kentucky demanding justice for Breonna Taylor,,1595770079.0
130,103208.0,R. Kelly Has Been Found Guilty Of Federal Crimes After 11 Sexual Abuse Victims Testified Against Him,,1632770534.0
131,103119.0,"Bond denied for father, son charged with murder in Ahmaud Arbery case",,1588966919.0
132,102962.0,Twenty-Two Attorneys General Sue The FCC Over Net Neutrality Repeal,,1516157233.0
133,102624.0,Magic Mushrooms Are Decriminalized in DC as of Today,,1615836267.0
134,102357.0,CNN banned from White House press briefing,,1487965888.0
135,102154.0,Commonwealth’s Attorney: Man who drove through group of protesters is leader of KKK,,1591636722.0
136,102154.0,Kanye West's Yeezy got millions in federal small business loans,,1594068518.0
137,101856.0,GSA tells Biden that transition can formally begin,,1606173063.0
138,101809.0,Hospitals Sued to Keep Prices Secret. They Lost.,,1593005772.0
139,101679.0,Boy who suffered up to 100 seizures a day has none in 300 days after being prescribed cannabis oil,,1504810067.0
140,101599.0,"Texas judge interrupts jury, says God told him defendant is not guilty",,1516389174.0
141,101542.0,"Robinhood appears to halt support on Reddit-driven GameStop, AMC stocks",,1611842194.0
142,101393.0,Vermont has officially legalized cannabis,,1516649066.0
143,101138.0,Apple fined for slowing down old iphones.,,1581101330.0
144,101012.0,"Man dies after police kneel on his neck for nearly 5 minutes, family says in wrongful death claim",,1614141810.0
145,100903.0,YouTube star Daddyofive loses custody of two children featured in 'prank' video.,,1493730089.0
146,100270.0,Costco lifts minimum wage above Amazon or Target to $16 per hour,,1614273068.0
147,100255.0,Family sues after 26-year-old EMT is shot and killed by police in her own home,,1589544704.0
148,100087.0,U.S. court: Mass surveillance program exposed by Snowden was illegal,,1599100401.0
149,99833.0,Washington state governor OKs bill banning for-profit jails,,1618513378.0
150,99625.0,New York Gov. Cuomo signs executive order that allows store owners the right to ban any customer that enters without wearing a mask.,,1590681810.0
151,99281.0,A man who carried a Confederate flag into the Capitol has been arrested.,,1610644445.0
152,99287.0,Carrie Fisher Dies at 60,,1482861146.0
153,99275.0,Vermont Senate legalizes recreational pot,,1515681822.0
154,99092.0,"75-year-old protester pushed by Buffalo police files lawsuit against city, mayor and officers",,1614042616.0
155,99083.0,New probe confirms Trump officials blocked Puerto Rico from receiving hurricane aid,,1619127571.0
156,99006.0,Trump tax returns are now in the hands of the Manhattan district attorney,,1614263934.0
157,99010.0,Post-election audits find no fraud in Arizona,,1605219956.0
158,98344.0,CNN sues President Trump and White House for banning reporter Jim Acosta,,1542119149.0
159,98168.0,"Texan files $1 billion class-action lawsuit after receiving $9,000 electric bill",,1614303011.0
160,98167.0,Facebook will block Trump from posting for the remainder of his term,,1610035118.0
161,98159.0,Alex Jones arrested for DWI in Travis County,,1583866531.0
162,97987.0,Admitted KKK leader who drove through crowd of protesters found guilty on multiple charges,,1597090302.0
163,97959.0,"Bob Murray, Who Fought Against Black Lung Regulations As A Coal Operator, Has Filed For Black Lung Benefits",,1601510776.0
164,97813.0,Kamala Harris makes history as first woman of color elected US vice-president,,1604768094.0
165,97612.0,Former Buffalo officer who stopped fellow cop's chokehold on suspect will get pension after winning lawsuit,,1618393500.0
166,97513.0,Belgium declares loot boxes gambling and therefore illegal,,1524681250.0
167,97315.0,"Infowars host Alex Jones is responsible for damages triggered by his false claims on the Sandy Hook shooting, judge rules",,1633082441.0
168,97109.0,Ohio mayor calls for 'immediate termination' of officer who shot and killed a Black man 'who had committed no crime',,1608814171.0
169,97105.0,Bloomberg drops out of 2020 presidential race after poor Super Tuesday showing,,1583334809.0
170,97058.0,"Thirteen Russians criminally charged for interfering in US election, Mueller announces",,1518805101.0
171,97020.0,USA now vaccinating more people against COVID-19 in one day than Canada has in total,,1613919978.0
172,96880.0,"Burger King workers write ‘we all quit’ on sign, walk out of Nebraska restaurant",,1626119605.0
173,96622.0,Black Army Medic Pepper-Sprayed in Traffic Stop Accuses Officers of Assault,,1618089453.0
174,96462.0,"""Nobody Died at Sandy Hook"" author must pay victim's dad $450,000, jury says",,1571236336.0
175,96133.0,Black gun owners plan pro-Second Amendment walk,,1592578195.0
176,96014.0,Black homeowner had a white friend stand in for third appraisal. Her home value doubled.,,1621009749.0
177,95946.0,Virginia's governor signs legislation banning no-knock warrants,,1603916671.0
178,95770.0,Agents raid home of fired Florida data scientist who built COVID-19 dashboard,,1607381578.0
179,95656.0,Student suspended after showing fellow students without masks,,1596721415.0
180,95574.0,Actor Danny Trejo saves a trapped baby from an overturned car,,1565229767.0
181,95554.0,Thousands of Amazon workers demand time off to vote,,1602623582.0
182,95441.0,The Museum of London Has Acquired That Giant 'Trump Baby' Balloon for Its Collection of Protest Art,,1610974347.0
183,95274.0,Report: Sen. Graham pressured Ga. secretary of state to throw out legally cast ballots,,1605580393.0
184,95277.0,AntiVirus Creator John McAfee Found Dead In Catalan Prison Cell,,1624476235.0
185,95009.0,Calling 911 with a false claim because of race can now put you in prison for years in N.J.,,1598986651.0
186,94963.0,Measles returned to Costa Rica after five years by French family who had not had vaccinations,,1551026335.0
187,94940.0,Federal judge rules women can get abortion pill without doctor visits,,1594680580.0
188,94773.0,"Los Angeles Mayor Eric Garcetti, City Officials Cutting $100-$150 Million From LAPD Budget, Funds To Be Reinvested In Communities Of Color",,1591234965.0
189,94723.0,US makes official return to Paris climate agreement,,1613734856.0
190,94708.0,Kentucky Sen. Rand Paul tests positive for coronavirus,,1584899528.0
191,94565.0,Poland stalls abortion ban amid nationwide protests,,1604413924.0
192,94497.0,Texas real estate agent who took private jet to D.C. charged in Capitol riot,,1610745622.0
193,94479.0,"FDA grants full approval to Pfizer-BioNTech’s Covid shot, clearing path to more vaccine mandates",,1629726183.0
194,94396.0,Mask order issued for entire state of Texas,,1593721811.0
195,94385.0,Buffalo police officers arrested after shoving 75-year-old protester,,1591455173.0
196,94266.0,Target joins Walmart in staying closed for Thanksgiving this year,,1595856567.0
197,94164.0,NFL offers Biden all 32 football stadiums as mass Covid vaccination sites,,1612560619.0
198,94157.0,Larry Nassar sentenced to 175 years in prison in sexual abuse case,,1516815633.0
199,94030.0,Billionaire David Koch dies at age 79,,1566563751.0
200,93955.0,Wuhan residents remember coronavirus 'whistleblower' doctor a year after his death,,1612615199.0
201,93790.0,National veterans groups plan to purge members found guilty in Capitol attack,,1610388299.0
202,93739.0,Mississippi Votes to End Jim Crow Electoral College-Like System; Popular Vote to Choose Governor,,1604512222.0
203,93728.0,"Giuliani has tested positive for coronavirus, Trump says",,1607286583.0
204,93655.0,Woman who lied about being raped on college campus gets jail,,1529431720.0
205,93587.0,"Ronna McDaniel, chairwoman of the R.N.C., tests positive for the coronavirus.",,1601646540.0
206,93429.0,Steve Bannon indicted in scheme to defraud donors to campaign pledging to build border wall,,1597932529.0
207,93275.0,Christian Cooper is asking people to stop making death threats against the woman who called the cops on him,,1590592407.0
208,93004.0,Delta adds 460 passengers who refused masks to 'no-fly' list,,1603483719.0
209,92919.0,"Human penises are shrinking because of pollution, warns scientist",,1616588297.0
210,92910.0,"Elderly couple found dead in apparent murder-suicide, left notes about high medical bills",,1565355669.0
211,92731.0,"Kentucky lawmaker who proposed ""Breonna's Law"" to end no-knock warrants statewide arrested at Louisville protest",,1601047323.0
212,92539.0,Facebook will stop recommending political groups permanently,,1611786900.0
213,92435.0,Pelosi announces formal impeachment inquiry,,1569359122.0
214,92258.0,Recreational marijuana becomes legal in Illinois on New Years Day,,1577194330.0
215,92226.0,Trump revealed highly classified information to Russian foreign minister and ambassador,,1494883179.0
216,92213.0,"Protesters trample, burn LeBron James jerseys in Hong Kong",,1571168942.0
217,92189.0,"Video shows Minneapolis cop with knee on neck of motionless, moaning man who later died",,1590492001.0
218,92115.0,Comcast fired 500 despite claiming tax cut would create thousands of jobs,,1515103967.0
219,91963.0,"CBC.ca: Jeffrey Epstein prison guards admit to falsifying records, make deal to avoid jail time",,1621644110.0
220,91826.0,"A suspected big cat poacher has been eaten by lions near the Kruger National Park in South Africa, police say",,1518450645.0
221,91781.0,Chris Brown detained on suspicion of rape,,1548155887.0
222,91686.0,NASCAR bans Confederate flag from its races and properties,,1591824549.0
223,91618.0,"Man with mental illness spent nearly 5 months in jail before body cam video revealed Garfield Heights officers beat, tased and mocked him",,1592321580.0
224,91547.0,"Sacha Baron Cohen Crashes Right Wing Event, Leads Absurd Sing-Along",,1593364360.0
225,91479.0,Comcast deleted net neutrality pledge the same day FCC announced repeal,,1511982740.0
226,91470.0,"Jeff Bezos to step down as Amazon CEO, Andy Jassy to take over in Q3",,1612300019.0
227,91462.0,Senate approves bill to extend 9/11 victims fund,,1563911967.0
228,91381.0,Amazon workers stage strike on Black Friday,,1575036902.0
229,91158.0,Woman who coughed on $35K worth of grocery store food charged with four felonies,,1585354841.0
230,91152.0,"Nestlé cannot claim bottled water is ‘essential public service’, court rules",,1575545583.0
231,91103.0,Prison whistleblower who exposed unsafe conditions in Arizona facility found dead,,1584015582.0
232,91018.0,"Twitter has suspended 70,000 QAnon accounts since U.S. Capitol riot",,1610419900.0
233,90991.0,Campaign to 'thank' Xi Jinping flatly rejected by Wuhan citizens,,1584187493.0
234,90985.0,Twitter Suspends Marjorie Taylor Greene for Posting Coronavirus Misinformation,,1626744407.0
235,90941.0,Hate crime charges filed against 4 in torture of teen,,1483641716.0
236,90891.0,Nestle illegally fires worker for reporting racist comment,,1608061453.0
237,90850.0,Jeffrey Epstein Death: 2 Guards Slept Through Checks and Falsified Records,,1565870658.0
238,90808.0,Exclusive: Georgia doctor who forcibly sterilized detained women has been identified,,1600205357.0
239,90805.0,Rhino poacher trampled to death by elephant; remains eaten by lions,,1554592276.0
240,90660.0,"Louisville Metro Council Agrees To Ban No-Knock Raids. Breonna Taylor was killed nearly three months ago during a no-knock raid. All 26 members of the Metro Council have signed on as co-sponsors to “Breonna’s Law,” which would ban them.",,1591910713.0
241,90656.0,'Epstein Didn’t Kill Himself' Mardi Gras float causes a stir,,1582670925.0
242,90483.0,"Eddie Van Halen, Guitar Hero, Dies At 65",,1602013749.0
243,90459.0,"YouTube suspends Logan Paul’s ad revenue, blames ‘recent pattern of behavior",,1518180785.0
244,90422.0,Michigan becomes the 10th state to legalize recreational marijuana,,1541564118.0
245,90416.0,"Police officer fired after ""fabricating"" story about being served McDonald's coffee with ""f***ing pig"" written on cup",,1577757959.0
246,90167.0,Third Sandy Hook parent wins defamation suit against Alex Jones,,1633475492.0
247,90091.0,"MyPillow CEO says Bed Bath & Beyond, Kohl's stopped selling his products, prompting calls for boycotts",,1611066225.0
248,89869.0,Doctor who tweeted that she would give Jews the wrong medication loses ohio medical certificate,,1598386450.0
