,score,title,selftext,created_utc
0,82832.0,"This rare image, featuring the victims of the mass slaughter of peaceful protesters by the Chinese army at Tiananmen Square, was just censored from the front page of reddit with 134,000 net upvotes.",,1566399585.0
1,67105.0,This was deleted twice from reddit's front page.,,1522543474.0
2,44751.0,REMINDER: It has been 2866 days since Sean Hannity offered to undergo waterboarding for charity as proof that it's not torture and has not done it.,,1488043566.0
3,39141.0,"Reminder: 80 days ago a Billionaire pedophile, connected with every elite member, who owned his own island with underage sex slaves, killed himself before he was to testify. He was on suicide watch and killed himself by hanging on his knees. Don’t ever forget, those responsible are free.",,1572354205.0
4,38348.0,"This is my Senator. He sold me, my fellow Coloradoans, and this nation to the telecom lobby for the price of $95,023 [r/Colorado]",,1512129927.0
5,37119.0,Do you remember?,,1587464088.0
6,34808.0,90% of modern art is just tax evasion.,,1576259271.0
7,34629.0,Good question,,1597020296.0
8,34283.0,"Evidence of Hillary's IT guy, Paul Combetta, asking Reddit how to cover up emails.",,1474287283.0
9,34052.0,Sources: Jeffrey Epstein dies by suicide in Manhattan jail cell,,1565442004.0
10,33689.0,Admins are editing our posts guys. It's over.,,1479947232.0
11,33389.0,Remember who’s really responsible and hold them accountable,,1618236757.0
12,33154.0,My best friend's dog was shot and killed by the police when they showed up to the wrong house. They are trying to cover it up.,,1430750414.0
13,32136.0,I've never been so happy to see tbe front page of reddit (+17k upvotes),,1586309062.0
14,31641.0,"Andrew Yang on Twitter: ""Airlines got $25 billion in bailout money and cut 90,000 workers anyway. We are spending money to prop up companies that should just go directly to people and families.""",,1607297823.0
15,31572.0,This image is illegal in China. Tiananmen Square 1989 massacre,,1570734272.0
16,31210.0,Don’t Let This Die. Shes A Confirmed Child Sex Trafficker. She Was As Involved As Epstein Himself. She Ruined The Lives Of Children By Selling Them Into Sex Work To Blackmail High-Level Politicians & Aristocrats. Why Is She Not Under Arrest?! No Investigation? She Holds The Key To Epstein’s Secrets,,1572799850.0
17,30352.0,I just got permanently banned from r/interestingasfuck for this.,,1571851114.0
18,28887.0,HAPPENING: Epstein Fed-Ex Assassin AND Epstein private banker both commit SUICIDE. Both IN ADDITION to Judge/Judges son previously.,,1595289539.0
19,27875.0,Immortal Technique coming in with the hot take...,,1611881841.0
20,27133.0,"Terry Crews: ""If I have a timely 'accident' – you know where to look""",,1513451522.0
21,27118.0,"Hillary Clinton has received more money from the arms and weapons industry than any other candidate in history. Every time it is posted to /r/politics or /r/news, it is instantly downvoted to oblivion. This is an obvious manipulation by the Clinton campaign monitoring reddit.",,1450736808.0
22,27058.0,"I'm fucking TIRED of the fucking WAR on drugs. Jeff Sessions Demands ""Strongest Possible Charges"" For Drug Users. Fuck Jeff Sessions, and Fuck the War on Drugs",,1494657154.0
23,26954.0,Wonka knows,,1594993944.0
24,26843.0,"NSFW Natacha Jaitt Was An Argentine Whistleblower Exposing High Level Pedophile Ring Involving VIPs, Politicians, Movie Stars, Popes Friend, and Other Celebrities. She was ""Epsteined""",,1565894536.0
25,25899.0,"People seem to have forgotten all this, don't forget the shit FCC has pulled",,1535112831.0
26,25310.0,Hillary says “We will work to get money out of politics!” on the same day she accepts a $25 million donation from George Soros,,1469883489.0
27,25074.0,You in?,,1594687314.0
28,24054.0,"Reddit recently accepted a $150m donation from a Chinese company, tencent. Now, they're replacing a much bigger Hong Kong subreddit (r/hongkong) for a prochina subreddit in their search engine.",,1566905304.0
29,23713.0,The true conspiracy that is happening in broad daylight.,,1626373785.0
30,23573.0,This is the attitude we should take when it comes to these fucks,,1618491535.0
31,23492.0,Reddit actively removing video of Chinese police forcefully entering a woman's home to arrest her for internet posts,,1554731809.0
32,23469.0,4Chan user finds evidence of over 13k bodies being burned in an empty field outside of Wuhan,,1581101365.0
33,23259.0,Scums of the Earth,,1594477420.0
34,22730.0,"On the left is the former Vice President of Monsanto, a company that poisons everything you consume. On the right is the current Deputy Commissioner of the FDA, an agency that protects you from companies like Monsanto. This is legal.",,1534605451.0
35,22715.0,"This was just censored from the #1 spot on /r/all; ""Cops illegally confiscate guys phone and accidentally record themselves debating the best way to frame him"".",,1561818567.0
36,22682.0,"Ghislane Maxwell, long-time friend and confidante of Jeffrey Epstein, has been arrested by the FBI and charged by federal prosecutors",,1593696118.0
37,22653.0,"Due to Verizon's Super Bowl ad, remember that in the midst of raging wildfires Verizon throttled firefighters' data unless they paid more.",,1580691589.0
38,22462.0,It's like it never even happened...,,1598624854.0
39,22086.0,Gunman kills son of federal judge Esther Salas at their home. The Jeffrey Epstein Deutsche Bank case was assigned to Judge Salas just two days ago.,,1595213377.0
40,21873.0,The rabbit hole is deep..,,1612058839.0
41,21680.0,We can make use of the weapons they force on us,,1591101551.0
42,21580.0,Don’t Let This Die. Shes A Confirmed Child Sex Trafficker. She Was As Involved As Epstein Himself. She Ruined The Lives Of Children By Profiting Off Of The Sale Of Them To Blackmail High-Level Disgusting Politicians & Aristocrats. Why Is She Not Under Arrest?! Arrest Her Now!,,1568081448.0
43,20850.0,"Hello co-conspirators!! This is your daily reminder that NONE OF THE PEOPLE in this picture are on your side, (no matter what ""side"" you are on.)",,1589982343.0
44,20524.0,"TIL during the 2013 California drought, Nestle extracted 27,000,000 gallons of California drinking water for only $524, and resold it for millions. This received almost no news coverage.",,1534766102.0
45,20319.0,Always ask for a Receipt!,,1600172983.0
46,20284.0,President Donald Trump thinks Scientology should lose its tax-exempt status in the United States,,1510278219.0
47,20239.0,Your move ladies and gents.,,1569025629.0
48,20060.0,Biden Sexual Assault Coverup,,1585488729.0
49,19949.0,His name was Gary Webb.,,1560284926.0
50,19866.0,"9/11 WTC Towers Had Power Turned Off For 36 Hours the Weekend Before the Attack - Security Systems disabled, unknown ""workers"" everywhere.",,1485780101.0
51,19842.0,U.S. taxpayers gave $400 Billion dollars to cable companies to provide the United States with Fiber Internet. The companies took the money and didn't do shit for the citizens with it.,,1492003801.0
52,19766.0,This is the attitude we should take when it comes to these fucks,,1597330282.0
53,19750.0,Reddit Aggressively Censoring Content Critical of China: Story about Hearthstone player banned by Blizzard for pro-Hong Kong statement removed from THREE different subs on the front page of /r/all,"Yesterday, a [link to South Park's latest episode](https://old.reddit.com/r/undelete/comments/deopfe/211030576_south_parks_episode_band_in_china_which/) ""Band in China"" was removed from /r/videos after [hitting #2 on the front page](https://old.reddit.com/r/undelete/comments/deopfe/211030576_south_parks_episode_band_in_china_which/).

This morning, [this thread](https://old.reddit.com/r/worldnews/comments/dewc98/blizzard_suspends_hearthstone_player_for/) hit #4 on /r/all after [accumulating 54,000 upvotes](https://old.reddit.com/r/undelete/comments/dezfli/4520333305_blizzard_suspends_hearthstone_player/). 

[This post](https://old.reddit.com/r/pics/comments/dexnfb/hearthstone_pro_ng_wai_blitzchung_chung_recently/) from /r/pics was removed [after hitting #3](https://old.reddit.com/r/undelete/comments/dezbli/38116304_hearthstone_pro_ng_wai_blitzchung_chung/) on /r/all.

[This post](https://old.reddit.com/r/LivestreamFail/comments/dew4ij/after_the_hearthstone_hong_kong_incident_blizzard/) from /r/Livestreamfail hit [#15 before getting removed](https://old.reddit.com/r/undelete/comments/dextvo/153302386_after_the_hearthstone_hong_kong/)

[They are also censoring](https://old.reddit.com/r/hearthstone/comments/dezyit/53000_post_just_now_censored_from_redditrworldnews/) this discussion over at /r/Hearthstone.

AS I WAS LITERALLY WRITING THIS POST, [a second thread on this story](https://old.reddit.com/r/worldnews/comments/dezpcd/blizzard_bans_hearthstone_player_from_esports/) that had ALREADY hit #1 on /r/worldnews in an hour was REMOVED too.

This is happening in REAL TIME folks.",1570545256.0
54,19733.0,Bernie Sanders’ Presidential Run Was Sabotaged by Fake News - 'Nobody worried about fake news when it helped Hillary Clinton',,1480687005.0
55,19685.0,Proven conspiracies: In light of Epsteins's 'suicide' here is another high profile 'Suicide'. Gary Webb. Found Dead with two bullet holes in his head. (For all the newly recent active users),,1565526535.0
56,19625.0,Subtle ways to drive the media narrative and they use almost every one.,,1570627620.0
57,19510.0,"Ah, the good old days",,1593013099.0
58,19464.0,Is r/conspiracy surprised?,,1590687649.0
59,19456.0,Remember who’s really responsible and hold them accountable,,1609109045.0
60,19395.0,Mass media are keeping a lid on this. The DNC is trying to bury a class action law suit against them regarding them undemocratically favoring Hillary Clinton during the primary.,,1493655817.0
61,19378.0,Aubrey spitting facts.,,1594564120.0
62,18700.0,"Hillary Clinton's presidential campaign ends, and the next day an article detailing her financial ties to ISIS hits the front page of /r/politics. Finally",,1478702053.0
63,18549.0,"Saudi Arabia is mass murdering its Shia population and causing a genocide in Yemen. Meanwhile, the Reddit front page offers you a fawning photo of ""Saudi man teaching his wife to drive""",,1506966185.0
64,18354.0,"Man found stabbed inside his burning home in Fresno last week is confirmed to be John Lang, a police accountability activist who predicted the Fresno Police would kill him just days prior to his death",,1453956693.0
65,18280.0,You can't deny that YouTube is Propaganda now,,1507396190.0
66,18267.0,Congress gets a lot done actually,,1573673852.0
67,18235.0,"Here is how Colorado is spending it's Cannabis Tax revenue: $40 million in school renovations, $6.7 million went to treatment programs, $8 million to combat HS drop outs and bullying. This is what they are waging war against. Never let ANYONE forget.",,1515174656.0
68,18115.0,Tax dollars well spent?,,1608517156.0
69,17942.0,"In light of the banning of /r/fatpeoplehate, I nominate this picture for the sidebar",,1433962344.0
70,17525.0,"Judge demands answers from Jeffrey Epstein’s estate after millions of dollars flood into his dormant offshore bank in the Virgin Islands, and then ""disappear"". This adds weight to the supposition that Epstein is alive, and in hiding.",,1580915366.0
71,17372.0,"They view us as pawns, don’t forget that.",,1591287961.0
72,17335.0,Finally! No more kids in cages...,,1611191512.0
73,17209.0,"It’s been nearly a week since former Joe Biden staffer Tara Reade leveled disturbing accusations of sexual misconduct against the Democratic presidential frontrunner, and yet ABC, CBS, NBC, MSNBC and CNN haven’t said a single word about them",,1585672846.0
74,17207.0,ABC News Caught Faking w/Crime Scene Tape,,1480856474.0
75,17107.0,*everyone disliked that*,,1581532593.0
76,17079.0,FCC literally LAUGHING at the millions of comments of people pleading to save Net Neutrality.,,1513272868.0
77,17060.0,This one keeps getting removed from other subs,,1433980647.0
78,16903.0,Just a reminder,,1597288969.0
79,16894.0,FCC has been using dead peoples accounts to shill for ending Net Neutrality.,,1513346171.0
80,16841.0,"Newly leaked photo of Chauntae Davies, a Jeffrey Epstein victim, giving a back message to Bill Clinton. (2002)",,1597772984.0
81,16805.0,"CNN removed the August 11th, 1993 Larry King Episode from Google Play, the episode featuring a call from Tara Reade's mother. CNN is actively colluding with the Biden campaign to cover up evidence of Biden's sexual assault.",,1587865120.0
82,16797.0,We're reaching 1984 levels of deception in the media.,,1470233235.0
83,16763.0,"Dear Trump: the bill is now on your desk. Veto the shit out of it to protect the privacy of people YOU work for. Grow some balls and stand up to the swamp you supposedly were going to drain. If you don't, we WILL fight back","This needs to be said.

Edit: to all those who think I am still a Trump supporter, just so you all know, I WAS a Trump supporter, but have become extremely disillusioned with him and his administration. I plead to other Trump supporters to open your eyes and mind about him, being a little more skeptical about who he is, and his actions. I have learned he is a CONMAN, and he is no different from previous presidents before him, including Obama, Bush, and Clinton, PROBABLY worse.


We must stand up to him. We must not blindly obey him just because he said he was going to drain the swamp and you think he's playing 420D backgammon Chinese checkers. It's all bullshit, he's full of bullshit, and you all need to OPEN your eyes.

This is r/conspiracy for fuck's sake, NOT r/the_scumbag, or any other biased subreddit.

Be skeptical of ALL authority.


Edit2: I never voted for Trump. I stopped supporting him before election day. I bought into his bullshit during the beginning of his campaign when he was promising to drain the swamp, but I eventually realized how much we've been played and DUPED by this fuckwad.

Edit3: also if you want to sign a petition regarding this issue, check out this link

https://petitions.whitehouse.gov/petition/reinstating-protecting-privacy-customers-broadband-and-other-telecommunications-services

",1490757683.0
84,16711.0,Surprised no one talks about this here,,1618578144.0
85,16652.0,"Senator Jon Tester: I was just handed a 479-page tax bill a few hours before the vote. One page literally has hand scribbled policy changes on it that can’t be read. This is Washington, D.C. at its worst.",,1512221651.0
86,16619.0,"Americans haven’t figured that out yet. As long as some one keep choosing manmade sides and fighting over which liar is lying less, cant figure.",,1597587861.0
87,16602.0,r/pics mods removed this. Tiananmen protestors were swept to side of road like trash as tanks roll by in distance.,,1566470747.0
88,16586.0,"Welcome to 2021, where multi billion dollar oil companies lecture the average person on why they're damaging the environment.",,1624922978.0
89,16522.0,Critics are on the take,,1587909291.0
90,16448.0,"TIL The Susan G. Komen (Pink Ribbon/Breast Cancer) is a scam artist, her foundations takes in billions, but little goes back to those who need help.",,1491224453.0
91,16388.0,"TIL Ron Paul has his own show on Youtube ""The Ron Paul Liberty Report"", It's still relatively new. He's been attacked from the left and right throughout his whole career, let's promote independent media channels willing to speak the truth. Check it out and spread the word!",,1483667861.0
92,16348.0,Julian Assange,,1554976480.0
93,16341.0,"New year, new president, same old shit",,1614429128.0
94,16262.0,Bot Support for Ted Cruz on Twitter,,1536927865.0
95,16202.0,"Today reddit co-founder, and ardent defender of the free exchange of ideas on the modern internet, Aaron Swartz would have been 34. In his short time on earth, beyond co-founding reddit, Aaron also played a roll in RSS and helped to implement the Creative Commons License. RIP /u/aaronsw.",,1604854285.0
96,16189.0,90% of modern art is just tax evasion,,1594135251.0
97,16140.0,Two sides of the same coin,,1595678302.0
98,16084.0,This did not age well.,,1582638376.0
99,16088.0,"On a positive note, maybe this is what unites us?",,1565465220.0
100,16063.0,"After 3 weeks of protests in Venezuela, today is happening the biggest one and the whole world have to see it",,1492642845.0
101,16006.0,The Power of Propaganda,,1559679432.0
102,15818.0,I wonder how many people have been known to commit suicide by shooting themselves twice in the head.,,1549125443.0
103,15795.0,"Remember when Sacha Baron Cohen uncovered a child sex ring through a hotel concierge that said he worked for politicians and billionaires, then the FBI didn't want to pursue the case and dropped it?",,1593389273.0
104,15789.0,The worst shitcoin.,,1621450075.0
105,15700.0,"Nixon was impeached for deleting 8 min. of tape. Hillary deletes over 30,000 emails and can still run?",,1462467131.0
