,score,title,selftext,created_utc
492,8584.0,Both candidates suck but this...,,1472912959.0
493,8582.0,"CIA 'mistakenly' destroys copy of 6,700-page US torture report",,1463571144.0
494,8579.0,"The reporter who broke the story about the CIA selling Cocaine in the US had his reputation smeared, career destroyed, and was found dead from TWO gunshot wounds to the head... it was ruled a suicide",,1441131040.0
495,8572.0,‘RIGGED’: Trump slams DNC for ‘vicious plan to destroy’ Bernie exposed in WikiLeaks emails,,1469366337.0
496,8570.0,"CNN called out on twitter for their intentionally misleading coverage of climate change; ""100 corporations are responsible for 71% of the global greenhouse gas emissions...presenting the crisis as a moral failing on the part of individuals without nothing that fact is journalistic malpractice"".",,1539189940.0
497,8576.0,"WikiLeaks drops TPP, TiSA and TTIP leak",,1473939120.0
498,8559.0,Ice Cube shared this picture of Masonic police patches,,1591626144.0
499,8564.0,First they dumb you down.,,1588037367.0
500,8563.0,"Reminder: it’s been 81 days since the deadliest mass shooting in modern American history, and we still have no motive, the media is silent, and dozens of unanswered questions remain.",,1513871159.0
501,8563.0,Hillary Clinton made a small fortune by arming ISIS: Wikileaks,,1470310872.0
502,8549.0,"CBS News Reporter Ben Swann does a ""Reality Check"" on Pizzagate Story",,1484716325.0
503,8546.0,"CNN Journalist ‘Governments Pay Us To Fake Stories’, Shocking Exposé",,1470651693.0
504,8547.0,Nothing to see here move on...,,1602454556.0
505,8530.0,This is where we are at.,,1598479981.0
506,8519.0,The elites don't care about you. Stop caring about them. They live in a different universe,,1615503060.0
507,8517.0,NY mayor encourages people to take pics of neighbors breaking lockdowns and send them to police. Police are flooded with Dick-pics,,1587495165.0
508,8504.0,Calling all scientific minds who feel some way about COVID-19!,"I am in the process of setting up a website dedicated to increasing accessibility of scientific articles. In times like this, people take what the media gives them and either swallow it or are dissatisfied buy lack the resources to develop their own conclusion.

There are a wealth of studies dating back \~15 years about studies relating to bat coronaviruses, engineering viruses to do with the ACE2 receptor (the receptor COVID-19 utilises), and increasing pathogenicity in human cells. Alongside this, there are multiple credible articles to do with scientific discourse regarding virus creation, bribes linking Wuhan and Harvard, and containment breaches of SARS.

It is not a conspiracy site. It is a collation point for articles and studies the media is refusing to bring up, and only credible ones. CREDIBILITY IS KEY. I do not want to push a viewpoint; I want to allow people the freedom and the ability to synthesise their own opinion, except with all the facts.

I am after volunteers (I am not making nor intending to make money) with a scientific background to translate these studies into digestible bites (around 300-600 words) that someone with no scientific background could understand. Not condescending, but informative and simple, while maintaining accuracy. Take out the scientific jargon that makes the studies so difficult to understand, and try to explain them to an intelligent member of the public. There is a brimming pool of people who don't know who to trust or where to go, so I want to create a little platform for them.

If you aren't interested in writing but you have articles or studies you think would be useful, please DM them to me or leave them in the comments! I am a biotechnology (drug design) student, so I am also translating them. I just need help to get this on the move quickly!

EDIT: AHHHHHH WHAT A RESPONSE!! I am overwhelmed with the interest and did not expect this many people to believe in my idea. I am trying to respond as comments come in, but every single comment is appreciated! If I missed your comment (and I am so so sorry if I did) please DM me and we'll go from there!

EDIT 2: my DMs have stopped working. I am sending this form to everyone interested about your background study and skills and I CANNOT REPLY TO YOUR DM, IT WON'T LET ME. Anyone know why?

https://docs.google.com/forms/d/e/1FAIpQLSeGob-d6cJnj986tPlwTSNEMEDPYQDSSPn6pWwTJ21eh3V6Rw/viewform?usp=sf_link",1585191295.0
509,8497.0,Reddit is a joke,,1600026310.0
510,8502.0,"Q-ANON... i want to believe, but let's be honest, its bullshit","Yes, there are elite families that control everything from banking to media

Yes, politicians and celebrities are involved in child sex acts & trafficking

Yes, our entire existence is fabricated to keep us locked in this matrix state of being

But im sorry to break it to you folks... Donald Trump is not going to save us.. we are the only ones who can save ourselves.",1600767523.0
511,8481.0,"Whether you are for Biden or for Trump, we should all agree no private software company should control our elections.",,1605453825.0
512,8484.0,This is ACTUAL PROOF of Clintons selling favors to foreign governments during her time as SoS. Deleted from 4 subreddits already. /r/Conspiracy is my last bastion of hope.,"https://www.reddit.com/r/Political_Revolution/comments/5aqb8u/wikileaks_bombshell_exposes_extent_of_clinton/

This is big. Could bring down the entire Clinton Foundation, and anybody whose touched it, if a RICO case is brought. This is ACTUAL PROOF of Clintons selling favors to foreign governments during her time as SoS.

* https://assets.documentcloud.org/documents/3183007/Memo-from-Bill-Clinton-aide-on-how-Teneo.pdf - The Memo
* Source: https://wikileaks.org/podesta-emails/emailid/35400
* https://wikileaks.org/podesta-emails/emailid/36761 - ""I'm also starting to worry that if this story gets out, we are screwed.""
* https://wikileaks.org/podesta-emails/emailid/21978 - Fall out
* https://wikileaks.org/podesta-emails/emailid/9665 - The cover up

Relevant search: https://wikileaks.org/podesta-emails/?q=&mfrom=doug%40presidentclinton.com&mto=&title=&notitle=&date_from=&date_to=&nofrom=&noto=&count=50&sort=2#searchresult

=========================
----------------------------------------------


EDIT: I just got back from eating, and this thread has gone off the charts. I'm really having trouble keeping up. From here on, I will only be able to reply to comments directly on my own comments, or ones that I am tagged in via ""/u/dataphreak"". In the mean time, it's time to start digging. We've exposed the Dow angle for motive to access the Secretary of State at the time, but there are plenty of other companies and dates. Each one deserves its own thread. Find stuff, post it, tag me in the comments, and I'll come check it out with you.

Stay safe.


---------------------------------------------

Update: [FBI's Clinton Foundation investigation now 'a very high priority,' sources say](http://www.foxnews.com/politics/2016/11/02/fbis-clinton-foundation-investigation-now-very-high-priority-sources-say.html) - """"There is an avalanche of new information coming in every day,"" one source told Fox News, who added some of the new information is coming from the WikiLeaks documents and new emails.""

-FoxNews

=======================

Going to bed now guys. Hope I live to see tomorrow. -_^

------------------------------------------

Good morning! I didn't die!

----------------------------------

/u/reini_urban found this. Definitely should be added.
http://www.globalresearch.ca/breaking-hillary-clinton-to-be-indicted-on-federal-racketeering-charges/5527829

More: http://observer.com/2016/11/wikileaks-clintons-sell-political-favors-to-clinton-foundation-donors/

-----------------------------------

Late late late update:

https://wikileaks.org/podesta-emails/emailid/50025 - Doug Band to Podesta.

RICO.

Did

I

Fucking

Stutter",1478108544.0
513,8483.0,"@ggreenwald: ""Note how Sanders is going after Trump on what voters care about - SS & Medicare - rather than ranting about Putin & imaginary Kremlin plots""",,1483622445.0
514,8478.0,Project Veritas Caught by the Washington Post Running a Sting Operation to Discredit Roy Moore Pedophile Reporting,,1511820081.0
515,8457.0,The list goes on...and on...and on...,,1606877298.0
516,8464.0,No words describe this,,1503946191.0
517,8454.0,"What Are The Odds?? Same Guy That Filmed France Truck Attack, On Scene at German Mall Shooting..","German journalist Richard Gutjahr, 42, who filmed the scene unfold, said: 'I stood on the balcony, right on the Promenade des Anglais, and saw how people celebrated there, and how suddenly a truck drove through the crowd,' he told AFP on Friday. 

http://www.dailymail.co.uk/news/article-3691144/Horrifying-footage-shows-moment-terrorist-ploughs-truck-screaming-Bastille-Day-crowd-killing-73-Nice.html

Local reporter Richard Gutjahr described the scene at the shopping center as something ""out of a bad movie,"" with the shopping center completely surrounded by police, a helicopter overhead, and police carrying semi-automatic rifles. Gutjahr was not able to confirm reports of deaths or injuries. 

http://www.motherjones.com/politics/2016/07/multiple-people-killed-shooting-munich-shopping-mall

Richard Gutjahr who filmed the Nice France Bastille Day Staged attack is married to Mossad agent and Knesset member Einat Wilf. To quote Mossad agent Richard Gutjahr this video is like something ""out of a bad movie"" ",1469230943.0
518,8443.0,Ghislaine Maxwell at Chelsea Clinton's wedding. You don't accidentally get invited to a wedding. Why was she there?,,1623060032.0
519,8439.0,"700,000 Petition the US Government to Stop Monsanto-Bayer Merger",,1474892611.0
520,8428.0,"Private Internet Access, a VPN provider, takes out a full page ad in The New York Time calling out 50 senators. (X-Post r/pics)",,1490581667.0
521,8413.0,"If you find it hard to accept that people are actually murdered because they represent a threat to political and financial power holders, well, I'm 68 years old and I'd like to remind you that when I was a teenager the list of those murdered for such reasons included JFK, MLK, Malcolm X, and RFK.","And these are only the four who are most well known and who were murdered in public.  The list is a very long one.  Murder is very common.  To this list I will add Huey Long, Presidents Lincoln, McKinley and Garfield.  If we were to also list those who survived murder attempts we would add Presidents Teddy Roosevelt and Ronald Reagan.  Then others such as Yitzhak Rabin, George Wallace, and many more.  It has been said that Murder is as American as Apple Pie and there is enough truth in this that no one should suspend their ability to accept the commonality of it.  [My comments have only scratched the surface.](https://www.wikiwand.com/en/List_of_United_States_presidential_assassination_attempts_and_plots)",1495070448.0
522,8403.0,Posted a year ago and has been confirmed in recent events.,,1567091897.0
523,8391.0,Let’s not forget about the newest legislation introduced by The Traitorous Three...,,1593289886.0
524,8366.0,Terry Crews goes against BLM with a better message,,1593990903.0
525,8366.0,Y’all don’t forget about this child trafficker.,,1602255801.0
526,8364.0,Google and YouTube caught actively censoring negative Clinton coverage.,,1477836848.0
527,8360.0,Made a tool to investigate the Las Vegas Shooting: ALL footage released and visualized. (calling all investigators),"It's been almost 4 years and there's still no official motive for the biggest mass shooting in American history. The media unilaterally dropped the story a week after the shooting in Las Vegas occurred. **Why?**

In an effort to pull this incident out of the memory hole, I took all of the public footage that has been released, and mapped out interpolated timestamps and geo-coordinates. The result is a tool that gives you a god's eye view of the shooting as it unfolds, on a second by second scale.

All security cam, traffic cam, cell phone video, and even police bodycam video from that night is on the map here:

[www.vidi.world/explore](http://www.vidi.world/explore?utm_source=r_conspiracy&utm_medium=reddit&utm_campaign=alpha)

&#x200B;

[each green dot is video that covers the exact second selected on the timeline at the bottom](https://preview.redd.it/69e4qmvpza571.png?width=2166&format=png&auto=webp&s=d8c5437f334fba14575b6ea81a62f1a9b33ebe59)

If you know anything about this case, or are good at online sleuthing and want to help us dig through all of the footage for clues, please jump into the vegas channel in our discord here:

[https://discord.gg/nPQM7TEXfS](https://discord.gg/nPQM7TEXfS)

Any and all help is appreciated, even if you just have memes and good vibes to contribute.

**tldr: please help us dig into the las vegas shooting. a lot of people asking how to help: either join the discord and contribute finds from the videos, or share this with people you know who would support a mass exodus from MSM.**

Edit: thanks for all the love. If this is useful I hope to expand the tool into a general citizen journalism platform for collecting evidence and investigating events ourselves, so we no longer need to rely on the MSM.

There's a feature I didn't mention before - if you pin videos that are nearby each other in time and space, you can click the little share button to the left of your pinned videos, and it generates a multi-view link. Soon this will also automatically sync the videos by time so you can see multiple angles of the exact same moment in time.

edit 2: UPLOADING IS LIVE www.vidi.world/#upload",1623708141.0
528,8351.0,The future is bright.,,1609257855.0
529,8359.0,What the establishment truly fears.,,1603076724.0
530,8350.0,Remember Laura Silsby?,,1565284588.0
531,8340.0,Taxes are essentials.,,1595125993.0
532,8336.0,"2 Days Until National Gary Webb Day: August 31, 2020 (Gary's Birthday); Gary Webb's ""Dark Alliance"" exposed DRUG SALES in U.S. cities by the Contras & the CIA funded wars in Latin America. He was found dead from 2 bullet wounds (suicide)in 2004. Maxine Waters found that a U.S. employee ran drugs:",,1598765058.0
533,8326.0,"Remember, it's been 45 days since Epstein died. The media's constant bombardment of mass shootings, Iran, and climate change has once again swept away another high profile care. The 24 hour news cycle exists so that we don't get fixated on one topic for too long.",,1569333916.0
534,8325.0,I microdosed psilocybin mushrooms for 3-4 months. I see everything and everyone differently and I think it’s important that everyone try psilocybin.,"Started off slow just .2 grams like every 2 days or so. Real small amount. Didn’t kick in at all for a month I felt nothing and nothing changed psychologically. 

A month or so in I started getting obsessively curious about obesity rates and fitness culture and why people are so sick. I dove in deep. 

Researching for days and weeks looking through the original usda dietary guidelines. Made me physically ill and disgusted to see the truth. That the government was knowingly poisoning and making the people ill. 

6-11 serving of grains a day is a 1992 usda food pyramid recommendation. 

Started looking into the hormonal glycemic responses from foods and you start to notice how they used the word “calorie” to confuse the masses. 

Because surely a calorie of ice cream is not the same effect as a calorie of fish so why do they even use that as a tool for weight management?

It’s so they can continue to feed people processed foods that have a heavy glycemic content. Spiking insulin and blood sugar- leading to diabetics and crazy obesity rates. 

My whole world changed. I quit eating anything that I couldn’t kill or grow. All my extra weight fell off. My sleep quality increased dramatically. My workouts were always really good. 

Then the phone became too much. I got a flip phone and started leaving my smartphone turned off. I only used my smartphone as a gps if I really needed one. 

I was on this path to kind of going backwards in a sense. I didn’t want the tech. I wasn’t consciously thinking this either it just slowly happened and I adapted into this different person. 

I was way closer with family I reconnected with siblings I felt closer with my partner. 

I made phone calls on a flip phone if I wanted to talk to someone. I had to leave the house to see people I’d take my dog to a nearby coffee shop. 

My ego completely died. I became an observer of whatever was around me. It’s not something explainable unless you have felt it yourself and I’m sure some of you here have. It’s like you’re just the place you’re in looking at itself. It’s the most unexplainable moment I’ll ever have I think.

I felt more appreciative. Of everything and I think that’s the most important thing. 

I appreciated seeing a bird at the park in the mornings. I appreciate the smell of the grass and the sunshine on me. I appreciated my dog and all I though about how she was going to eventually die (sounds morbid) but I will make the best of our moments together maybe that’s why I feed her my food so much. 

I don’t think we were ever meant to have all of this synthetic shit. 

It’s killing all of us. 

The fake processed food. 

The fake virtual world of social media and social status based on what people want to appear to be. 

The artificial communication through screens. You aren’t even looking the person in the eye. 

The farther we stray from nature and each other, the more sick we become. In every way.

Dang I just woke up. People got spicy af in the comments. I wish I could sit face to face with each one of you and actually experience an organic conversation that would be amazing. No internet ego just me and you sitting there as people. I wonder how different some of you are in person. Love you all have a great day I’m gonna go lift outside with my dog get some sunshine🌞

My account got banned for like a week lol so my bad for not responding to those who messaged me.",1615282175.0
535,8313.0,How an extra GPS tracker on a drug dealer's car unraveled a corrupt Baltimore police force that robbed homeless people and resold confiscated heroin and ecstasy back on the street,,1522850679.0
536,8309.0,Surprise surprise...,,1593950210.0
537,8309.0,Dr. Michael Baden to oversee Epstein autopsy...,,1565601727.0
538,8306.0,"Anthony Bourdain took Chantix to quit smoking, a drug that has more cases of suicidal thoughts, self-harm, and homicidal thoughts than any other drug, by a more than three-fold margin",,1528652389.0
539,8305.0,"In this age of 'Fake news', let's remember that the Media decides our reality.",,1481833781.0
540,8307.0,Jeffrey Epstein’s Private Banker at Deutsche & Citi Found Swinging From a Rope; Executive ‘Suicide’ Before FBI Questioned Him,,1575386717.0
541,8293.0,"NY pension chief invests $100 million into controversial gas company, then immediately retires, and takes $300k part time job with said company",,1537871484.0
542,8292.0,The essence of /r/conspiracy,,1569407073.0
543,8284.0,Epstein should have been the most protected inmate in the history of protective custody. Especially after one prior attempt on taking his life.,,1619701574.0
544,8271.0,Everyone enjoying the Great Reset?,,1623975201.0
545,8271.0,The real conspiracy we will all face at some point in life either directly or indirectly.,,1606723568.0
546,8271.0,The real reason elites make political contributions. Nothing to do with ideology.,,1583330118.0
547,8269.0,10 Year Challenge Plot,,1619268447.0
548,8248.0,"Trump just tweeted: ""Subject to the receipt of further information, I will be allowing, as President, the long blocked and classified JFK FILES to be opened.""",,1508589430.0
549,8240.0,When you own the media,,1457443719.0
550,8232.0,He spoke truth. Rest easy,,1624538995.0
551,8187.0,"FBI recommends no charges against Clinton, but Snowden & others didn’t get off so easy",,1467806690.0
552,8186.0,"In Leaked Speech, Clinton Promises Bankers to Stand Against Pot Legalization 'In All Senses of the Word'",,1476206468.0
553,8174.0,What the REAL conspiracy theorists believe...,,1612712200.0
554,8144.0,FBI re-opens Hillary email investigation!,,1477675033.0
555,8134.0,"No One Knows Why Epstein's Secret Bank Account Moved Millions Since His Death: Epstein's lawyers say that the payments were made “in error,” but a judge is not satisfied with the explanation and has demanded a full accounting of the payments made from the estate.",,1581007461.0
556,8119.0,"Nestle CEO: Water Is Not A Human Right, Should Be Privatized",,1441791828.0
557,8100.0,"CNN disguises lobbyist interns and democratic politicians as ""mothers, voters, and students.""",,1551249588.0
558,8096.0,To all of yous blaming either Trump or Biden on Afghanistan fall out :,,1629174099.0
559,8086.0,The 1.6% still own slaves today,,1598239230.0
560,8090.0,This Wayfair thing is really starting to creep me out... We may actually be on to something...,,1594432017.0
561,8077.0,"Cops Who Flash Banged Infant's Crib Are Blaming the Baby in Court, state; ""The act of sleeping in a room about to be breached by a SWAT team constituted “criminal” conduct on the part of the infant.""",,1432217568.0
562,8062.0,Apple and Samsung fined for deliberately slowing down older phones.,,1542624605.0
563,8061.0,Fairness of justice system in America,,1527421828.0
564,8060.0,Little Accident in 2007,,1592190087.0
565,8059.0,"Today marks the 50th year since the Ohio National Guard fired on Kent State University students during an anti-war protest, claiming the lives of four students and injuring nine others, on May 4, 1970. Never forget who the military actually works for.",,1588620842.0
566,8058.0,There should be a petition for this.,,1605637438.0
567,8023.0,Three Anti-Clinton Officials Found Dead In One Month,,1470486928.0
568,8026.0,"Jeff Bezos’ Whole Foods slashes medical benefits for nearly 2,000 part-time workers — Bezos, net worth $115 billion, makes enough money in 2 to 6 hours to more than cover the cost of an entire year of benefits for all of the workers facing cuts.",,1570120036.0
569,8016.0,New Poll Shows 60% of Americans Think Hillary Clinton is Untrustworthy and Dishonest,,1446927178.0
570,8006.0,Rep. Tulsi Gabbard Introduces Bill to Permanently End Warrantless Collection of Americans’ Emails,,1495485985.0
571,8010.0,The sad truth,,1616183987.0
572,8012.0,Every Time Facebook Or Twitter Censor Free Speech In Poland They Will Face $2.2 Million Fine,,1609644702.0
573,8006.0,"If there is one conspiracy I believe in, its that at least 50% of the web are Fake News/Propaganda. China, Russia, USA or Nazis. All of them spreading lies to push their agenda. The internet is the battleground for our hearts and minds and it makes me sad to see how many people fall for it.",,1590152513.0
574,8002.0,How long do you think this post will survive before being censored?,,1566952072.0
575,7999.0,Something to think about,,1588880472.0
576,7994.0,Amazon deletes one-star reviews of Hillary Clinton's new book,,1505323093.0
577,7991.0,Tomorrow's election results already on CNN.,,1584391720.0
578,7987.0,The rich are stealing from you and then telling you that it's greedy to want YOUR money to pay for your education,,1622735871.0
579,7968.0,On the holy occasion of Biden beginning his bombing campaigns in Syria,,1614349917.0
580,7963.0,And who controls all of it?,,1574227152.0
581,7960.0,Daphne Caruana Galizia - She died to bring us the Panama Papers! Remember Her!,,1562702396.0
582,7952.0,How is this not THEFT?,,1612151637.0
583,7950.0,Ted Cruz wrote to A.G. Barr about Cuties. Let’s hope this goes somewhere.,,1599953211.0
584,7927.0,Do you guys remember when all those celebs sang imagine and we all came together and told them to fuck off? Lol,That was rad.,1610643038.0
585,7928.0,Figure ya'll will like my x-mas sweater,,1576201625.0
586,7918.0,"Thanks a lot asshole: With only days remaining in office, Obama announced new rules that will let the NSA share private data gathered without warrant, court orders or congressional authorization with 16 other agencies, including the FBI, DEA and DHS.",,1484474377.0
587,7903.0,Feminist who tortured a man for 15-20 days and was sentenced to 25 years in prison was speaker at the 'Womens March'. MSM is praising her.,,1485167174.0
588,7901.0,Remember this when the NBA is shoving BLM down your throat,,1617453802.0
589,7907.0,The old Top Gear cast on their new show Grand Tour dropping some truth (Jeremy Clarkson and Richard Hammond ) pointing out the flaw in the US' logic after 9/11 - Calling out Saudis.,,1577196067.0
590,7897.0,"Now we now why she didn't fit the "" script """,,1599879131.0
591,7889.0,"Warden who was in charge when Jeffrey Epstein supposedly died in his cell, gets promoted to cushy Club Fed job.",,1579963314.0
592,7868.0,Amazon Made $5.6 Billion in Profits Last Year and Reportedly Paid Zero American Dollars in Federal Taxes,,1519747960.0
593,7866.0,"Oligarchs are controlling all aspects of life, they are not voted into any office, they buy all politicians, and we are forced to accept their will, regardless if its good for us, which is never the case btw",,1588202756.0
594,7862.0,Anyone else ever notice that racism is very bad unless you are Israeli?,,1589803526.0
595,7854.0,This sand sculpture in Las Palmas California looks like it was made by one of us,,1601762982.0
596,7845.0,"Here's the censored CBS clip where Bill Clinton says Hillary faints frequently. If you're unaware, the media has edited it out of the interview... #StreisandEffect",,1473801392.0
