,score,title,selftext,created_utc
801,6620.0,"What pisses me off about covid lockdowns is how the people who's paychecks are not threatened (politicians), are telling people who are losing money that we're ""all in this together."" Meanwhile they secure their paycheck by taxing business owners, and giving subsidies to big corporations.","I'm not anti-mask. I don't give a shit if I have to wear a piece cloth in public. What infuriates me is how government workers who aren't losing their income are telling people who are losing money daily that they can't open. They'll still take their cut of property tax to keep their cheque secure. They then proceed to give the billion dollar bailouts to the massive corporations, and then preach about how to fix poverty. Then they have the nerve to call people who open against public health suggestions selfish. Fuck lockdowns. I don’t even own a business my self, and I have no gain from lockdown ending. I just can’t stand this.",1605054258.0
802,6617.0,"""Adolf Hitler showing symptoms of amphetamine use"". I saw this and started doing some research. All of Germany was high as fuck. On the eve of World War II, Germany was a pharmaceutical powerhouse.",,1553648174.0
803,6619.0,"Damn I miss Ron Paul, he is so right on Syria.",,1491522515.0
804,6613.0,"Trump warns Epstein's island a 'cesspool' in 2015, implicates Prince Andrew",,1595017957.0
805,6601.0,"REMINDER: The University of Alaska Fairbanks is set to release its $300,000 computer model of Building 7. This finite element analysis of the 3rd tower collapse on 9/11 has exposed the official NIST report as fraudulent. UAF's 2 year project is banned from /r/engineering, /r/physics, and /r/science",,1488128474.0
806,6603.0,"Wikileaks, in 10 years produced 10 million documents with 100% accuracy. How does that compare to NBC, CBS, ABC, CNN, Fox, MSNBC, Washington Post, New York Times etc.?",,1478453045.0
807,6607.0,The Jefferey Epstein Scandal is NOT an Isolated Incident -- He Is NOT The Only Child Rapist Involved With The US Government,,1565703070.0
808,6595.0,burger king just publicly confirmed police deleted security footage from Chicago police shooting,,1448461843.0
809,6598.0,"Don't worry, corporations would never do harm against you, especially through medicines and vaccines! It'll hurt profits!",,1623363110.0
810,6589.0,Fellow /r/conspiracy community: I propose we add the DNC's 'Hillary for 2016' collusion to the list of confirmed conspiracies.,"After the Wikileaks emails, and Schultz's resignation, I think this needs to be put on the locc. There's enough hard evidence by now that Schultz, Hillary, and other members of the DNC were working together in secret to undermine the rules of the DNC, undermine the democratic process of our nation, and force upon the American people a presidential nominee.",1470142954.0
811,6588.0,Their priorities are so obvious,,1607745847.0
812,6583.0,Mouthy buddah channel got deleted,,1602781314.0
813,6582.0,"Censored from #1 on /r/all due to non-existent ""paywall""; ""TIL Mark Zuckerberg was sued by 3 reporters from the Crimson, after Zuckerberg hacked into their email accounts to monitor the investigation against him. He used their invalid logins on facebook.com, to zero in on their email passwords.""",,1523212098.0
814,6583.0,"The funniest part of the “2020 worst year ever” meme is that if everyone would just unplug from social media, they wouldn’t even know about 95% of what happens.","For 99.9% of human history, people lived in small communities and the people within those communities are the only people they ever knew.

YOU WEREN’T MEANT TO KNOW AND STRESS OUT ABOUT EVERY SINGLE FUCKING ISSUE ON THE PLANET.

But because everyone is special now and everyone just has to have their opinion heard, everybody has to be online and plugged into the matrix 24 hours a day 7 days a week.

The human brain hasn’t changed all that much in the last thousand years. Just because you have a phone now doesn’t mean you still don’t have that same caveman brain.

So what happens is you go online and surround yourself with negative energy and eventually your brain starts to think these things are actually affecting you because subconsciously it can’t tell the difference between reality and social media.

This is actually the exact reason why movies and tv shows are such an effective form of brainwashing. Your conscious mind realizes it’s just entertainment, but your subconscious mind can’t tell the difference.",1590750108.0
815,6585.0,"Anonymous member receives FBI investigation documents from a whistleblower that show that the CIA was responsible for the 2001 anthrax attacks, which was a a psyop to fuel public terror and build support for the Iraq War. He's subsequently arrested on child porn charges and tortured by the FBI.",,1427012308.0
816,6575.0,Protestors in Hong Kong are cutting down facial recognition towers,,1566738935.0
817,6571.0,"Why is it easier to blame 150,000,000 Americans being 'lazy' rather than 400 Americans being greedy.",,1512791131.0
818,6573.0,And that's on Elite Cover up. #Pizzagate,,1594124836.0
819,6556.0,Technology has existed on this planet that could propell humanity forward but TPTB will always eliminate any threat to their power of control over the money,,1611050348.0
820,6559.0,Oprah needs to be investigated,,1596729420.0
821,6559.0,Megathread: Ghislaine Maxwell (Epstein) documents unsealed. Important excerpts will be added here.,"***This post will be updated regularly as more is uncovered.  Dark to Light!***

In September 2015 Virginia Roberts Giuffre (VRG) sued Ghislaine Maxwell for defamation in New York federal court.  The documents unsealed today by Judge Preska are those that were filed under seal in that case in 2015.

There is overlap with older released documents, so some of this may not be new.  More will be released Monday.

(Edit: Two Clinton judges on the 2nd U.S. Circuit Court of Appeals [delayed release of the 2016 deposition] (https://www.newsweek.com/ghislaine-maxwell-deposition-release-delayed-appeals-court-1522099) until September 22.)

[**The source documents are here.**](https://www.courtlistener.com/docket/4355835/giuffre-v-maxwell/?filed_after=&filed_before=&entry_gte=&entry_lte=&order_by=desc)  The link may be down at times.

I am finding that all of the so called compilation PDFs, ZIPs, and dumps are incomplete or parts of the old Epstein docs of 2019.  [Exhibit 15 always seems to be missing, which implicates Bill Clinton and Prince Andrew.](https://assets.documentcloud.org/documents/7010927/Virginia-Giuffre-Interview-2011.pdf) Only go to the source for the complete unsealed documents.  

[**These are the older Epstein files released in 2019, a 2,024 page PDF**](https://www.documentcloud.org/documents/6250471-Epstein-Docs.html).

There is some confusion about what documents are old and what is newly unsealed, which may be deliberate attempts to muddy the waters.
______________________________

**Important Excerpts:** 

* Virginia Roberts Giuffre says she was [trafficked by both Epstein and Maxwell](https://i.postimg.cc/T1x2VqpZ/Image-26.jpg) to many men including Glenn Dubin, Stephen Kaufmann, Alan Dershowitz, George Mitchell, Prince Andrew, Marvin Minsky, Jean Luc Brunel, Bill Richardson, a ""large hotel chain owner"" (probably Thomas Pritzker), and [many others that she could not recall.](https://i.postimg.cc/7ZQNjvLx/Image-17.jpg)

* [Allegations of minor VRG being trafficked to Maxwell, Prince Andrew, and Alan Dershowitz.](https://i.postimg.cc/d1d3wCmW/Ee-N7-Qo5-X0-AAh-Ly-J.png)

* [The trafficking scheme was international in scope: In France, Ghislaine Maxwell ordered her give an ""erotic massage"" to a French hotel magnate. Deposition of the victim:  ""I was ordered by Ghislaine \(Maxwell\) to go and give him an erotic massage.""](https://i.postimg.cc/tThqLjpw/Ee-N9-UBVXYAILArf.png)

* [Epstein bragged about having 12 year old girls from poor French families flown in for his birthday.](https://i.postimg.cc/sx69XmnP/Image-29.jpg)

* [Witness interview: Bill Clinton was at Epstein's island with Jeffrey Epstein, Ghislaine Maxwell, and ""2 young girls.""  Sexual orgies were a regular occurrence.](https://i.postimg.cc/SQgFjsTV/Ee-OBNEl-Wk-AUYRgh.png)

* [VRG listed names who flew on Epstein’s private jet, including Naomi Campbell, model Heidi Klum, Clinton, former Vice President Al Gore, and Simpsons co-creator Matt Groening, as well as Jacques Cousteau’s granddaughter Alexandra Cousteau.](https://i.postimg.cc/zfqMPntC/C3870-E88-CADD-45-BC-9758-757-A04921-C9-C.png)

* [Allegations against Marvin Minsky: Maxwell directed the minor to have sex with former MIT scientist Marvin Minsky at Epstein's complex in the US Virgin Islands.](https://i.postimg.cc/4N4fFqM2/Ee-N-KEOXk-AAjfwj.png)

* [Allegations against Dershowitz: Not only did Dershowitz abuse the minor, but he helped draft a non-prosecution agreement that gave Dershowitz immunity.](https://i.postimg.cc/gJPdyT8D/Ee-N-Yj1-Xg-AAj-QM8.png)

* [VRG said that she never saw Trump on the Island, at Epstein's home, together with Epstein, or with any of the girls, and that he never flirted with her.](https://i.postimg.cc/6pq2tRGK/pjfvt6ypk6e51.jpg)

* [VRG claims she was trafficked to a ""Spanish"" ""40s"" foreign president. Could be Andres Pastrana.](https://i.postimg.cc/bJQwMFn6/Image-22.jpg) 

* [Emails between Epstein and Maxwell: Epstein instructs Maxwell on how to deny allegations. Epstein tells Maxwell she had ""done nothing wrong."" ""Go to parties. Deal with it.""](https://i.postimg.cc/5NDrFFw5/Ee-OEip-OXg-AE4-NR0.jpg)

* [This is big: The FBI was in contact with Epstein and Ghislaine Maxwell's minor victim back in 2014, yet they did nothing.](https://i.postimg.cc/QMJYP4vS/Ee-OFYX0-WAAAFXOK.png)

* [Heartbreaking:  The minor victim VRG was asking the FBI for the evidence \(photos and videos\) they seized from Epstein. Why? So she could prosecute her civil case.](https://i.postimg.cc/g0mNvyrh/Ee-OGPAm-Xg-AAc-Agg.png)  Let's be clear, the FBI HAD PHOTOS AND VIDEOS AND DID NOTHING.

* [Remember that famous Prince Andrew photo with Ghislaine Maxwell and the victim?  The FBI had their own copy for years - even before the victim's 2011 FBI interview.  The FBI knew!  They always knew.](https://i.postimg.cc/8Py6yhyW/Ee-OL1-x-Wo-AEMoud.jpg)

* [The DOJ let free Epstein's co-conspirator's in the FL case.  This included Maxwell and Sarah Kellen.  Here the victim describes the abuse during flights from Epstein, Maxwell, and Kellen.](https://i.postimg.cc/852SknPW/Ee-OPMa-WWAAATh-Pn.jpg)

* [VRG alleges that Maxwell is sexually attracted to women, observed Maxwell having sex with Emmy Taylor and Sarah Kellen, and that she personally had been abused by Maxwell.](https://i.postimg.cc/CLKfBSkS/Image-24.jpg)

* [Maxwell also took numerous sexually explicit pictures of underage girls involved in sexual activities.  She shared these photographs (which constituted child pornography under applicable federal laws\) with Epstein, likely for blackmail.](https://i.postimg.cc/J4LjVP8B/Screenshot-2020-07-31-gov-uscourts-nysd-447706-1090-6-pdf-1.png)

* [Epstein trafficked children for sexual purposes to powerful men, including numerous prominent American  politicians, powerful business executives, foreign presidents, a well-known Prime Minister, and other world leaders.  Epstein required the women to describe the events that she had with these men so that he could potentially blackmail them.](https://i.postimg.cc/QtvkT3v6/Screenshot-2020-07-31-gov-uscourts-nysd-447706-1090-6-pdf.png)  
______________________
Donate to VRG's charity https://victimsrefusesilence.org",1596163513.0
822,6564.0,A tale of two drugs.,,1595963948.0
823,6544.0,Daily reminder that Epstein was killed to protect wealthy and high-status pedophiles,its a fact you know,1589317831.0
824,6552.0,/u/Fluck needs gold for this,,1377656492.0
825,6549.0,Vive la France!,,1580407713.0
826,6551.0,If only more people realized this.,,1418797968.0
827,6545.0,The masses have never not been completely duped,,1625620247.0
828,6548.0,Latest Guccifer 2.0 Leak Reaffirms Primaries Were Rigged for Clinton,,1468883832.0
829,6534.0,"Since Princeton University is removing Woodrow Wilson's name from its buildings due to his racist thinking and policies, I think we should also repeal the Federal Income Tax and The Federal Reserve, as both acts were signed into law by Wilson. Letting either law stand is racist.","---Peter Schiff

The Federal Reserve is the grand daddy of conspiracies in the US. The literal takeover of the money supply by private bankers. Every dollar printed by the Fed is done so at debt, meaning there is a burden associated with it. 

Lincoln know this and exploited the knowledge [to help him win the Civil War](http://www.xat.org/xat/usury.html), but the bankers eventually parlayed that in the 1913 bill signed by Wilson. Since we are now rewriting history, this could be a chance to fix the most nefarious conspiracy ever propagated on the American people.",1593354031.0
830,6540.0,"Professors around America have been caught selling secret research to the Chinese Communist Regime. The national media won't cover it, so here's a list of who have been caught so far.","1. [This UCLA professor](https://www.campusreform.org/?ID=13423) was caught selling Air Force/Navy missile secrets to the Chinese. He's facing 219 years in prison.

2. [The head of the Chemistry Dept. at Harvard](https://www.campusreform.org/?ID=14286) was caught secretly taking $1.5 million from the Chinese to set up a medical research lab in…WUHAN.  In addition, he was paid up to $50,000 a month for other research he smuggled to the Chinese.

3. [This professor](https://www.campusreform.org/?ID=14256) from the University of Kansas had 2 research contracts with the Department of Energy.  Turns out he was secretly working for the Chinese and smuggling research to them all along.  He now faces 50 years in prison.

4. [This is Zaosong Zheng.](https://www.campusreform.org/?ID=14250) He was caught trying to smuggle 21 vials of cancer research from a Harvard medical lab to the Chinese goverment.  He now faces 30+ years in prison.

5. [This Professor](https://www.campusreform.org/?ID=14873) from the world renowned Cleveland Clinic was secretly giving information to the Chinese while receiving $3.6 million in tax-payer funding for his ""research"".

6. [This Professor](https://www.campusreform.org/?ID=14497) in West Virginia took ""paternity leave""... then flew alone to China to secretly conduct research for their government. There, he was given a half million dollar ""research subsidy"" along with over $250,000 in ""living stipends.""

7. [This Professor](https://www.campusreform.org/?ID=14856) in Arkansas was applying for a federal research grant from NASA when an investigation showed he was simultaneously receiving payments from the Chinese government.  I'm sure it was just an accident that he forgot to disclose that part.

8. [This Professor](https://www.campusreform.org/?ID=14473) in Tennessee faces 6 felony charges after trying to cover up his secret work with the Chinese while applying for a research grant through NASA.

9. [This Professor](https://www.campusreform.org/?ID=14329) in Georgia was fired after it was discovered he tried to cover up money he'd been paid by the Chinese government, while conducting research with the National Institutes of Health.

[Why do 75 American colleges](https://campusreform.org/?ID=14847) have Chinese Communist Party funded ""Confucius Institutes"" on campus?  The Pentagon says they're national security threats and China admits they're propaganda centers.

[A recent investigation](https://campusreform.org/?ID=14700) found **48 colleges broke the law in failing to report tens of millions in donations from China.**

1. If there’s nothing shady, why break the law to hide donations?

2. What does China gain from donating millions to American colleges?

We had almost zero evidence of foreign interference in our elections, and half the country freaked out.  Now, we have endless evidence of foreign interference on our campuses, and no one is batting an eye.

People on campus are afraid to question China's influence efforts for fear of being labeled xenophobic or racist. Colleges are so concerned about being called ""intolerant"" that they let a communist regime exploit our country.

People will call you a conspiracy theorist if you question why China is secretly spending millions on buying off American professors.  Ask those people if they believe China is just doing all this out of the goodness of their hearts.

[Video: How Communist China Infiltrates U.S. Campuses & Steals Research](https://www.youtube.com/watch?v=QqOe_aLBggk)

https://campusreform.org/china/",1590178142.0
831,6537.0,Reddit is an echo chamber of mental illness and delusions,,1634825569.0
832,6531.0,Here are all the reps who voted against increasing the $600 stimulus to $2000. 14 of these reps received 20 million in Civid relief for their businesses.,,1609292029.0
833,6526.0,Current state of reddit. It went from being one or the only places to find the truth to converting to a mass propaganda machine.,,1574518557.0
834,6506.0,TIL that ExxonMobil was sponsoring the Clinton Foundation with up to 5 million dollars a year. ExxonMobil cuts off its sponsorship and Clinton calls for a probe in to the company for allegedly withholding data related to climate change and misleading the people.,,1446818827.0
835,6477.0,"This video is blacklisted on r/videos, if you post this link it will be automatically removed",,1573045862.0
836,6471.0,This is exactly the reason why it matters that everything you’ve been told is a lie.,,1506778697.0
837,6475.0,"This ""NEWS SITE"" is not for the common people",,1611952139.0
838,6478.0,"If you post something that goes against the sheep, it will bring you nothing but insults and humiliations. Decencies are long gone. Evil is good and good is evil. Modernists cannot distinguish between honest respect and sticky insults.",,1593864773.0
839,6471.0,Im speechless,,1632753379.0
840,6462.0,The brainwashed masses treat the same situation (censorship) with different criteria.,,1562278916.0
841,6457.0,Never Forget,,1610794332.0
842,6446.0,"Twitter is actively censoring videos of Joe Biden saying ""you aint black if you don't vote for me"". Seems like Reddit might be doing the same by keeping posts stuck buried in new in more popular subreddits?",,1590199566.0
843,6442.0,"Between July 2016-2017 in the US, 7 people died in school shootings, while 66,972 people died from drug overdoses. If gun manufacturers should be held responsible for the actions of their products, why not opiate manufacturers?","All of these deaths are senseless. All are avoidable. And all were committed by something that is easy to obtain whether it's illegal, banned, or or otherwise. It's just another thing that gets placed on America's ""To Do"" list, and unless it's in the daily news it's forgotten. Maybe if addicts start overdosing 20-30 at a time inside schools, it would get a closer look. It's so easy to cast blame at guns or Trump or race, but the real problem is that people are fed up and shit is boiling over in all kinds of ugly ways. THEY have happily awaited this war WE have created. ",1518729834.0
