,score,title,selftext,created_utc
367,9681.0,This week I was banned from 400+ subreddits in a day. I broke no rules and never even posted in most of them. The two power mods that did this to me have been power-tripping for years and they're the exact type of authoritarian stooges that fit right in with Reddit CEO Ellen Pao's new reddit.,"Last weekend I posted [an article](https://i.imgur.com/0sBNlhT.png) about a possible religious hate incident to /r/europe. An hour later I was banned from /r/europe, /r/HistoryPorn, /r/history, /r/bestof and /r/food by power mod /u/davidreiss666. I was later banned by power mod /u/agentlame from hundreds of subreddits even though I broke no rules in any of them. I asked both of them and the other mods what was going on and [this was the response.](http://imgur.com/a/cRJRk) I was issued global bans from the numerous subreddits that these mods control for having opinions that they personally disliked. They wrongly slandered me as a racist and banned me for saying things outside of the subreddits they mod that they didn't like and this is in keeping with their past tyrannical behavior. [This isn't the first time we've seen this type of mod abuse for having opinions/views that mods don't personally agree with and being labeled a racist for holding them in an effort to eliminate dissent and/or open discussion.](https://imgur.com/a/cQE96) davidreiss666 has been purging and censoring opinions on reddit that don't align with  his Leftist views for as long as he has had power here. He corruptly ran /r/politics before being thrown out and he mods Left wing subreddits like /r/postnationalist, /r/Green, /r/Liberal, /r/labor, and /r/neoprogs (New progressives). Here is his rap sheet as one of reddit's most dictatorial, biased, and corrupt mods.

[In 2012, davidreiss666 was responsible for serious mod drama that led to a near-meltdown in /r/Canada. He was constantly removing posts, spamming the subreddit with Left wing posts with his secret alt account, and banning users who posted views that went against his Left wing positions. The entire subreddit turned on him and eventually managed to push him out of the mod team.](https://imgur.com/a/tKwtX) [He is so bad that he managed to have a reddit admin kick him out of /r/ideasfortheadmins because he was up to no good.](http://i.imgur.com/T0Fy5vw.png)

[He has a history of the same type of behavior in /r/europe as well.](https://imgur.com/a/fKYZV) The last screenshot is from voat.co and was posted by a user this week who noticed what davidreiss666 has been doing in /r/europe and how he is trying to control the subreddit just like he did with /r/Canada before he was thrown out of there. [Here is a link to that post from voat.co for you to read.](https://voat.co/v/MeanwhileOnReddit/comments/98027)

It doesn't stop there. In what was probably his most blatant act of abuse and corruption, in 2013 he used his mod power to censor people exposing his shady moderation of and posting in /r/politics. He caused immense drama and got serious attention on the front page of reddit for trying to get rid of someone who got tons of upvotes for calling him out as a spammer and shill in /r/politics. /r/politics was removed as a default subreddit by the admins because of mods like davidreiss666 running it in a way that allowed him to create what has to be the biggest political echo chamber filled with Left wing bias on the entire internet.

[One,](https://i.imgur.com/j3mYRZp.png) [two,](https://i.imgur.com/OcUioEr.png) [three,](https://i.imgur.com/tFhlu5P.png) [four.](https://imgur.com/a/O4ymS)

[Read the comments in this /r/SubredditDrama thread about this incident to really see what this guy is about.](https://np.reddit.com/r/SubredditDrama/comments/1ckgu1/bestof_links_to_rmurica_comment_calling_out_the/) 

His behavior hits close to home for those of us here at /r/conspiracy as well since [he was the mod responsible for banning links from this subreddit to /r/bestof.](https://i.imgur.com/aE8jT1p.png) He is lying when he says that the other /r/bestof mods ""agreed"" with the banning since it doesn't matter what any other mod thinks because he is the de facto top mod of the subreddit. The mods above him pay no attention to /r/bestof and are inactive.

He happens to be friends with and mods subreddits with agentlame. Both of them were in part responsible for the total meltdown of /r/technology in Summer 2014 that led to the admins temporarily having to remove its default status. [Here is a good look at the way these two moderate together.](https://imgur.com/a/aOMHl)

I posted this today because I have had enough of the wrong turns that reddit has been taking recently with its many biased, authoritarian, and terrible moderators. I felt the need to share this information with all of you just in case you weren't aware of how bad the problem has gotten on this site. Between mods like this and Ellen Pao forcing this site to become [a ""safe space"" instead of a place for the most open and engaged discussion on the web,](http://imgur.com/a/Ib6kT) I felt the need to show those who don't know about two of reddit's most dictatorial mods just how perfect they are for the new reddit under Ellen Pao. 

As for my bannings and the reasons given by these two mods, I reject their view that I am a racist and that I deserve to be banned from every subreddit that they moderate for this accusation. I make no apologies for and do not reject the view that I hold conservative and right of center opinions on certain issues. I reject the notion that the views I hold are inappropriate, that I have no right to participate in discussion in the many subreddits that these mods control due to my views, and I know that the censoring of myself and others for holding these views is the wrong way to run subreddits that are supposed to be places for open and varied discussion. 

I'm not advocating for the right to spam racial and/or other hateful slurs in a subreddit. I'm not demanding the right to yell ""FIRE!"" in a crowded theater or subreddit either. I'm staunchly in favor of the right to hold opinions that cut against the grain and that challenge others to think and to address beliefs that may not be popular or widely-held. I actually believe that the reason why I was banned from hundreds of subreddits is because these two mods were angry that people were giving [positive attention to the views that I hold](https://imgur.com/a/TG1uY) since my views apparently do not align with their own.

If I have to choose between a safe space where my ideas aren't challenged or deemed worthy of sharing, where I have to walk on eggshells not to push the envelop too far, or where I have to think twice about every ""controversial"" view that I hold before posting then you can count me out. I like a reddit where we're all able to post freely without any sort of coercion from mods or admins that makes us alter or sanitize what we say and/or to scare us from saying anything at all that would be deemed inappropriate by biased, authoritarian neckbeards like davidreiss666 and agentlame. If you've read this far, I hope you're in favor of the latter reddit and not the former.

Edit: The top comment in this thread is telling me that /r/subredditcancer is the place for this type of post so I will post this over there as well. 

Edit: I've just been told that /u/davidreiss666 is talking about this post in his backroom private subreddits with his other power mods and his sycophants who are telling him he's not to blame for anything that I've exposed and dug up here. He's such a coward that he won't respond to this post in any public subreddit where people can challenge his poor behavior but he'll act like he's not a piece of garbage in his private subreddits with other authoritarian neckbeards just like him who all tell each other that it's everyone else who is the problem reddit but not them. ",1432485396.0
368,9657.0,The system has been rigged against you from the start,,1592652804.0
369,9663.0,"After Slamming Bitcoin As A Money Laundering Tool, JPMorgan Busted For Money Laundering",,1510922916.0
370,9661.0,"It's really time to wake the fuck up. Hillary Shills and Trump Bots need to get the fuck off this sub. They have taken over like crazy and we are getting more divided than ever. Fuck Trump. Fuck Obama. Fuck the Clintons, and the Bushes.","Is it just me or are there constant people in this sub defending either Trump or Hillary?

It's gotten to the point where this sub is a complete disaster.

Oh, how I miss the good times when we didn't have all these stupid fucking attacks from either side.

I miss the good old times when we didn't defend the FUCKING government and the President of the Goddamn United States.

Wake up Every One. Wake. Up.

Edit: spelling",1488805372.0
371,9645.0,I'm not buying it,,1609351447.0
372,9615.0,"Embroiled QB Colin Kaepernick; ""I mean, we have a presidential candidate [Hillary Clinton] who's deleted emails and done things illegally and is a presidential candidate. That doesn't make sense to me, because if that was any other person, you'd be in prison.""",,1473087387.0
373,9594.0,Happy 4 year anniversary of this shit..,,1603115461.0
